qid,query
1006728,"occipital lobe, visual processing, brain anatomy, vision perception, cerebral cortex, sensory processing, neuroanatomy, visual cortex, eye-brain connection, brain function--occipital lobe, vision processing, brain anatomy, visual perception, lobe functions, sensory processing, neuroanatomy, visual cortex, brain regions, sight and vision--occipital lobe, vision processing, brain anatomy, visual perception, sensory information, cerebral cortex, visual cortex, neuroanatomy, brain function, eye-brain connection--occipital lobe, visual processing, brain anatomy, vision perception, cerebral cortex, sensory information, visual cortex, eye-brain connection, neuroanatomy, brain function--occipital lobe, vision processing, brain anatomy, visual perception, visual cortex, sensory processing, neuroanatomy, brain function, eye-brain connection, visual information processing"
1040198,"Florida Supreme Court, state law authority, judicial review in Florida, Florida legal system, state court decisions, legal precedent in Florida, Florida constitutional law, role of Florida judiciary, state vs federal law in Florida, Florida legal hierarchy.--Florida Supreme Court, state law interpretation, judicial authority in Florida, legal precedent in Florida, Florida judicial system, state court decisions, Florida legal hierarchy, appellate court rulings, state constitutional law, legal jurisdiction in Florida.--Florida Supreme Court, state law interpretation, judicial authority in Florida, Florida legal system, Florida constitutional law, state court decisions, legal precedent in Florida, Florida judicial review, role of Florida Supreme Court, Florida law hierarchy.--Florida Supreme Court, state law interpretation, judicial authority in Florida, legal precedent in Florida, Florida court system, state constitutional law, appellate jurisdiction in Florida, legal hierarchy in Florida, state vs federal law, Florida legal system--Florida Supreme Court, state law interpretation, judicial authority in Florida, legal precedent in Florida, state court decisions, Florida legal system, constitutional law Florida, Florida legal hierarchy, appellate jurisdiction Florida, state versus federal law."
1104300,"bryophyte life cycle, gametophyte dominance, sporophyte generation, bryophyte reproduction, plant life cycles, moss life cycle, liverworts and hornworts, bryophyte characteristics, plant dominance phases, ecological role of bryophytes--bryophyte life cycle, dominant phase in bryophytes, bryophyte reproduction, gametophyte dominance in bryophytes, bryophyte life stages, sporophyte vs gametophyte in bryophytes, bryophyte lifecycle phases, plant life cycle comparison, bryophyte ecology, plant reproductive strategies--bryophyte life cycle, dominant phase in bryophytes, bryophyte reproduction, gametophyte dominance, sporophyte generation in bryophytes, bryophyte life stages, plant life cycle comparison, bryophyte biology, moss life cycle, liverwort reproduction--bryophyte life cycle, dominant stage bryophytes, bryophyte reproduction, gametophyte dominance, sporophyte in bryophytes, bryophyte biology, plant life cycle stages, bryophyte ecology, moss life cycle, liverworts and hornworts--bryophyte life cycle, dominant phase bryophytes, bryophyte reproduction, gametophyte dominance, sporophyte role bryophytes, bryophyte development stages, plant life cycle comparison, bryophyte ecology, moss life cycle, liverwort reproductive strategies"
1104447,"transform boundary, transform fault, lateral fault, plate tectonics, horizontal plate movement, tectonic plates, fault line, geological boundaries, plate interactions, continental drift--transform boundary, transform fault, lateral fault, plate tectonics, plate boundaries, horizontal plate movement, tectonic plates, geological boundaries, Earth science, seismic activity--transform boundary, transform fault, plate tectonics, lateral fault, horizontal plate movement, tectonic plate interaction, geological boundaries, fault lines, continental drift, seismic activity--transform boundary, transform fault, lateral fault, plate tectonics, horizontal plate movement, tectonic plate interaction, boundary types, geological boundaries, earthquake zones, plate boundary dynamics--transform boundary, transform fault, plate tectonics, lateral fault, horizontal plate movement, tectonic plates interaction, geological boundaries, continental drift, seismic activity, earth science"
1107704,"single European currency advantages, benefits of Euro adoption, economic impact of Euro, advantages of a unified currency, Eurozone economic benefits, single currency advantages in Europe, Euro benefits for trade, financial stability of Euro, Eurozone economic integration benefits, impact of Euro on member states--single European currency advantages, benefits of Euro adoption, economic impact of Euro, advantages of a unified currency, Eurozone economic benefits, single currency advantages, Euro benefits for trade, impact of Euro on European economy--single European currency advantages, benefits of Euro adoption, Eurozone economic impact, advantages of a unified currency, impact of Euro on trade, single currency economic benefits, Euro benefits for member states, advantages of currency integration, effects of the Euro on European economy, benefits of a common currency in Europe--single European currency advantages, benefits of Euro adoption, economic impact of Euro, advantages of a unified currency, Eurozone economic benefits, single currency advantages in Europe, benefits of the Euro for member states, economic integration through Euro, monetary union benefits, Euro impact on trade--single European currency advantages, benefits of euro adoption, economic impact of euro, advantages of a unified currency in Europe, eurozone economic benefits, single currency pros and cons, effects of euro on trade, monetary union advantages, euro benefits for member states, financial stability in eurozone"
1107821,"Radio Free Europe history, Radio Free Europe mission, Radio Free Europe impact, Radio Free Europe broadcasts, Radio Free Europe significance, Radio Free Europe funding, Radio Free Europe Cold War, Radio Free Europe current role--Radio Free Europe history, Radio Free Europe mission, Radio Free Europe impact, Radio Free Europe broadcasts, Radio Free Europe significance, Radio Free Europe Cold War, Radio Free Europe funding, Radio Free Europe programming--Radio Free Europe, RFE, Cold War broadcasting, Eastern Europe media, anti-communist radio, US government-funded radio, news and information services, media freedom, historical context of RFE, impact of RFE, propaganda radio, RFE mission and goals.--Radio Free Europe history, Radio Free Europe mission, Radio Free Europe impact, Radio Free Europe broadcasts, Radio Free Europe funding, Cold War propaganda, Eastern Europe media, Radio Free Europe legacy--history of Radio Free Europe, Radio Free Europe mission, Radio Free Europe impact, Radio Free Europe broadcasts, Radio Free Europe significance, Cold War media, Radio Free Europe funding, Radio Free Europe programming"
1109840,"occupational safety, workplace health regulations, labor law, occupational health and safety, OSHA standards, employee safety legislation, industrial safety laws, workplace safety compliance--occupational safety, workplace health regulations, OSHA standards, employee safety laws, industrial health regulations, labor safety legislation, workplace safety compliance, private sector health laws--occupational safety, workplace health regulations, private-sector labor laws, employee safety standards, OSHA regulations, industrial health policies, workplace safety legislation, health and safety compliance--occupational safety, workplace health regulations, labor safety laws, employee health standards, OSHA regulations, industrial safety compliance, workplace safety legislation, health and safety at work, private-sector health laws, employee safety rights--occupational safety, workplace health regulations, labor laws, OSHA standards, employee safety legislation, industrial health policies, workplace safety compliance, private sector health regulations"
1110996,"t tubules function, t tubules purpose, t tubules significance, t tubules mechanism, t tubules in muscle contraction, transverse tubules, t tubules and calcium release, role of t tubules in excitation-contraction coupling, t tubules structure, t tubules in cardiac muscle--t tubules function, t tubules purpose, t tubules significance, t tubules in muscle contraction, t tubules structure, t tubules and calcium release, t tubules in cardiac muscle, t tubules in skeletal muscle, t tubules and action potentials--t tubules function, t tubules significance, t tubules physiology, t tubules and muscle contraction, role of transverse tubules, t tubules in cardiac muscle, t tubules in skeletal muscle, t tubules structure, t tubules and excitation-contraction coupling--t tubules function, t tubules purpose, t tubules significance, role of transverse tubules, t tubules in muscle contraction, t tubules and action potential, t tubules anatomy, t tubules in cardiac muscle, t tubules in skeletal muscle, t tubules and calcium release--t tubules function, t tubules significance, role of transverse tubules, t tubules in muscle contraction, t tubules and calcium signaling, t tubules structure and function, transverse tubules in cardiomyocytes, t tubules in skeletal muscle, t tubules and action potentials, t tubules in excitation-contraction coupling"
1111577,"phrase meaning, idiom definition, jump on the bandwagon explanation, idiomatic expression, bandwagon effect, colloquial phrase, figurative language, popular trends, cultural references, expression usage--phrase meaning, idiom explanation, jump on the bandwagon definition, idiomatic expression, cultural significance, usage examples, related phrases, figurative language, slang interpretation, popular sayings--jump on the bandwagon meaning, idiom definition, phrase explanation, bandwagon effect, common phrases, idiomatic expressions, cultural references, usage examples--idiom definition, phrase meaning, jump on the bandwagon explanation, idiomatic expression, phrase origin, common usage, cultural significance, figurative language, metaphorical meaning, slang interpretation--idiom meaning, phrase definition, jump on the bandwagon explanation, idiomatic expression, bandwagon effect, common phrases, figurative language, cultural references, slang meanings, language usage"
1113361,"censorship, free speech, legal definition, First Amendment, press freedom, government regulation, judicial review, media law, constitutional rights, public interest--censorship, freedom of speech, legal definition, First Amendment, press freedom, judicial review, media regulation, constitutional law, government intervention, public interest--censorship, freedom of speech, First Amendment, legal definition, media law, government regulation, press freedom, judicial review, constitutional rights, speech limitations--censorship, free speech, legal definition, First Amendment, media law, government regulation, judicial review, press freedom, constitutional rights, speech suppression--censorship, freedom of speech, First Amendment, legal definition, media law, press freedom, government regulation, judicial review, constitutional law, speech suppression"
1117243,"nail growth tips, natural remedies for nails, vitamins for nail growth, nail care products, healthy nails diet, nail growth supplements, home remedies for nails, best oils for nail growth, nail strengthening techniques, fast nail growth methods--nail growth tips, natural remedies for nails, vitamins for nail growth, healthy nails, nail care products, biotin for nails, foods for strong nails, nail growth supplements, DIY nail treatments, improve nail health--nail growth tips, nail care products, vitamins for nails, healthy nails diet, nail growth remedies, biotin for nails, natural nail treatments, nail strengthening techniques, nail health supplements, home remedies for nail growth--nail growth tips, natural remedies for nails, vitamins for nail growth, healthy nails diet, nail care products, strengthen nails, fast nail growth, nail health supplements, DIY nail treatments, hydration for nails--nail growth tips, strengthen nails, natural nail growth remedies, vitamins for nails, healthy nails, nail care products, home remedies for nails, biotin for nails, nail growth supplements, improve nail health"
1118716,"Karl Marx, nature of man, human nature, Marxist philosophy, dialectical materialism, social theory, historical materialism, alienation, human essence, capitalism critique, Marx and humanism, economic determinism, class struggle, ideological critique, Marxist anthropology--Karl Marx philosophy, Marxism and human nature, Marx on human essence, Marxist theory of man, Karl Marx views on humanity, nature of man in Marxism, Marx human nature analysis, Marxist perspectives on human beings, dialectical materialism and man, Karl Marx social theory--Karl Marx philosophy, Marxist theory, nature of humanity, human nature according to Marx, Marx on human beings, Marxism and human nature, Karl Marx views, historical materialism, alienation in Marxism, Marxist perspective on man--Karl Marx philosophy, human nature Marx, Marxist theory, Marx on humanity, dialectical materialism, historical materialism, Marx and human nature, Marxist view of man, alienation in Marx, Marxism and ethics--Karl Marx philosophy, Marxism human nature, Marx on humanity, Karl Marx views on man, nature of man in Marxism, Marxist theory of human nature, Karl Marx social theory, Marx human essence, Marx on alienation, historical materialism and human nature"
1121909,"woodwind quintet instruments, woodwind ensemble instruments, woodwind quintet members, instruments in woodwind quintet, woodwind quintet instrumentation, woodwind quintet explained, woodwind quintet overview, types of woodwind instruments, woodwind quintet roles, woodwind quintet arrangement--woodwind quintet instruments, woodwind ensemble instruments, woodwind quintet members, woodwind quintet instrumentation, woodwind quintet components, woodwind quintet parts, instruments in woodwind groups, woodwind quintet description, woodwind instruments list, woodwind quintet performance--woodwind quintet instruments, woodwind ensemble instruments, woodwind quintet members, instruments in woodwind quintet, woodwind quintet instrumentation, woodwind quintet overview, woodwind quintet explained, types of woodwind instruments, woodwind quintet roles, woodwind quintet features--woodwind quintet instruments, woodwind ensemble instruments, woodwind quintet instrumentation, woodwind quintet members, instruments in woodwind quintet, woodwind quintet explained, types of woodwind instruments, woodwind quintet roles, woodwind quintet repertoire, woodwind quintet definition--woodwind quintet instruments, woodwind ensemble instruments, woodwind quintet members, instruments in woodwind quintet, woodwind quintet instrumentation, woodwind quintet lineup, woodwind quintet components, woodwind quintet description"
112700,"scleroderma, esophageal motility, dysphagia, gastroesophageal reflux, gastrointestinal symptoms, connective tissue disease, esophageal peristalsis, swallowing difficulties, esophageal dilation, autoimmune disorders--scleroderma, esophageal motility, gastrointestinal symptoms, dysphagia, reflux, esophageal dilation, connective tissue disease, esophageal stricture, swallowing difficulties, gastrointestinal reflux disease (GERD)--scleroderma, esophageal motility, gastrointestinal symptoms, dysphagia, acid reflux, esophageal peristalsis, CREST syndrome complications, connective tissue disease, esophageal manometry, GERD--scleroderma, esophageal motility, gastroesophageal reflux, dysphagia, esophageal manometry, connective tissue disease, gastrointestinal symptoms, CREST syndrome complications, esophageal peristalsis, dysmotility--scleroderma, esophageal motility, gastrointestinal symptoms, dysphagia, reflux disease, connective tissue disease, esophageal peristalsis, swallowing difficulties, esophageal stricture, CREST syndrome complications"
1128632,"levothyroxine weight effects, levothyroxine weight loss, levothyroxine weight gain, levothyroxine thyroid medication, levothyroxine side effects, hypothyroidism and weight changes, thyroid hormone and metabolism, levothyroxine dosage impact on weight, weight management with levothyroxine, levothyroxine and appetite changes--levothyroxine weight effects, levothyroxine weight loss, levothyroxine weight gain, thyroid medication and weight, levothyroxine side effects, hypothyroidism and weight changes, thyroid hormone and metabolism, levothyroxine dosage and weight, thyroid treatment weight management, levothyroxine and appetite changes--levothyroxine weight loss, levothyroxine weight gain, levothyroxine side effects, thyroid medication weight effects, hypothyroidism and weight changes, levothyroxine dosage and weight, thyroid hormone and metabolism, levothyroxine reviews, weight management with levothyroxine, thyroid function and weight--levothyroxine weight effects, levothyroxine weight loss, levothyroxine weight gain, thyroid medication weight changes, hypothyroidism and weight, levothyroxine side effects, thyroid hormone and metabolism, levothyroxine dosage and weight, endocrine system and weight management, levothyroxine and appetite changes--levothyroxine weight effects, levothyroxine weight loss, levothyroxine weight gain, thyroid medication weight changes, levothyroxine side effects weight, hypothyroidism and weight, thyroid hormone and metabolism, levothyroxine dosage and weight, thyroid treatment weight impact, levothyroxine and body weight"
1129560,"capital improvements, property enhancements, asset upgrades, building renovations, real estate improvements, accounting treatment for renovations, depreciation of building improvements, financial reporting for property enhancements--capital improvements, property enhancements, asset upgrades, real estate renovations, accounting treatment of building upgrades, depreciation of building improvements, financial reporting of property enhancements--building enhancements, capital improvements, property upgrades, asset enhancements, renovation accounting, real estate improvements, facility upgrades, value-add renovations--capital improvements, property enhancements, building upgrades, asset valuation, real estate improvements, depreciation of improvements, renovation costs, fixed asset accounting--real estate enhancements, property upgrades, capital improvements, asset valuation, depreciation of building improvements, construction modifications, accounting treatment for renovations, financial reporting of property improvements"
168329,"photosynthesis rates, light intensity effects, carbon dioxide concentration, plant growth factors, photosynthetic efficiency, environmental influences on photosynthesis, light and CO2 interaction, photosynthesis research, botanical studies, plant physiology--photosynthesis rates, light intensity effects, carbon dioxide concentration, photosynthesis variables, environmental factors in photosynthesis, light and CO2 interaction, plant growth factors, photosynthetic efficiency, chlorophyll absorption, greenhouse gas effects on plants--photosynthesis rate, light intensity effects, carbon dioxide concentration, photosynthesis factors, light and CO2 impact, plant growth conditions, environmental influences on photosynthesis, photosynthetic efficiency, light availability, CO2 levels and plant health--photosynthesis rate, light intensity effects, carbon dioxide concentration, photosynthesis variables, environmental factors, plant growth, light conditions, CO2 effects on photosynthesis, photosynthetic efficiency, plant biology research--photosynthesis rate, light intensity effects, carbon dioxide concentration, plant growth factors, photosynthesis variables, environmental influences on photosynthesis, light and CO2 interaction, photosynthetic efficiency, botanical studies, greenhouse gas impact on plants"
190623,"David W. Taylor, accomplishments, contributions, biography, achievements, naval research, scientific contributions, impact on naval engineering, historical significance, innovations, career highlights--David W. Taylor biography, David W. Taylor contributions, David W. Taylor achievements, David W. Taylor significance, David W. Taylor legacy, David W. Taylor research, David W. Taylor impact, David W. Taylor history, David W. Taylor awards, David W. Taylor influence--David W. Taylor biography, David W. Taylor achievements, David W. Taylor contributions, David W. Taylor significance, David W. Taylor legacy, David W. Taylor career highlights, David W. Taylor research, David W. Taylor awards, David W. Taylor influence, David W. Taylor history--David W. Taylor biography, David W. Taylor achievements, David W. Taylor contributions, David W. Taylor legacy, David W. Taylor significance, David W. Taylor career highlights, David W. Taylor research, David W. Taylor influence, David W. Taylor awards, David W. Taylor impact on industry--David W. Taylor, naval research, contributions, achievements, biography, notable works, legacy, military innovations, oceanography, research institute, historical significance, awards, publications, leadership, influence"
2082,"bone density loss, age-related bone loss, osteoporosis onset age, bone mass decline, adult bone health, factors affecting bone density, prevention of bone loss, signs of osteoporosis, maintaining bone strength, age and bone health--bone density loss, age-related bone loss, osteoporosis onset age, adult bone health, factors affecting bone mass, prevention of bone loss, signs of bone density decline, maintaining bone strength, age and bone health, lifestyle effects on bone density--bone density loss, age-related bone loss, osteoporosis onset age, adult bone mass decline, factors affecting bone health, preventive measures for bone loss, maintaining bone density, aging and bone health, signs of bone loss, nutrition for bone strength--bone density loss, age-related bone loss, osteoporosis onset age, adult bone mass decline, factors affecting bone mass, prevention of bone loss, maintaining bone health, signs of bone density loss, lifestyle impacts on bone health, age and bone strength--bone density loss, age-related bone loss, osteoporosis onset age, adult bone health, factors affecting bone mass, prevention of bone loss, maintaining bone density, age and bone strength, lifestyle impacts on bone health, calcium and bone mass"
226975,"Medicaid application process, newborn Medicaid eligibility, post-birth Medicaid enrollment, infant health insurance options, Medicaid for newborns, applying for Medicaid after delivery, Medicaid coverage for infants, healthcare for newborns, Medicaid benefits for babies, enrolling baby in Medicaid.--Medicaid application process, newborn Medicaid enrollment, Medicaid eligibility for infants, applying for Medicaid after birth, Medicaid for newborns, post-birth Medicaid registration, health insurance for babies, Medicaid for children, infant health coverage, newborn health insurance options.--Medicaid application process, newborn Medicaid enrollment, Medicaid eligibility for infants, applying for Medicaid after birth, Medicaid for newborns, health insurance for babies, postnatal Medicaid application, Medicaid coverage for infants, infant health insurance options, enrolling baby in Medicaid.--Medicaid application process, newborn Medicaid enrollment, baby Medicaid eligibility, Medicaid for infants, applying for Medicaid after birth, postpartum Medicaid application, health coverage for newborns, Medicaid benefits for children--Medicaid application process, newborn Medicaid enrollment, Medicaid eligibility for infants, applying for Medicaid for newborns, Medicaid after birth, infant health insurance options, post-birth Medicaid application, Medicaid coverage for newborns, enrolling baby in Medicaid, Medicaid benefits for infants."
23287,"landlord liability, tenant safety, premises liability, break-in injuries, landlord responsibilities, tenant rights, security measures, injury claims, rental property safety, criminal activity liability--landlord liability, tenant safety, premises liability, break-in incidents, tenant rights, landlord responsibilities, injury claims, security measures, legal obligations, property management--landlord liability, tenant injury, break-in liability, premises liability, landlord responsibilities, tenant safety, legal obligations of landlords, security measures, tenant rights, injury claims against landlords--landlord liability, tenant safety, premises liability, break-in injury, landlord responsibility, tenant rights, security measures, negligence claims, property management liability, legal obligations of landlords--landlord liability, tenant safety, premises liability, break-in injuries, landlord responsibilities, tenant rights, security measures, property owner obligations, injury claims, criminal activity liability"
