qid,query
237669,"Oil Pollution Act, 1990, impact on oil companies, environmental regulations, oil spill liability, corporate compliance, oil industry response, legislative effects, pollution control measures, oil spill prevention, environmental policy, economic impact on oil companies, regulatory challenges.--Oil Pollution Act, 1990, impact on oil companies, environmental regulations, oil spill prevention, compliance requirements, industry response, economic effects, legislative impact, liability provisions, pollution control measures--Oil Pollution Act, 1990, impact on oil companies, environmental regulations, oil spill prevention, compliance requirements, liability for oil spills, industry response, legislative changes, oil industry regulations, environmental impact assessments--Oil Pollution Act, 1990 amendments, oil companies compliance, environmental regulations, oil spill response, corporate responsibility, legal implications, environmental impact, regulatory framework, oil industry accountability--Oil Pollution Act 1990, impact on oil companies, environmental regulations, oil spill liability, compliance requirements, corporate responsibility, oil industry response, pollution prevention measures, legal implications for oil companies, economic effects of oil regulations."
253263,"sprained wrist recovery time, wrist sprain healing duration, healing time for wrist sprain, sprained wrist recovery period, wrist injury healing timeline, sprained wrist rehabilitation, factors affecting wrist sprain healing--sprained wrist recovery time, wrist sprain healing duration, sprained wrist healing process, wrist injury recovery timeline, sprained wrist treatment duration, healing time for wrist sprain, sprained wrist rehabilitation period--sprained wrist recovery time, healing duration for wrist sprain, wrist sprain healing process, sprained wrist treatment timeline, recovery period for wrist injury, wrist sprain rehabilitation, factors affecting wrist sprain healing, symptoms of wrist sprain healing--sprained wrist recovery time, wrist sprain healing duration, sprained wrist healing process, recovery time for wrist injuries, sprained wrist treatment timeline, wrist sprain rehabilitation, healing time for wrist sprains--sprained wrist recovery time, wrist injury healing duration, sprained wrist healing process, time to heal wrist sprain, wrist sprain recovery timeline, factors affecting wrist sprain healing, sprained wrist rehabilitation period"
300025,"whale bycatch statistics, California fishing nets impact, marine mammal entanglement, fishing practices and whale conservation, whale population decline, fishing net regulations California, bycatch reduction strategies, ocean wildlife protection, fishing industry and marine life, cetacean conservation efforts--whale bycatch statistics, California fishing net entanglement, marine mammal conservation, fishing industry impact on whales, whale population decline, fishing regulations California, bycatch mitigation strategies, marine wildlife protection laws, entanglement prevention measures, whale rescue efforts California--whale bycatch statistics, California fishing nets impact, marine mammal entanglement data, fishing industry whale interactions, cetacean conservation California, fishing net mortality rates, whale conservation efforts California, marine wildlife protection regulations--whale bycatch statistics, California fishing nets whale entanglement, marine mammal conservation California, fishing impact on whales, whale rescue efforts California, fishing regulations California whales, bycatch reduction strategies, marine wildlife protection California--whale bycatch statistics, California fishing nets whale entanglement, marine mammal conservation California, fishing industry impact on whales, whale population decline California, fishing regulations California whales, bycatch mitigation strategies, whale rescue efforts California"
300986,"money laundering penalties, jail time for money laundering, sentencing for money laundering, legal consequences of money laundering, money laundering prison sentence, financial crime sentencing, federal sentencing guidelines money laundering--money laundering penalties, jail time for money laundering, sentencing for money laundering, legal consequences of money laundering, money laundering laws, prison sentence for money laundering, financial crime sentencing, federal money laundering charges, state laws on money laundering, consequences of money laundering offenses--money laundering penalties, jail time for money laundering, sentencing for money laundering, legal consequences of money laundering, money laundering prison sentence, financial crime sentencing, penalties for financial crimes, money laundering laws, criminal charges for money laundering, consequences of money laundering--money laundering penalties, jail time for money laundering, legal consequences of money laundering, sentencing for money laundering, money laundering laws, criminal charges money laundering, financial crime sentencing, prison sentence money laundering, money laundering convictions, penalties for financial crimes--money laundering penalties, jail time for money laundering, sentencing for money laundering, legal consequences of money laundering, money laundering charges, prison sentence money laundering, financial crime penalties, state laws money laundering, federal money laundering laws, sentencing guidelines money laundering"
30611,"average age of first marriage for men, median age of men at marriage, trends in male marriage age, demographic data on marriage age for men, historical average age of marriage for men, marriage age statistics by country, factors affecting marriage age for men--average marriage age for men, typical age of men at marriage, men marriage age statistics, average age of first marriage for men, median age of men at marriage, trends in men's marriage age, historical marriage age for men, demographic data on men's marriage age--average age of first marriage for men, typical age men marry, men's marriage age statistics, marriage age trends for men, average marriage age by country, demographic data on men's marriage age, historical marriage age for men--average age of men at marriage by country, average age of first marriage for men, trends in marriage age for men, demographic statistics on marriage age, historical average age of marriage for men, marriage age comparison men and women, factors influencing marriage age for men--average age of marriage for men, typical age of grooms, marriage age statistics for men, men marriage age trends, average groom age by year, demographic marriage age data, male marriage age analysis"
337656,"Joseph Merrick, Elephant Man, age at death, birth date, death date, historical figures, medical conditions, Victorian era, biography, life story--Joseph Merrick, Elephant Man age, Elephant Man death, Joseph Merrick death age, Elephant Man biography, Elephant Man life span, Joseph Merrick facts, Elephant Man historical details, age at death of Joseph Merrick, Elephant Man legacy--Joseph Merrick, Elephant Man age at death, Joseph Merrick death age, Elephant Man biography, Joseph Merrick life span, Elephant Man historical facts, Joseph Merrick age, Elephant Man medical condition--Joseph Merrick, Elephant Man age at death, Elephant Man biography, Joseph Merrick death date, Elephant Man life story, historical figures, Victorian era, medical conditions, rare diseases, 19th century history--Joseph Merrick, Elephant Man, age at death, biography, historical figures, medical conditions, Victorian era, life story, death date, personal history"
364210,"finger injury treatment, jammed finger remedies, finger pain relief, first aid for jammed finger, how to treat a sprained finger, jammed finger exercises, finger swelling reduction, home remedies for finger injuries--finger injury treatment, jammed finger relief, finger sprain care, first aid for jammed finger, finger pain management, home remedies for finger injuries, finger rehabilitation exercises, swelling reduction for fingers--finger injury treatment, jammed finger remedies, finger pain relief, treating a jammed finger, finger sprain care, home remedies for finger injuries, finger rehabilitation exercises, first aid for jammed fingers--jammed finger treatment, finger injury relief, home remedies for finger pain, sprained finger care, finger dislocation first aid, swelling reduction for fingers, finger injury rehabilitation, sports injuries finger care, finger joint pain relief--jammed finger treatment, finger injury relief, sprained finger care, finger pain management, home remedies for finger injuries, first aid for jammed fingers, finger swelling reduction, rehabilitation for finger injuries"
395948,"Howard Gardner biography, Howard Gardner contributions, Howard Gardner theories, Howard Gardner multiple intelligences, Howard Gardner education, Howard Gardner books, Howard Gardner research, Howard Gardner career, Howard Gardner influence, Howard Gardner interviews--Howard Gardner biography, Howard Gardner contributions, Howard Gardner theories, Howard Gardner multiple intelligences, Howard Gardner education, Howard Gardner books, Howard Gardner research, Howard Gardner background, Howard Gardner achievements, Howard Gardner influence--Howard Gardner biography, Howard Gardner contributions, Howard Gardner theories, Howard Gardner multiple intelligences, Howard Gardner education background, Howard Gardner publications, Howard Gardner interviews, Howard Gardner influence in psychology, Howard Gardner research areas, Howard Gardner current projects--Howard Gardner biography, Howard Gardner contributions, Howard Gardner theories, Howard Gardner multiple intelligences, Howard Gardner education, Howard Gardner books, Howard Gardner research, Howard Gardner career, Howard Gardner achievements, Howard Gardner influence--Howard Gardner biography, Howard Gardner theories, Howard Gardner multiple intelligences, Howard Gardner contributions, Howard Gardner education, Howard Gardner research, Howard Gardner books, Howard Gardner career, Howard Gardner interviews, Howard Gardner influence"
421946,"pulse oximetry legislation for children, pediatric pulse ox screening laws, child health screening regulations, pulse oximeter use in pediatrics, legal requirements for pulse oximetry in children, pediatric healthcare laws, screening guidelines for children, pulse oximetry policy for minors--pulse oximetry legislation, pediatric pulse oximetry laws, child health screening regulations, pulse ox screening requirements, state laws on pulse oximetry, pediatric health law, newborn screening laws, pulse oximeter usage in children, healthcare policy for pulse oximetry, legal requirements for pulse ox screening--pulse oximetry legislation, pediatric pulse ox screening requirements, child health law pulse oximetry, pulse oximeter screening regulations, pediatric healthcare laws, newborn screening laws, pulse oximetry guidelines for children, child health screening policies--pulse oximetry legislation for children, pediatric pulse ox screening requirements, laws on pulse oximetry in pediatrics, pulse oximeter screening regulations, pediatric health screening laws, pulse oximetry policy for children, legal requirements for pulse ox in children--pulse oximetry screening laws for children, pediatric pulse ox legislation, child health screening regulations, pulse oximeter requirements for minors, pediatric health law pulse oximetry, state laws pulse oximetry screening children, newborn screening laws pulse oximetry"
493490,"schizandra berry health benefits, schizandra berry uses, schizandra berry side effects, schizandra berry nutrition, schizandra berry extract benefits, schizandra berry dosage, schizandra berry for stress, schizandra berry and liver health, schizandra berry antioxidants, schizandra berry traditional medicine--schizandra berry health benefits, schizandra berry uses, schizandra berry nutrition, schizandra berry extract advantages, schizandra berry medicinal properties, schizandra berry side effects, schizandra berry dosage, schizandra berry recipes, adaptogenic herbs, traditional Chinese medicine herbs--schizandra berry health benefits, schizandra berry uses, schizandra berry properties, schizandra berry nutrition, schizandra berry side effects, schizandra berry supplements, schizandra berry extract benefits, schizandra berry for stress, schizandra berry antioxidant properties, schizandra berry traditional uses--schizandra berry health benefits, schizandra berry uses, schizandra berry nutrition, schizandra berry side effects, schizandra berry for stress, schizandra berry antioxidant properties, schizandra berry dosage, schizandra berry extracts, schizandra berry traditional medicine, schizandra berry recipes--schizandra berry health benefits, schizandra berry uses, schizandra berry properties, benefits of schizandra, schizandra berry nutrition, schizandra berry extract advantages, schizandra for stress relief, schizandra berry antioxidants, traditional uses of schizandra, schizandra berry side effects"
505390,"supartz injections ingredients, supartz composition, supartz injection components, supartz active ingredients, supartz formulation, supartz gel composition, supartz injection materials--supartz injections ingredients, supartz composition, supartz injection components, supartz active ingredients, supartz formulation, supartz hyaluronic acid content, supartz injection materials, supartz injection efficacy--supartz injections ingredients, supartz composition, supartz injection components, supartz hyaluronic acid, supartz formulation, supartz active ingredients, supartz injection properties--supartz injections ingredients, supartz composition, supartz injection components, supartz active ingredients, supartz formulation, supartz injection materials, supartz hyaluronic acid content, supartz injection properties, supartz injection uses--supartz injection ingredients, supartz composition, supartz injection components, supartz active ingredients, supartz formulation, supartz injection materials, supartz hyaluronic acid content"
508292,"neuroma pain symptoms, signs of neuroma, neuroma pain characteristics, neuroma discomfort symptoms, neuroma pain indicators, symptoms of nerve tumors, neuroma-related pain signs, peripheral nerve neuroma symptoms--neuroma pain symptoms, signs of neuroma, neuroma discomfort, neuroma pain indicators, neuroma pain characteristics, symptoms of nerve tumor, neuroma pain description, peripheral nerve pain symptoms--neuroma pain symptoms, signs of neuroma, neuroma discomfort, nerve pain symptoms, foot neuroma symptoms, Morton’s neuroma signs, pain associated with neuroma, neuroma pain indicators, neuroma pain characteristics, treatment for neuroma pain--neuroma pain symptoms, signs of neuroma, neuroma discomfort, nerve pain symptoms, neuroma diagnosis, foot neuroma symptoms, Morton’s neuroma pain, peripheral nerve pain, neuroma treatment options, neuroma pain relief--neuroma pain symptoms, signs of neuroma, neuroma discomfort, neuroma pain indicators, neuroma pain characteristics, neuroma-related pain symptoms, symptoms of nerve tumor pain, neuroma pain experiences, peripheral neuroma symptoms, neuroma pain description"
540006,"Nietzsche's philosophy, Nietzsche and religion, Nietzsche's beliefs, atheism in Nietzsche, Nietzsche's view on God, existentialism and Nietzsche, Nietzsche's writings, Nietzsche's influence on atheism, critiques of Nietzsche, Nietzschean thought.--Nietzsche's philosophy, Nietzsche and religion, atheism in Nietzsche's work, Nietzsche's views on God, existentialism and Nietzsche, Nietzsche's critique of Christianity, Nietzsche's beliefs, Nietzschean atheism, morality in Nietzsche's philosophy, the death of God in Nietzsche.--Nietzsche's philosophy, Nietzsche and religion, atheism in Nietzsche's work, Nietzsche's views on God, existentialism and Nietzsche, Nietzsche's critique of Christianity, Nietzsche's writings on faith, Nietzschean atheism, Nietzsche and morality, Nietzsche's influence on atheism.--Nietzsche's philosophy, Nietzsche and religion, Nietzsche atheism, Nietzsche beliefs, Friedrich Nietzsche quotes, Nietzsche on God, Nietzsche and morality, existentialism and Nietzsche, Nietzsche's impact on atheism, Nietzsche's writings.--Nietzsche's philosophy, Nietzsche and religion, atheism in philosophy, Nietzsche's beliefs, existentialism and Nietzsche, Nietzsche's view on God, Nietzsche quotes on faith, Nietzsche's writings on religion, critique of religion by Nietzsche, Nietzsche's influence on atheism."
596569,"veterinary school prerequisites, vet school required courses, veterinary medicine curriculum, classes for veterinary admission, pre-veterinary coursework, veterinary school eligibility requirements, vet school academic requirements, essential classes for vet school--vet school prerequisites, veterinary school requirements, classes for veterinary medicine, veterinary program courses, vet school curriculum, essential classes for vets, veterinary education requirements, undergraduate courses for vet school, vet school admissions criteria, veterinary science classes--vet school prerequisites, veterinary medicine courses, required classes for vet school, veterinary education requirements, vet school admission criteria, pre-veterinary coursework, veterinary school curriculum, classes for aspiring veterinarians, veterinary science degree requirements, essential courses for vet school--vet school prerequisites, veterinary school requirements, classes for veterinary medicine, veterinary program coursework, vet school admission classes, veterinary education requirements, pre-vet courses, veterinary science curriculum--veterinary school prerequisites, vet school coursework, required classes for veterinary medicine, veterinary program admission requirements, vet school degree requirements, veterinary science classes, pre-veterinary education, vet school application courses, academic requirements for vet school"
629937,"popped blood vessel symptoms, hand blood vessel rupture, blood vessel injury sensations, signs of blood vessel damage, hand bruising and pain, vascular health concerns, blood vessel swelling, hand injury symptoms, vascular rupture effects, blood vessel inflammation--popped blood vessel symptoms, blood vessel rupture hand, hand bruising sensation, blood vessel injury signs, hand vascular issues, subcutaneous hemorrhage, blood vessel damage feel, hand swelling after injury--popped blood vessel symptoms, blood vessel rupture hand, hand bruising sensations, blood vessel injury signs, vascular trauma hand, hand pain after injury, subcutaneous hemorrhage hand, blood vessel swelling hand, hand injury recovery, signs of blood vessel damage--popped blood vessel symptoms, blood vessel rupture hand, hand bruising sensation, blood vessel injury signs, hand vascular health, subcutaneous hemorrhage, hand pain after injury, blood vessel swelling in hand--popped blood vessel symptoms, blood vessel rupture sensations, hand bruising, vascular injury signs, blood vessel damage, hand pain after rupture, subcutaneous bleeding, localized swelling, discoloration in hand, hand injury recovery"
646091,"prenatal care services, prenatal check-ups, prenatal health assessments, prenatal nutrition guidance, prenatal screenings, prenatal education classes, prenatal testing options, comprehensive prenatal care, benefits of prenatal care, prenatal care timeline--prenatal care services, prenatal check-ups, prenatal nutrition, prenatal testing, prenatal vitamins, prenatal appointments, maternity care, pregnancy health care, expectant mother care, prenatal education--prenatal care services, prenatal checkups, prenatal education, prenatal screenings, prenatal vitamins, prenatal health tips, pregnancy care, maternal health care, obstetric care, prenatal appointments--prenatal care services, prenatal check-ups, prenatal health benefits, prenatal visit schedule, prenatal screenings, prenatal education, prenatal nutrition, prenatal tests, prenatal care guidelines, comprehensive prenatal care--prenatal care services, prenatal check-ups, prenatal health screenings, prenatal vitamins, prenatal education, prenatal nutrition, prenatal tests, prenatal appointments, maternal health care, pregnancy care guidelines"
647362,"s/p definition, s/p medical abbreviation, s/p meaning in healthcare, s/p medical terminology, post-operative meaning, s/p in medical context, s/p explanation, s/p significance in medicine--s/p meaning, s/p medical definition, s/p abbreviation in medicine, s/p term explanation, s/p in healthcare, s/p medical terminology, s/p meaning in medical context--s/p meaning in medical terms, s/p definition in healthcare, s/p medical abbreviation, s/p medical terminology, s/p meaning in medicine, s/p post-operative, s/p patient status, s/p surgical procedure meaning--s/p definition, s/p medical terminology, s/p meaning in medicine, s/p abbreviation, s/p in healthcare, s/p meaning, s/p medical context, s/p surgical history, s/p patient status, s/p explanation--s/p meaning, s/p medical definition, s/p abbreviation in medicine, s/p terminology, s/p in healthcare, s/p interpretation, s/p medical context"
661905,"asthma-friendly foods, foods to avoid with asthma, asthma diet restrictions, triggers for asthma, inflammatory foods, food allergies and asthma, asthma management diet, best foods for asthma sufferers, nutrition for asthma, asthma and diet connection--asthma triggers, foods to avoid with asthma, asthma-friendly diet, inflammatory foods, allergens in food, asthma management diet, respiratory health foods, dietary restrictions for asthma, food sensitivities and asthma, asthma and nutrition--asthma triggers, foods to avoid with asthma, diet for asthma management, asthma-friendly foods, inflammatory foods, allergens in food, asthma diet recommendations, foods that worsen asthma, nutrition for asthma sufferers, dietary restrictions for asthma--asthma triggers, foods to avoid with asthma, asthma diet restrictions, inflammatory foods, allergens in food, asthma-friendly foods, dietary recommendations for asthma, food sensitivities and asthma, nutritional advice for asthma, asthma management through diet--asthma triggers, foods to avoid, asthma diet, inflammatory foods, allergens in food, asthma-friendly foods, respiratory health, food sensitivities, dietary restrictions for asthma, asthma management through diet"
681645,"divorce bench trial definition, divorce bench trial explained, divorce court procedures, bench trial vs jury trial, divorce legal process, family law bench trial, divorce trial outcomes, divorce litigation process, understanding bench trials in divorce, divorce court hearings--divorce bench trial definition, divorce trial process, bench trial vs jury trial in divorce, divorce court procedures, divorce litigation types, understanding bench trials in family law, divorce trial outcomes, legal representation in divorce trials--divorce bench trial definition, divorce bench trial process, divorce bench trial vs jury trial, divorce bench trial advantages, divorce bench trial outcomes, divorce bench trial procedures, understanding divorce bench trials, divorce litigation types, family court bench trial, divorce trial explained--divorce bench trial definition, divorce bench trial process, divorce bench trial vs jury trial, benefits of divorce bench trial, divorce bench trial outcomes, divorce bench trial procedures, divorce bench trial advantages, understanding divorce bench trials--divorce bench trial definition, divorce bench trial process, divorce bench trial advantages, divorce bench trial vs jury trial, divorce bench trial outcomes, divorce bench trial procedures, divorce bench trial explanation, divorce bench trial legal terms"
688007,"kanima definition, kanima meaning, kanima characteristics, kanima mythology, kanima origins, kanima in folklore, kanima symbolism, kanima in popular culture--kanima definition, kanima meaning, kanima mythology, kanima characteristics, kanima origins, kanima in popular culture, kanima symbolism, kanima in folklore--kanima definition, kanima meaning, kanima explained, kanima characteristics, kanima origins, kanima mythology, kanima in popular culture, kanima symbolism, kanima vs werewolf, kanima traits--kanima definition, kanima meaning, kanima characteristics, kanima mythology, kanima origins, kanima in folklore, kanima transformation, kanima symbolism--kanima definition, kanima meaning, kanima explanation, kanima characteristics, kanima origin, kanima mythology, kanima symbolism, kanima in popular culture, kanima examples, kanima traits"
707882,"acumen fuse features, acumen fuse benefits, acumen fuse pricing, acumen fuse reviews, acumen fuse use cases, acumen fuse integration, acumen fuse tutorial, acumen fuse comparison, acumen fuse support, acumen fuse documentation--Acumen Fuse overview, Acumen Fuse features, Acumen Fuse benefits, Acumen Fuse pricing, Acumen Fuse reviews, Acumen Fuse tutorial, Acumen Fuse comparison, Acumen Fuse use cases, Acumen Fuse integration, Acumen Fuse support.--acumen fuse overview, acumen fuse features, acumen fuse benefits, acumen fuse pricing, acumen fuse reviews, acumen fuse use cases, acumen fuse integration, acumen fuse tutorials, acumen fuse comparison, acumen fuse support--Acumen Fuse overview, Acumen Fuse features, Acumen Fuse benefits, Acumen Fuse tutorial, Acumen Fuse use cases, Acumen Fuse pricing, Acumen Fuse reviews, Acumen Fuse comparison, Acumen Fuse integrations--Acumen Fuse overview, Acumen Fuse features, Acumen Fuse benefits, Acumen Fuse pricing, Acumen Fuse reviews, Acumen Fuse tutorial, Acumen Fuse use cases, Acumen Fuse comparison, Acumen Fuse integration"
