qid,query
764738,"lean body mass, body composition analysis, body fat percentage, muscle mass, body weight metrics, fitness measurement, health and fitness, body composition methods--lean body mass, body composition analysis, body fat percentage, muscle mass, fitness metrics, health assessment, body composition measurement, LBM definition, weight management, body composition techniques--lean body mass, body composition analysis, body fat percentage, muscle mass, fitness metrics, health assessment, body composition measurement, LBM definition, weight management, physical fitness--lean body mass, body composition analysis, body fat percentage, muscle mass, body weight measurement, fitness assessment, health metrics, body composition methods, weight management, physical fitness--lean body mass, body composition analysis, fat-free mass, muscle mass, body fat percentage, LBM definition, body composition measurement, health and fitness, weight management, body metrics"
806694,"sonographer salary Massachusetts, average sonographer pay Massachusetts, sonographer compensation Massachusetts, sonographer wage Massachusetts, Massachusetts sonographer earnings, sonography salary trends Massachusetts, sonographer hourly rate Massachusetts--average sonographer salary Massachusetts, sonographer pay scale MA, sonographer wages Massachusetts, Massachusetts sonographer compensation, sonographer income Massachusetts, sonography salary trends MA, average earnings sonographer Massachusetts, sonographer hourly rate MA--average salary sonographer Massachusetts, sonographer pay rates Massachusetts, sonographer compensation Massachusetts, sonography salary Massachusetts, Massachusetts sonographer earnings, sonographer income Massachusetts, average sonographer wages Massachusetts--average salary sonographer Massachusetts, sonographer pay rates Massachusetts, sonographer compensation Massachusetts, sonographer salary range Massachusetts, sonography wage Massachusetts, sonographer earnings Massachusetts, average income sonographer Massachusetts, sonography job market Massachusetts--average salary sonographer Massachusetts, sonographer pay rates Massachusetts, sonographer compensation Massachusetts, sonographer earnings Massachusetts, sonographer income Massachusetts, Massachusetts sonographer salary guide, sonographer wage trends Massachusetts"
818583,"Range Rover vs Range Rover Sport, Range Rover comparison, Range Rover Sport features, Range Rover specifications, Range Rover vs Range Rover Sport differences, Land Rover models comparison, Range Rover trim levels, Range Rover Sport performance, Range Rover design differences, Land Rover SUV comparison--Range Rover vs Range Rover Sport, Range Rover comparison, Range Rover Sport features, Range Rover specifications, Range Rover Sport review, Range Rover differences, luxury SUV comparison, Range Rover models, Range Rover performance, Range Rover interior, Range Rover Sport dimensions, Range Rover Sport advantages, Range Rover technology features.--Range Rover vs Range Rover Sport, Range Rover comparison, Range Rover Sport features, Range Rover specifications, Range Rover Sport specifications, differences between Range Rover models, Range Rover vs Range Rover Sport review, Range Rover Sport advantages, Range Rover design differences, Range Rover performance comparison--Range Rover vs Range Rover Sport, Range Rover comparison, Range Rover Sport features, Range Rover specifications, Range Rover models, luxury SUV differences, Range Rover trim levels, Range Rover performance, Range Rover interior, Range Rover Sport reviews--Range Rover vs Range Rover Sport, Range Rover comparison, Range Rover features, Range Rover Sport features, Range Rover specifications, Range Rover Sport specifications, luxury SUV comparison, Range Rover models, Range Rover Sport models, off-road capabilities Range Rover, interior differences Range Rover, performance Range Rover Sport."
832573,"methylmalonic acid test, MMA test, methylmalonic acidemia, metabolic testing, organic acid test, vitamin B12 deficiency, laboratory test for methylmalonic acid, diagnostic testing for MMA, methylmalonate levels, biochemical testing--methylmalonic acid test, MMA test, methylmalonic acidemia, methylmalonate levels, metabolic disorder testing, organic acid test, vitamin B12 deficiency test, laboratory testing for MMA, diagnostic tests for methylmalonic acid--methylmalonic acid test, MMA test, methylmalonic acid levels, methylmalonic aciduria, metabolic disorders, vitamin B12 deficiency, organic acidemia, laboratory test for MMA, interpreting methylmalonic acid results, clinical significance of MMA test--methylmalonic acid test, MMA test, methylmalonic aciduria, vitamin B12 deficiency, metabolic disorders, lab test for methylmalonic acid, diagnostic tests for MMA, methylmalonic acid levels, interpretation of MMA test results, clinical significance of methylmalonic acid--methylmalonic acid test, MMA test, methylmalonic aciduria, vitamin B12 deficiency, metabolic disorder testing, organic acid test, laboratory test for methylmalonic acid, diagnostic testing for MMA, methylmalonic acid levels, biochemical tests for methylmalonic acid"
835760,"trigone of the bladder, bladder trigone, triangular bladder region, bladder anatomy, urinary bladder base, bladder structure, vesical trigone, anatomical features of the bladder--bladder trigone, trigonal region, bladder base anatomy, urinary bladder triangle, vesical trigone, bladder floor structure, anatomy of bladder trigone, trigone of bladder--trigone of the bladder, bladder trigone, triangular bladder region, bladder anatomy, urinary bladder base, bladder structure, trigonal area, bladder floor anatomy--trigone of the bladder, bladder trigone, triangular bladder region, bladder anatomy, urinary bladder structure, vesical trigone, bladder base anatomy, trigonal area of bladder--trigone of the bladder, bladder trigone, triangular bladder region, bladder anatomy, urinary bladder base, bladder floor anatomy, vesical trigone, bladder structure, pelvic anatomy, urinary system anatomy"
845121,"sacraments of service, Catholic Church sacraments, service sacraments, Holy Orders, Matrimony, sacramental theology, Catholic sacraments explained, sacraments in Catholicism, significance of sacraments, role of sacraments in service--sacraments of service, Catholic sacraments, service sacraments in Catholicism, Holy Orders, Matrimony, Catholic Church sacraments, sacraments explained, significance of sacraments of service, role of sacraments in Catholic faith, sacraments and service in the Church--sacraments of service, Catholic Church sacraments, service sacraments explained, Catholic sacraments overview, sacraments of service definition, roles of sacraments in Catholicism, sacramental theology, Catholic Church teachings on sacraments, significance of sacraments of service, marriage and holy orders in Catholicism--sacraments of service, Catholic Church sacraments, sacraments of vocation, sacraments of marriage and holy orders, Catholic sacramental theology, significance of sacraments in Catholicism, role of service in Catholic faith, understanding sacraments in the Church, sacramental life in Catholicism, importance of service sacraments--sacraments of service, Catholic Church sacraments, sacrament of holy orders, sacrament of matrimony, Catholic sacraments explained, significance of sacraments of service, sacraments in Catholic faith, roles of sacraments of service, understanding sacraments in Catholicism, Catholic Church teachings on sacraments"
935353,"Battle of Manassas dates, Battle of Bull Run location, First Battle of Manassas history, Second Battle of Bull Run timeline, Civil War battles Virginia, Manassas National Battlefield Park, significance of Manassas battles, Confederate vs Union forces Manassas--Battle of Manassas dates, First Battle of Bull Run location, Second Battle of Bull Run history, Manassas Virginia Civil War, timeline of Manassas battles, Civil War battles in Virginia, significance of Battle of Manassas, geographical coordinates of Manassas, Manassas battlefield map.--First Battle of Bull Run, Second Battle of Bull Run, Manassas location, Civil War battles, Virginia battles, historical significance of Manassas, timeline of Manassas battles, map of Manassas, key figures in Manassas, outcomes of Manassas battles--First Battle of Manassas, Second Battle of Manassas, Bull Run, Civil War battles, Manassas location, historical significance of Manassas, dates of Manassas battles, Virginia Civil War history, military strategy at Manassas, key figures in Manassas battles--Battle of Manassas date, Battle of Manassas location, First Battle of Bull Run, Second Battle of Bull Run, Manassas historical significance, Civil War battles in Virginia, Manassas timeline, Manassas battlefield map, Civil War history, key events in Manassas"
935964,"whale watching season, whale activity peak times, best months for whale watching, Massachusetts whale migration patterns, optimal whale watching times, whale species in Massachusetts, whale watching tours Massachusetts, marine life activity, seasonal whale behavior, whale watching tips--whale watching season Massachusetts, best time for whale watching Massachusetts, whale activity patterns Massachusetts, peak whale watching months Massachusetts, Massachusetts whale watching tours, whale migration Massachusetts, whale behavior Massachusetts, Massachusetts whale species, optimal whale watching times Massachusetts, Massachusetts marine wildlife viewing--whale watching season Massachusetts, best time for whale watching Massachusetts, whale activity peak times Massachusetts, Massachusetts whale watching calendar, optimal whale watching months Massachusetts, whale migration patterns Massachusetts, Massachusetts whale species activity--whale watching season Massachusetts, best time for whale watching Massachusetts, whale activity patterns Massachusetts, peak whale watching months Massachusetts, Massachusetts whale watching tips, optimal whale watching times Massachusetts, whale migration Massachusetts, Massachusetts whale species activity--whale watching season Massachusetts, best time for whale watching Massachusetts, whale activity patterns Massachusetts, peak whale watching months Massachusetts, Massachusetts whale watching tips, whale migration Massachusetts, whale watching tours Massachusetts, marine wildlife activity Massachusetts"
952262,"optimal timing, home pregnancy test accuracy, urine test best practices, pregnancy test sensitivity, early pregnancy detection, timing for accurate results, morning urine test, hormone levels in urine, test instructions, menstrual cycle and testing--optimal timing, home pregnancy test accuracy, urine test timing, early pregnancy detection, best time for pregnancy test, morning urine test, hormone levels in urine, pregnancy test sensitivity, testing after missed period, ovulation and pregnancy testing--best time for home pregnancy test, optimal timing for pregnancy test, urine pregnancy test timing, when to take a pregnancy test, home pregnancy test accuracy timing, early pregnancy test recommendations, pregnancy test sensitivity timing--home pregnancy test timing, optimal time for pregnancy test, urine test pregnancy accuracy, best time for pregnancy test, when to take home pregnancy test, early pregnancy test advice, urine pregnancy test tips, pregnancy test sensitivity--optimal timing for home pregnancy test, best time for urine pregnancy test, urine pregnancy test timing, accurate home pregnancy test timing, when to take a pregnancy test, home pregnancy test recommendations, timing for urine pregnancy test, pregnancy test best practices"
952284,"crawfish color bait fishing tips, best time to fish crawfish imitation, seasonal fishing with crawfish lures, crawfish bait fishing techniques, optimal fishing times for crawfish colors, fishing success with crawfish patterns, weather effects on crawfish bait fishing--best time to fish, crawfish color bait, fishing tips, seasonal fishing patterns, bait color effectiveness, freshwater fishing, fishing techniques, optimal fishing times, species-specific fishing, local fishing reports--best time to fish, crawfish color bait, fishing tips, seasonal fishing patterns, bait color effectiveness, freshwater fishing, fishing techniques, optimal fishing times, crawfish fishing, fishing bait selection--optimal fishing times, crawfish color bait effectiveness, seasonal fishing patterns, best bait colors for fishing, fishing techniques with crawfish bait, time of day for fishing, water temperature and fishing success, local fishing regulations, types of crawfish baits, fishing tips for specific species--crawfish color bait fishing tips, best time to fish crawfish bait, optimal fishing times crawfish color, seasonal fishing crawfish bait, fishing techniques crawfish color, bait color effectiveness fishing, crawfish bait fishing strategies"
975079,"Welsh language history, origins of Welsh, Celtic languages, Welsh linguistic roots, history of the Welsh language, Welsh language development, evolution of Welsh, Welsh language family, influences on Welsh language.--Welsh language history, origins of Welsh, Welsh language roots, Celtic languages, history of Welsh, linguistic heritage of Wales, Welsh language development, evolution of Welsh, Welsh dialects, ancient Welsh language.--Welsh language history, origins of Welsh, Celtic languages, history of Welsh, linguistic roots of Welsh, Welsh language development, evolution of Welsh, Welsh language family, historical linguistics Welsh, Welsh dialects.--Welsh language history, origins of Welsh, Celtic languages, Welsh linguistic roots, history of the Welsh language, Welsh language development, etymology of Welsh, Welsh language evolution, influence of Latin on Welsh, Welsh dialects.--Welsh language history, origins of Welsh, Celtic languages, Welsh etymology, history of the Welsh language, linguistic roots of Welsh, Welsh language development, influence of Latin on Welsh, Welsh dialects, prehistoric Welsh language"
