qid,query
1117099,"What are the characteristics of an active margin? {
  ""answer1"": ""An active margin is characterized by tectonic activity, where the oceanic and continental plates converge. Key characteristics include: 1) Narrow continental shelf, 2) Steep continental slope, 3) Frequent earthquakes and volcanic activity, 4) Formation of oceanic trenches and mountain ranges, and 5) Presence of subduction zones where one tectonic plate moves under another. These features indicate a dynamic geological environment influenced by plate tectonics.--How does an active margin differ from a passive margin? 
  
  ""answer2"": ""An active margin differs from a passive margin primarily in terms of tectonic activity and geological features. Active margins are located at plate boundaries and are characterized by significant geological activity such as earthquakes, volcanic eruptions, and the formation of mountain ranges and oceanic trenches. In contrast, passive margins are found at the edges of tectonic plates that are not interacting significantly, leading to broader continental shelves, gentle slopes, and a lack of volcanic or earthquake activity. Passive margins typically experience less geological change and are more stable than active margins.--What geological processes occur at active margins? 
  
  ""answer3"": ""At active margins, several geological processes occur due to the interaction of tectonic plates. These processes include subduction, where one plate is forced under another, leading to the formation of deep ocean trenches and volcanic arcs. Additionally, mountain building (orogeny) can occur as continental plates collide, resulting in uplift and the creation of mountain ranges. Earthquakes are frequent due to the movement of tectonic plates, and volcanic activity is common as magma rises to the surface in subduction zones. Overall, active margins are dynamic environments that shape the Earth's surface through these geological processes.""
}"
1121402,"What are the environmental benefits of contour plowing? {
  ""answer1"": ""Contour plowing is an agricultural practice that involves plowing and planting across the slope of the land, following its natural contours. This method offers several environmental benefits, including reducing soil erosion, improving soil health, and enhancing biodiversity. By plowing along the contours, farmers create natural barriers that slow down water runoff, allowing more water to infiltrate the soil and reducing the risk of erosion. Additionally, contour plowing can help maintain organic matter in the soil, as it minimizes the disturbance of the soil structure, which in turn supports a diverse range of soil organisms and promotes a healthier ecosystem.--How does contour plowing affect soil erosion? 
  
  ""answer2"": ""Contour plowing significantly affects soil erosion by minimizing it through the creation of furrows that act as barriers to water flow. When rain falls on sloped land, water tends to run straight down the slope, which can lead to significant soil loss. By following the land's contours, contour plowing slows down this runoff, allowing water to seep into the soil rather than washing it away. This method can reduce the rate of soil erosion by up to 50% compared to conventional plowing methods, helping to preserve topsoil, maintain soil fertility, and prevent sedimentation in nearby waterways.--In what ways can contour plowing improve water conservation? 
  
  ""answer3"": ""Contour plowing can improve water conservation in several ways. First, by following the natural contours of the land, it reduces surface runoff, allowing more rainwater to infiltrate the soil. This increased infiltration helps to recharge groundwater supplies and maintain soil moisture levels, which is crucial for crop growth during dry periods. Additionally, contour plowing can help create micro-catchments that capture and hold water, further enhancing the availability of moisture for plants. Overall, this practice not only conserves water but also promotes sustainable agricultural practices by ensuring that water is used more efficiently.""
}"
1121709,"What is the origin of the term ""three percenters""? {
  ""answer1"": ""The term \""three percenters\"" originates from a historical interpretation of the American Revolutionary War. It is based on the belief that only about three percent of the American colonists actively fought against British rule during the war. This figure is often cited by members of the movement to suggest that they are a small, dedicated group willing to take a stand for their beliefs, particularly regarding gun rights, limited government, and individual liberties. The modern three percent movement emerged in the United States in the early 2000s, gaining prominence in the context of anti-government sentiment and the defense of the Second Amendment.--What beliefs or ideologies do the three percenters hold? 
  
  ""answer2"": ""Three percenters generally hold a set of beliefs centered around the preservation of individual liberties, the right to bear arms, and a strong opposition to what they perceive as government overreach. They often advocate for a strict interpretation of the U.S. Constitution and emphasize the importance of self-defense and personal responsibility. The movement is associated with a broader ideology of militia movements and can include elements of patriotism, nationalism, and sometimes, anti-establishment sentiments. While not all members share the same views, there is a common thread of valuing personal freedom and skepticism towards federal authority.--How do the three percenters organize and operate within their groups? 
  
  ""answer3"": ""Three percenters typically organize into decentralized groups or cells that operate independently, which allows for flexibility and a degree of anonymity. These groups often utilize social media and online platforms to communicate, recruit, and coordinate activities. They may engage in training exercises, community events, and rallies to promote their beliefs and build camaraderie among members. The structure of these groups can vary widely, with some having formal leadership and others functioning more informally. Overall, their organization reflects a strong commitment to grassroots activism and local engagement, often emphasizing self-sufficiency and preparedness.""
}"
1124210,"What role do tracheids play in plant structure? {
  ""answer1"": ""Tracheids are elongated cells found in the xylem of vascular plants that play a crucial role in the transport of water and minerals from the roots to the rest of the plant. They are specialized for both conduction and support. Tracheids have thick cell walls that are lignified, providing structural support to the plant while also allowing for efficient water movement through their lumen. The presence of pits in the walls of tracheids facilitates the flow of water between adjacent cells, making them vital for maintaining hydration and nutrient transport within the plant.--In which types of plants can tracheids be found? 
  ""answer2"": ""Tracheids can be found in a variety of plant types, particularly in gymnosperms (such as conifers) and some angiosperms (flowering plants). They are a key component of the xylem in these plants, especially those that do not have vessels, which are more commonly found in many angiosperms. Tracheids are considered primitive vascular tissue and are often the primary means of water conduction in plants that have not evolved vessels.--How do tracheids differ from other types of vascular tissue? 
  ""answer3"": ""Tracheids differ from other types of vascular tissue, such as vessel elements, primarily in their structure and function. While tracheids are long and narrow, with tapered ends and primarily facilitate water transport through pits, vessel elements are shorter, wider, and have perforation plates that allow for more efficient water flow. This structural difference results in tracheids being less efficient in conducting water compared to vessels, which are more advanced and found in many angiosperms. Additionally, tracheids provide more support due to their thicker walls, making them essential for the structural integrity of certain plant types.""
}"
1129237,"At what temperature does hydrogen transition from a gas to a liquid? {
  ""answer1"": ""Hydrogen transitions from a gas to a liquid at its boiling point, which is approximately -252.87 degrees Celsius (-423.17 degrees Fahrenheit) at standard atmospheric pressure. At this temperature, hydrogen gas condenses into a pale blue liquid, which is used in various applications, including rocket fuel and cryogenics.--What are the properties of liquid hydrogen at low temperatures? 
  ""answer2"": ""Liquid hydrogen possesses several distinctive properties at low temperatures. It has a very low density, approximately 70.85 kg/m³, making it one of the lightest liquids. It exhibits high thermal conductivity and is a good insulator against heat transfer. Additionally, liquid hydrogen has a low viscosity and is highly flammable, requiring careful handling. Its boiling point is extremely low, and below this temperature, it remains in a liquid state while being utilized in various scientific and industrial applications.--How does the temperature of hydrogen compare to other elements when determining their state of matter? 
  ""answer3"": ""When comparing the temperature at which hydrogen transitions between states of matter to other elements, hydrogen has one of the lowest boiling points. For example, helium, another light element, remains a liquid at even lower temperatures (it does not solidify at atmospheric pressure). In contrast, heavier elements like mercury transition from liquid to solid at much higher temperatures. This significant difference in transition temperatures highlights the unique properties of hydrogen and its position on the periodic table as the lightest element.""
}"
1133167,"What is the current temperature in Jamaica? {""answer1"": ""As of October 2023, I do not have real-time data access to provide the current temperature in Jamaica. However, you can check reliable weather websites or apps for up-to-date information on the temperature.--Are there any weather warnings or alerts in Jamaica today?  ""answer2"": ""I do not have access to live data to confirm any weather warnings or alerts in Jamaica today. It is advisable to check local news sources or the Jamaica Meteorological Service for any current weather advisories.--What is the typical weather like in Jamaica during this time of year?  ""answer3"": ""In October, Jamaica typically experiences warm and humid weather, with average temperatures ranging from 24°C to 31°C (75°F to 88°F). This month is part of the hurricane season, so there may be occasional rain showers and thunderstorms, especially in the afternoons.""}"
130510,"What is a declaratory judgment in legal terms? {
  ""answer1"": ""A declaratory judgment is a legal determination made by a court that clarifies the rights, duties, or obligations of the parties involved in a legal dispute, without ordering any specific action or awarding damages. It is typically sought to resolve uncertainty or ambiguity in the law or in the parties' legal relationships, allowing individuals or entities to understand their legal standing before taking further action.--How does a declaratory judgment differ from other types of judgments? 
  ""answer2"": ""A declaratory judgment differs from other types of judgments primarily in that it does not require the court to order a party to do something (like in an injunction) or to award damages (as in a monetary judgment). Instead, it simply provides a legal declaration regarding the rights or obligations of the parties. Other types of judgments, such as default judgments or summary judgments, typically involve a resolution of the underlying claims and may result in enforceable orders or relief.--In what situations might a declaratory judgment be sought in court? 
  ""answer3"": ""Declaratory judgments may be sought in various situations, including but not limited to disputes over contract interpretations, questions regarding the validity of a statute or regulation, or clarifications of insurance coverage. For instance, a party might seek a declaratory judgment to determine whether their actions comply with a contract's terms before proceeding with a course of action, thus avoiding future litigation or conflict.""
}"
131843,"What is a SIGMET and what does it stand for? {
  ""answer1"": ""A SIGMET, which stands for Significant Meteorological Information, is an aviation weather advisory that warns pilots of significant weather phenomena that may affect the safety of flight. These advisories are issued by meteorological authorities and are crucial for flight planning and in-flight decision-making. SIGMETs are typically issued for severe weather events such as thunderstorms, turbulence, icing, and volcanic ash that could pose a danger to aircraft operations.--What information is typically included in a SIGMET? 
  ""answer2"": ""A SIGMET typically includes several key pieces of information: the type of significant weather phenomenon being reported (e.g., thunderstorms, severe turbulence), the geographic area affected, the intensity and expected duration of the phenomenon, and any relevant flight levels. Additionally, it may provide guidance on the expected movement of the weather system and any pertinent updates or changes in the situation. This information is vital for pilots to assess potential risks during flight.--How does a SIGMET differ from other aviation weather advisories, such as AIRMETs? 
  ""answer3"": ""SIGMETs differ from other aviation weather advisories, such as AIRMETs, primarily in the severity of the weather phenomena they address. While SIGMETs are issued for significant weather that can pose a serious threat to aircraft safety, AIRMETs (which stands for Airmen's Meteorological Information) are used to convey information about less severe weather conditions that could still affect flight operations, such as moderate turbulence, icing, or visibility issues. AIRMETs are typically issued for broader areas and are intended for use by pilots flying at lower altitudes or in less severe conditions.""
}"
146187,"What are the main ingredients in a McDouble compared to a Double Cheeseburger? {
  ""answer1"": ""The main ingredients in a McDouble and a Double Cheeseburger are quite similar, but there are key differences. A McDouble consists of two beef patties, one slice of cheese, pickles, onions, ketchup, and mustard, all served on a sesame seed bun. In contrast, a Double Cheeseburger includes two beef patties, two slices of cheese, pickles, onions, ketchup, and mustard, also served on a sesame seed bun. The primary distinction lies in the number of cheese slices, with the Double Cheeseburger having one more slice than the McDouble.--How does the nutritional information differ between a McDouble and a Double Cheeseburger? 
  ""answer2"": ""Nutritional information for the McDouble and Double Cheeseburger varies mainly due to the difference in cheese content. A McDouble typically contains around 400 calories, 23 grams of fat, and 22 grams of protein. In comparison, a Double Cheeseburger has approximately 450 calories, 24 grams of fat, and 25 grams of protein. The extra slice of cheese in the Double Cheeseburger contributes to its slightly higher calorie and fat content. Additionally, both sandwiches contain similar amounts of sodium and carbohydrates, but the Double Cheeseburger may have marginally higher values due to the additional cheese.--Are there any variations in price or availability between McDouble and Double Cheeseburger at McDonald's? 
  ""answer3"": ""Price and availability can vary by location and region for both the McDouble and Double Cheeseburger at McDonald's. Generally, the McDouble is priced slightly lower than the Double Cheeseburger, reflecting the difference in the number of cheese slices. For example, a McDouble may cost around $1.89, while a Double Cheeseburger might be priced at about $2.29. Availability can also differ based on local McDonald's menus and promotions, with some locations offering one item more prominently than the other, especially during value meal promotions.""
}"
148538,"What are the educational requirements for becoming a Registered Nurse (RN) compared to a Bachelor of Science in Nursing (BSN)? {
  ""answer1"": ""To become a Registered Nurse (RN), one must complete an accredited nursing program, which can be either an Associate Degree in Nursing (ADN) or a Bachelor of Science in Nursing (BSN). An ADN typically takes about two to three years to complete and prepares graduates for entry-level nursing positions, while a BSN is a four-year degree that provides a more comprehensive education in nursing, including leadership, research, and public health courses. Although both pathways allow graduates to sit for the NCLEX-RN licensing exam, a BSN is increasingly preferred by employers and may provide greater opportunities for advancement in the nursing field.--What are the roles and responsibilities of an RN versus those of a BSN-prepared nurse? 
  ""answer2"": ""The roles and responsibilities of an RN encompass direct patient care, administering medications, monitoring patient health, and collaborating with healthcare teams. RNs can work in various settings, including hospitals, clinics, and community health. A BSN-prepared nurse, while also performing these core responsibilities, may have additional roles that include leadership, management, and the ability to participate in research and policy-making. BSN nurses are often trained to take on more complex cases and have a broader understanding of healthcare systems, which can lead to more responsibilities in patient education and care coordination.--How does the career advancement potential differ between RNs and BSN nurses? 
  ""answer3"": ""Career advancement potential differs significantly between RNs with an ADN and those with a BSN. While both can start as staff nurses, BSN-prepared nurses often have access to more advanced positions, such as nurse manager, clinical nurse leader, or roles in specialized areas like public health or education. Many healthcare employers now prefer or require a BSN for leadership roles or positions in specialized fields, which can lead to higher salaries and more opportunities for advancement. Additionally, many RNs with an ADN may find it beneficial to pursue a BSN through RN-to-BSN programs to enhance their career prospects.""
}"
156493,"What factors influence the growth of goldfish? {
  ""answer1"": ""The growth of goldfish is influenced by several factors including water quality, temperature, diet, and the size of their living environment. Water quality is crucial; poor water conditions can stunt growth and lead to health problems. Additionally, goldfish thrive in temperatures between 65°F and 75°F (18°C to 24°C). A balanced diet that includes high-quality pellets, vegetables, and occasional protein sources promotes healthy growth. Lastly, the size of the tank or pond plays a significant role; goldfish require ample space to grow, as overcrowding can inhibit their growth and lead to stress.--How large can goldfish grow in captivity versus in the wild? 
  ""answer2"": ""In captivity, goldfish can grow to be quite large, often reaching sizes of 6 to 8 inches (15 to 20 cm) or more, depending on the species and the care they receive. Some varieties, like the Comet or Shubunkin, can exceed 12 inches (30 cm) if kept in a spacious environment. In the wild, goldfish can grow even larger, with reports of individuals reaching up to 18 inches (45 cm) or more, largely due to the vast space and natural conditions that allow for optimal growth.--What is the average lifespan of a goldfish and how does it relate to their growth? 
  ""answer3"": ""The average lifespan of a goldfish is typically around 10 to 15 years, though some can live for over 20 years with proper care. Lifespan is closely related to growth; goldfish that are kept in optimal conditions with good nutrition and water quality tend to grow larger and live longer. Conversely, those kept in poor conditions may experience stunted growth and a shorter lifespan. Thus, providing a healthy environment is essential for both their growth and longevity.""
}"
168216,"What is Legionella pneumophila and how does it affect the human body? {
  ""answer1"": ""Legionella pneumophila is a type of bacteria that is responsible for causing a severe form of pneumonia known as Legionnaires' disease. It is commonly found in freshwater environments, such as lakes and streams, and can also thrive in man-made water systems like hot tubs, cooling towers, and plumbing systems. When inhaled, the bacteria can infect the lungs, leading to inflammation and a range of respiratory symptoms. The bacteria can affect the human body by evading the immune system, replicating within immune cells, and causing tissue damage, which can result in serious health complications, particularly in individuals with weakened immune systems or underlying health conditions.--What are the symptoms of pneumonia caused by Legionella pneumophila? 
  
  ""answer2"": ""The symptoms of pneumonia caused by Legionella pneumophila can vary but typically include: high fever, chills, cough (which may produce sputum), shortness of breath, chest pain, and muscle aches. Some patients may also experience gastrointestinal symptoms such as nausea, vomiting, and diarrhea. Additionally, confusion or changes in mental status can occur, particularly in older adults. Symptoms usually appear 2 to 10 days after exposure to the bacteria, and the severity can range from mild to life-threatening, especially in vulnerable populations.--How is pneumonia caused by Legionella pneumophila diagnosed and treated? 
  
  ""answer3"": ""Pneumonia caused by Legionella pneumophila is diagnosed through a combination of clinical evaluation and laboratory tests. Physicians may order a chest X-ray to assess lung inflammation and may also perform a sputum culture or a urine antigen test to detect the presence of Legionella bacteria. Blood tests may be conducted to evaluate the overall health of the patient and to check for signs of infection. Treatment typically involves the use of antibiotics, with macrolides (such as azithromycin) or fluoroquinolones (such as levofloxacin) being the most effective against Legionella. In severe cases, hospitalization may be necessary for supportive care, including oxygen therapy and intravenous fluids.""
}"
182539,"What is a monotonic function? {
  ""answer1"": ""A monotonic function is a function that preserves the given order of its values. In other words, a function f(x) is considered monotonic if it is either entirely non-increasing or non-decreasing throughout its domain. This means that if x1 < x2, then f(x1) ≤ f(x2) for a monotonic non-decreasing function, and f(x1) ≥ f(x2) for a monotonic non-increasing function. Monotonic functions are important in mathematics because they exhibit predictable behavior and are easier to analyze in terms of limits, continuity, and integrals.--Can you provide examples of increasing and decreasing monotonic functions? 
  
  ""answer2"": ""Examples of increasing monotonic functions include: 1) f(x) = x, which is a linear function that increases steadily as x increases; 2) f(x) = x^2 for x >= 0, which is a quadratic function that increases for all non-negative x; and 3) f(x) = e^x, which is the exponential function that increases rapidly as x increases. Examples of decreasing monotonic functions include: 1) f(x) = -x, which is a linear function that decreases steadily as x increases; 2) f(x) = -x^2 for x <= 0, which decreases for all non-positive x; and 3) f(x) = 1/x for x > 0, which decreases as x increases.--How do monotonic functions differ from non-monotonic functions? 
  
  ""answer3"": ""Monotonic functions differ from non-monotonic functions in that non-monotonic functions do not preserve the order of their values. A non-monotonic function can have intervals where it increases and other intervals where it decreases. For example, the function f(x) = sin(x) is non-monotonic because it oscillates between -1 and 1, increasing and decreasing repeatedly over its domain. In contrast, monotonic functions either consistently increase or consistently decrease, making them more predictable and easier to work with in various mathematical contexts.""
}"
