qid,query
1037798,"What are the notable achievements of Robert Gray? {
  ""answer1"": ""Robert Gray is recognized for several notable achievements, particularly in the field of literature and poetry. He is a prominent Australian poet whose work has garnered critical acclaim and numerous awards. Gray's poetry often reflects themes of nature, identity, and the Australian landscape. He has received prestigious accolades such as the Australian Literature Society Gold Medal and the Kenneth Slessor Prize for Poetry. Additionally, Gray has made significant contributions to the literary community through his involvement in editing and teaching, helping to shape the next generation of writers.--What is Robert Gray known for in his profession? 
  ""answer2"": ""In his profession, Robert Gray is best known as a poet and writer. His literary career spans several decades, during which he has published numerous poetry collections, essays, and works of criticism. Gray's distinctive voice and style have made him a key figure in Australian literature, with his works often praised for their lyrical quality and deep engagement with the natural world. He is also recognized for his role as a mentor to emerging poets and for his contributions to literary journals and anthologies.--Are there any famous works or contributions associated with Robert Gray? 
  ""answer3"": ""Robert Gray has several famous works and contributions associated with his name. His poetry collections, such as 'The Land I Came Through Last' and 'Collected Poems,' are highly regarded in literary circles. Gray's poem 'The Meatworks' is particularly noted for its vivid imagery and exploration of the Australian landscape and identity. Additionally, he has contributed essays and critiques that delve into the nature of poetry and the writing process, further solidifying his influence in the literary field. His work has been instrumental in bringing attention to contemporary Australian poetry on both national and international stages.""
}"
104861,"What factors influence the cost of interior concrete flooring? {
  ""answer1"": ""The cost of interior concrete flooring is influenced by several factors including the type of concrete used (e.g., polished, stained, or decorative), the complexity of the design, the size of the area being covered, and the local labor rates. Additional costs may arise from preparation work such as leveling the subfloor, the need for special tools or equipment, and the application of sealants or finishes. Geographic location can also play a role, as prices vary significantly between urban and rural areas due to differences in labor availability and material costs.--How does the price of interior concrete flooring compare to other flooring options? 
  ""answer2"": ""When compared to other flooring options, interior concrete flooring can be more cost-effective in the long run. While the initial installation cost may be higher than materials like vinyl or laminate, concrete offers durability, low maintenance, and longevity, which can lead to lower overall costs. For instance, hardwood flooring can be more expensive to install and maintain, while tile may have similar upfront costs but can also involve higher installation labor. Overall, concrete flooring can be a competitive option when considering total lifecycle costs.--What are the average installation costs for interior concrete flooring per square foot? 
  ""answer3"": ""The average installation costs for interior concrete flooring typically range from $2 to $6 per square foot, depending on factors such as the type of finish, the complexity of the installation, and regional labor costs. Basic concrete may be on the lower end of the spectrum, while decorative options like stamped or polished concrete can push costs higher. It's important to obtain quotes from local contractors to get a more accurate estimate based on specific project requirements.""
}"
1063750,"What were the main reasons for the United States' decision to enter World War I? {
  ""answer1"": ""The United States' decision to enter World War I in 1917 was influenced by several key factors. Firstly, unrestricted submarine warfare by Germany, particularly the sinking of the Lusitania in 1915, resulted in American casualties and heightened anti-German sentiment. Secondly, the interception of the Zimmermann Telegram, in which Germany proposed a military alliance with Mexico against the US, alarmed American officials and the public. Additionally, economic interests played a significant role; American banks and businesses had substantial loans and investments in the Allied powers, particularly Britain and France. The desire to protect these investments and ensure a favorable outcome in Europe contributed to the decision. Lastly, the ideological commitment to democracy, as President Woodrow Wilson framed the war as a fight for democratic values, also motivated the US to join the conflict.--How did public opinion in the US influence the decision to join the war? 
  
  ""answer2"": ""Public opinion in the United States significantly influenced the decision to join World War I. Initially, there was strong isolationist sentiment among the American public, with many citizens believing that the US should avoid involvement in European conflicts. However, as the war progressed, various events shifted public opinion. The sinking of the Lusitania and other ships by German U-boats stirred outrage and sympathy for the Allies. Propaganda campaigns, including those by the Committee on Public Information, effectively portrayed the war as a moral obligation to support democracy and freedom. The combination of these factors, along with the growing perception that the US had a stake in the outcome of the war, led to increased public support for intervention, ultimately influencing policymakers to declare war on Germany in April 1917.--What role did international events and alliances play in the US entering World War I? 
  
  ""answer3"": ""International events and alliances played a crucial role in the United States' entry into World War I. The complex web of alliances in Europe meant that the conflict was not isolated; actions by one nation had far-reaching consequences. The failure of diplomatic efforts and the escalation of hostilities among European powers created an environment where the US could no longer remain neutral. The Allied powers, especially Britain and France, were under significant threat from the Central Powers, and their struggle for survival became a concern for the US, particularly given its economic ties to these nations. Furthermore, the Russian Revolution in 1917 shifted the balance of power and made the Allied cause more appealing to Americans, as it removed the autocratic Tsarist regime from the equation. This combination of international pressures and the need to support allies against a common enemy ultimately led to the US entering"
1103812,"What is the Commonwealth of Independent States (CIS)? {
  ""answer1"": ""The Commonwealth of Independent States (CIS) is a regional organization formed after the dissolution of the Soviet Union in December 1991. It serves as a platform for member states to collaborate on various issues, including economic, political, and military cooperation. The CIS aims to promote stability and foster cooperation among its member countries, while also addressing issues such as trade, security, and cultural exchange.--Which countries were involved in the formation of the CIS? 
  ""answer2"": ""The CIS was initially formed by eleven former Soviet republics: Armenia, Azerbaijan, Belarus, Kazakhstan, Kyrgyzstan, Moldova, Russia, Tajikistan, Turkmenistan, Ukraine, and Uzbekistan. Georgia joined later but withdrew its participation in 2009. The founding members sought to maintain certain ties and facilitate collaboration in the post-Soviet space.--When was the Commonwealth of Independent States established? 
  ""answer3"": ""The Commonwealth of Independent States was established on December 8, 1991, when the leaders of Russia, Ukraine, and Belarus signed the Belavezha Accords, which declared the dissolution of the Soviet Union. The formal creation of the CIS followed shortly after, with the signing of the Alma-Ata Declaration on December 21, 1991, which included the participation of other former Soviet republics.""
}"
1106007,"What does the term ""visceral"" mean in a general context? {
  ""answer1"": ""The term \""visceral\"" generally refers to something that is deeply felt, instinctive, or related to the internal organs of the body. It often describes emotions or reactions that are raw and immediate, rather than intellectual or reasoned. For example, a visceral reaction to a piece of art or a situation may evoke strong feelings that are felt physically, such as a gut response, rather than a rational analysis of the situation.--How is the word ""visceral"" used in medical terminology? 
  ""answer2"": ""In medical terminology, \""visceral\"" pertains to the internal organs, particularly those within the abdominal cavity, such as the stomach, liver, and intestines. This term is often used to describe conditions or sensations that originate from these organs. For instance, visceral pain is a type of pain that arises from the internal organs, often described as deep, squeezing, or aching, and is distinct from somatic pain, which originates from the skin, muscles, or joints.--Can you provide examples of how ""visceral"" is used in literature or everyday language? 
  ""answer3"": ""In literature and everyday language, \""visceral\"" is often used to convey intense emotional experiences or reactions. For example, an author might describe a character's visceral fear in a horror story, illustrating a deep, instinctual terror that overrides logical thought. In everyday conversation, someone might say they had a visceral dislike for a particular food, indicating a strong, gut-level aversion rather than a reasoned opinion. This usage emphasizes the immediacy and intensity of feelings associated with the term.""
}"
1110199,"What are the main differences between Wi-Fi and Bluetooth in terms of range and speed? {
  ""answer1"": ""Wi-Fi and Bluetooth are both wireless communication technologies, but they differ significantly in terms of range and speed. Wi-Fi typically offers a much longer range, usually up to 100 meters (328 feet) indoors and even further outdoors, depending on the environment and the specific Wi-Fi standard in use. In contrast, Bluetooth has a shorter range, generally around 10 meters (33 feet) for most devices, though newer versions like Bluetooth 5 can reach up to 40 meters (131 feet) in open spaces. In terms of speed, Wi-Fi is significantly faster, with speeds ranging from 11 Mbps (802.11b) to several Gbps (802.11ac/802.11ax), whereas Bluetooth speeds are much lower, typically around 1-3 Mbps for classic Bluetooth and up to 2 Mbps for Bluetooth 5. This makes Wi-Fi more suitable for high-bandwidth applications like video streaming, while Bluetooth is ideal for low-bandwidth tasks such as connecting peripherals.--How do Wi-Fi and Bluetooth technology work, and what are their typical use cases? 
  
  ""answer2"": ""Wi-Fi and Bluetooth operate on different principles and serve various use cases. Wi-Fi uses radio waves to provide high-speed internet access and local area networking. It typically operates on the 2.4 GHz and 5 GHz frequency bands and requires a router or access point to connect devices to the internet. Common use cases for Wi-Fi include home networking, office connectivity, and public hotspots. On the other hand, Bluetooth is designed for short-range communication between devices. It operates on the 2.4 GHz frequency band and creates a personal area network (PAN) for connecting devices directly without the need for a central hub. Typical use cases for Bluetooth include connecting wireless headphones, keyboards, mice, and transferring files between devices. Both technologies are integral to modern wireless communication but are optimized for different scenarios.--What are the advantages and disadvantages of using Wi-Fi compared to Bluetooth for wireless connectivity? 
  
  ""answer3"": ""When comparing Wi-Fi and Bluetooth for wireless connectivity, there are several advantages and disadvantages to consider. Advantages of Wi-Fi include its superior range and speed, making it ideal for tasks that require high data transfer rates, such as streaming video or gaming. Wi-Fi can support multiple devices simultaneously without significant degradation of performance, making it suitable for environments with many users. However, Wi-Fi can be more power-hungry, which may not be ideal for battery-operated devices. On the other hand, Bluetooth has the advantage of lower power consumption, making it better suited for devices like wearables and IoT gadgets that"
1112341,"What are the typical daily routines of Thai people in urban areas compared to rural areas? {
  ""answer1"": ""In urban areas of Thailand, daily routines often revolve around a fast-paced lifestyle influenced by work commitments and modern conveniences. Many urban Thai people start their day early, with a common breakfast consisting of rice, noodles, or street food. Commuting is a significant part of urban life, with many individuals relying on public transportation like buses and the BTS Skytrain. Work hours typically extend from 8 AM to 5 PM, followed by social activities or shopping at local malls. In contrast, rural Thai people's routines are generally more aligned with agricultural cycles. Their day might start at dawn, with chores such as farming or tending to livestock. Meals are often home-cooked and may include ingredients grown locally. Social interactions are more community-oriented, with gatherings and festivals playing a significant role in daily life. Overall, urban routines are characterized by busyness and modernity, while rural routines emphasize community and traditional practices.--What cultural practices and traditions influence the daily life of Thai people? 
  
  ""answer2"": ""Thai culture is deeply rooted in traditions and practices that significantly influence daily life. Buddhism plays a central role, with many Thai people engaging in morning alms-giving to monks, visiting temples, and participating in religious festivals. Family is another cornerstone of Thai culture, with respect for elders being paramount. Traditional Thai practices such as Songkran (the Thai New Year) and Loy Krathong (the Festival of Lights) are celebrated with enthusiasm, reflecting the importance of water and light in Thai spirituality. Additionally, the concept of 'sanuk' (fun) influences daily interactions, encouraging a light-hearted approach to life. Thai cuisine, with its emphasis on balance and harmony, also reflects cultural values, as meals are often shared among family and friends, fostering connection and community. These cultural practices shape not only daily routines but also the social fabric of Thai society.--How do Thai people typically spend their leisure time and weekends? 
  
  ""answer3"": ""Leisure time and weekends for Thai people often involve a mix of relaxation, socializing, and cultural activities. In urban areas, many people enjoy shopping at local markets or malls, dining out with friends or family, and participating in recreational activities such as sports, movies, or concerts. Weekend trips to nearby tourist destinations or natural attractions are also popular, as they provide a break from the city hustle. In rural areas, leisure time may be spent engaging in traditional pastimes such as fishing, farming, or attending local festivals. Family gatherings and community events are common, allowing for social bonding and cultural expression. Overall, leisure activities in"
1113437,"What are the key characteristics of spruce trees' physical appearance? {
  ""answer1"": ""Spruce trees, belonging to the genus Picea, exhibit several key characteristics in their physical appearance. They typically have a conical shape with a narrow crown, which makes them easily recognizable. The bark of spruce trees is usually thin and scaly, ranging in color from gray to reddish-brown. The branches grow horizontally and are often drooping, giving the tree a graceful appearance. Spruce trees have a distinctive whorled branching pattern, where the branches grow in circles around the trunk. Their cones are cylindrical, hanging downwards, and can vary in size depending on the species, with colors ranging from green to brown as they mature. Overall, spruce trees present a rugged and evergreen look due to their dense foliage and sturdy structure.--How do the leaves and needles of spruce trees differ from those of other coniferous trees? 

  ""answer2"": ""The leaves of spruce trees are needle-like and typically range from 1 to 3 inches in length, with a square cross-section that allows them to be easily rolled between fingers. This characteristic distinguishes them from many other coniferous trees, such as pines, which have longer, slender needles that can be grouped in clusters. Spruce needles are attached individually to the branches, while pine needles often grow in bundles. Additionally, spruce needles are generally sharper and more rigid than those of fir trees, which tend to be softer and flatter. The color of spruce needles can vary, often appearing bluish-green or dark green, contributing to their aesthetic appeal in landscapes.--What is the typical height and shape of a fully grown spruce tree? 

  ""answer3"": ""Fully grown spruce trees can vary significantly in height depending on the species, but many commonly reach heights of 40 to 60 feet (12 to 18 meters) at maturity. Some species, such as the Sitka spruce, can exceed 100 feet (30 meters). The shape of a fully grown spruce tree is typically conical, with a straight trunk that tapers towards the top. This shape is advantageous for shedding snow and rain, reducing the risk of branch breakage. The overall height and shape can also be influenced by environmental factors such as soil quality, sunlight, and water availability, with trees in optimal conditions growing taller and more robust.""
}"
1114646,"What conditions or infections is Famvir used to treat? {
  ""answer1"": ""Famvir, or famciclovir, is an antiviral medication primarily used to treat infections caused by certain types of viruses. It is effective against the herpes simplex virus, which can cause conditions such as genital herpes and cold sores. Famvir is also used to treat shingles (herpes zoster), which is a reactivation of the chickenpox virus. In some cases, it may be prescribed for the treatment of herpes simplex virus infections in immunocompromised patients.--How does Famvir work in the body to alleviate symptoms? 
  ""answer2"": ""Famvir works by inhibiting the replication of viral DNA, which is essential for the virus to multiply and spread in the body. Once ingested, famciclovir is converted into its active form, penciclovir, which interferes with the viral enzyme DNA polymerase. By blocking this enzyme, famciclovir prevents the virus from producing new viral particles, thereby reducing the severity and duration of symptoms associated with viral infections such as genital herpes, cold sores, and shingles.--Are there any specific patient populations that should avoid taking Famvir? 
  ""answer3"": ""Certain patient populations should exercise caution or avoid taking Famvir. These include individuals with a known hypersensitivity to famciclovir or its components, as they may experience allergic reactions. Patients with severe renal impairment should also avoid this medication or use it under strict medical supervision, as dosage adjustments may be necessary to prevent toxicity. Additionally, pregnant or breastfeeding women should consult their healthcare provider before using Famvir to assess potential risks to the fetus or infant.""
}"
1114819,"What types of items are classified as durable medical equipment (DME)? {
  ""answer1"": ""Durable Medical Equipment (DME) refers to medical devices that are designed for long-term use and are essential for patients with chronic illnesses or disabilities. Common types of DME include wheelchairs, hospital beds, walkers, oxygen equipment, nebulizers, and prosthetic devices. These items are typically prescribed by healthcare providers and are intended to assist patients in their daily activities, improve their quality of life, and facilitate recovery.--How is durable medical equipment different from regular medical supplies? 
  ""answer2"": ""Durable Medical Equipment differs from regular medical supplies primarily in terms of longevity and purpose. DME is intended for repeated use over an extended period, while regular medical supplies, such as bandages, syringes, and disposable gloves, are generally designed for single-use or short-term use. Additionally, DME often requires a prescription and is covered by insurance under specific conditions, whereas regular medical supplies may not have the same coverage or prescription requirements.--What are the common uses and benefits of durable medical equipment? 
  ""answer3"": ""The common uses of Durable Medical Equipment (DME) include providing mobility assistance, enhancing patient comfort, and facilitating rehabilitation. Benefits of DME include improved patient independence, enhanced safety in home environments, and support during recovery from surgery or illness. DME can also help manage chronic conditions, reduce the need for hospitalization, and improve overall health outcomes by enabling patients to perform daily activities more effectively.""
}"
1115776,"What are the primary responsibilities of an AML surveillance analyst? {
  ""answer1"": ""The primary responsibilities of an AML (Anti-Money Laundering) surveillance analyst include monitoring financial transactions to detect suspicious activities that may indicate money laundering or other financial crimes. Analysts utilize various tools and software to analyze transaction patterns, investigate alerts generated by monitoring systems, and conduct in-depth reviews of customer accounts. They are also responsible for documenting findings, preparing reports, and collaborating with other departments, such as compliance and law enforcement, to ensure that any suspicious activities are reported to regulatory authorities in a timely manner. Additionally, AML surveillance analysts may participate in developing and enhancing monitoring systems and processes to improve the detection of illicit activities.--What skills and qualifications are required to become an AML surveillance analyst? 
  
  ""answer2"": ""To become an AML surveillance analyst, candidates typically require a combination of education, skills, and experience. A bachelor's degree in finance, accounting, business administration, or a related field is often preferred. Relevant certifications, such as the Certified Anti-Money Laundering Specialist (CAMS) or the Certified Financial Crime Specialist (CFCS), can enhance job prospects. Key skills include strong analytical and critical thinking abilities, attention to detail, and proficiency in data analysis tools and software. Familiarity with relevant laws and regulations, such as the Bank Secrecy Act (BSA) and the USA PATRIOT Act, is also essential. Effective communication skills are important for reporting findings and collaborating with team members and external parties.--How does the role of an AML surveillance analyst contribute to anti-money laundering efforts in financial institutions? 
  
  ""answer3"": ""The role of an AML surveillance analyst is crucial in the fight against money laundering and financial crime within financial institutions. By monitoring and analyzing transactions, these analysts help identify and mitigate risks associated with illicit financial activities. Their work ensures that institutions comply with regulatory requirements, which protects them from legal penalties and reputational damage. Additionally, AML surveillance analysts play a key role in safeguarding the financial system by detecting and reporting suspicious activities to authorities, thereby contributing to broader anti-money laundering efforts. Their insights and analyses can lead to improved monitoring systems and practices, enhancing the overall effectiveness of compliance programs.""
}"
