qid,query
183378,"What are exons and how do they differ from introns in biology? {
  ""answer1"": ""Exons are segments of a gene that contain coding information for proteins. They are the portions of the gene that are expressed, meaning they are transcribed into messenger RNA (mRNA) and ultimately translated into proteins. In contrast, introns are non-coding segments of a gene that are interspersed between exons. During the process of gene expression, introns are removed from the pre-mRNA transcript through a process called splicing, while exons are retained. This key difference is fundamental to the expression of genes, as exons determine the amino acid sequence of proteins, while introns do not contribute to the final protein product.--What role do exons play in the process of gene expression? 
  
  ""answer2"": ""Exons play a crucial role in gene expression as they encode the actual information needed to produce proteins. During transcription, the entire gene, including both exons and introns, is initially copied into a precursor mRNA (pre-mRNA). Subsequently, during RNA processing, introns are removed and exons are spliced together to form the mature mRNA. This mature mRNA is then translated into a protein by ribosomes. Thus, exons are essential for determining the functional outcome of gene expression, as they provide the sequence that dictates the structure and function of the resulting protein.--How are exons involved in the formation of mature mRNA? 
  
  ""answer3"": ""Exons are integral to the formation of mature mRNA through the process of RNA splicing. After transcription of the gene into pre-mRNA, the splicing machinery, including small nuclear ribonucleoproteins (snRNPs) and other proteins, recognizes the boundaries between introns and exons. The introns are removed, and the exons are joined together to form a continuous coding sequence. This spliced mRNA is then processed further, including the addition of a 5' cap and a poly-A tail, which are important for mRNA stability and translation. The final product, mature mRNA, consists solely of exons and is ready for translation into a protein.""
}"
19335,"What is the anthropological perspective on the concept of environment? {
  ""answer1"": ""The anthropological perspective on the concept of environment is multifaceted, emphasizing the relationship between human beings and their surroundings. Anthropologists view the environment not merely as a physical space but as a complex interplay of social, cultural, and ecological factors. This perspective acknowledges that environments are shaped by human activity and that cultural practices influence how communities interact with their natural surroundings. Anthropologists study environments in various contexts, including how cultural beliefs, economic systems, and historical processes affect human adaptation and resource management. The anthropological approach often highlights the importance of local knowledge and practices in understanding environmental issues, advocating for a holistic view that integrates cultural and ecological considerations.--How do anthropologists define the term ""environment"" in their studies? 
  
  ""answer2"": ""In anthropological studies, the term 'environment' is defined broadly to encompass both the physical and social contexts in which human life occurs. This includes natural landscapes, ecosystems, and climate, as well as the social, political, and economic structures that shape human experiences. Anthropologists examine how different cultures perceive and interact with their environments, recognizing that these interactions are influenced by factors such as technology, tradition, and power dynamics. The environment is seen as a dynamic entity that is co-constructed by human activities and cultural meanings. This definition allows anthropologists to explore the diverse ways in which communities adapt to and modify their surroundings over time.--What are the key components of the environment according to anthropological theories? 
  
  ""answer3"": ""According to anthropological theories, the key components of the environment include both biophysical elements and socio-cultural factors. Biophysical components refer to the natural aspects of the environment, such as climate, geography, flora, and fauna, which influence human life and activities. Socio-cultural components encompass the beliefs, practices, and social structures that shape how communities understand and engage with their environment. Additionally, anthropologists consider the historical context of environmental interactions, recognizing that past events and cultural legacies impact current relationships with the environment. This comprehensive view underscores the interdependence of humans and their environments, highlighting how cultural practices can lead to both sustainable and unsustainable outcomes in ecological contexts.""
}"
207786,"What are the physiological mechanisms that allow some sharks to maintain a warmer body temperature than the surrounding water? {
  ""answer1"": ""Sharks have evolved several physiological mechanisms that allow them to maintain a body temperature higher than the surrounding water, a trait known as regional endothermy. One of the primary mechanisms is the presence of a specialized circulatory system called the rete mirabile, a network of blood vessels that allows for the retention of heat generated by muscular activity. This system works by positioning the warm arterial blood close to the cooler venous blood returning from the gills, allowing heat to transfer and maintain the temperature of the arterial blood. Additionally, sharks possess a layer of insulating fat called blubber, which helps to reduce heat loss. These adaptations enable certain species of sharks to thrive in colder waters, enhancing their predatory efficiency and metabolic functions.--Which species of sharks are known to be warm-blooded, and how do they differ from cold-blooded sharks? 
  
  ""answer2"": ""The species of sharks known to be warm-blooded include the great white shark (Carcharodon carcharias), the shortfin mako shark (Isurus oxyrinchus), and the thresher shark (Alopias spp.). These sharks exhibit adaptations such as a highly developed rete mirabile that effectively retains heat, allowing them to maintain a body temperature that is several degrees higher than the surrounding water. In contrast, cold-blooded sharks, like most other shark species, rely on the ambient water temperature to regulate their body heat, which can limit their activity levels and hunting capabilities in colder environments. Warm-blooded sharks are generally more active and can sustain higher metabolic rates compared to their cold-blooded counterparts.--What advantages do warm-blooded sharks have in terms of hunting and survival in their environments? 
  
  ""answer3"": ""Warm-blooded sharks have several advantages in terms of hunting and survival. By maintaining a higher body temperature, these sharks can enhance their muscle performance and reaction times, allowing for quicker bursts of speed when pursuing prey. This increased metabolic rate also supports more efficient digestion and energy use, enabling them to hunt in colder waters where other predators may struggle. Furthermore, the ability to remain active in a broader range of temperatures allows warm-blooded sharks to exploit diverse ecological niches and prey on species that are less accessible to cold-blooded sharks. Overall, these adaptations contribute to their success as apex predators in various marine environments.""
}"
264014,"What are the different stages in the life cycle of a flea? {
  ""answer1"": ""The life cycle of a flea consists of four distinct stages: egg, larva, pupa, and adult. The cycle begins when an adult female flea lays eggs, which are small and white, typically in the host's environment. These eggs hatch into larvae, which are small, worm-like creatures that feed on organic debris, including flea feces. After several molts, the larvae spin cocoons and enter the pupal stage, where they undergo metamorphosis. Finally, the adult flea emerges from the pupa, ready to find a host and continue the cycle.--How long does each stage of a flea's life cycle typically last? 
  ""answer2"": ""The duration of each stage in a flea's life cycle can vary based on environmental conditions. Generally, the egg stage lasts about 2 to 10 days, the larval stage lasts between 5 to 20 days, the pupal stage can last from 5 days to several weeks, and the adult stage can live for several weeks to months, depending on the availability of a host and environmental conditions.--What factors can affect the duration of a flea's life cycle? 
  ""answer3"": ""Several factors can affect the duration of a flea's life cycle, including temperature, humidity, and the availability of food. Fleas thrive in warm and humid environments, which can accelerate their development. Conversely, cooler and drier conditions can prolong their life cycle. Additionally, the presence of a host can influence the adult flea's lifespan, as they require blood meals to reproduce and survive.""
}"
359349,"What is the definition of a midsegment in a trapezoid? {
  ""answer1"": ""A midsegment in a trapezoid is a line segment that connects the midpoints of the two non-parallel sides (legs) of the trapezoid. This segment is parallel to the bases of the trapezoid and serves to divide the trapezoid into two smaller trapezoids that are similar to the original trapezoid.--How do you calculate the length of the midsegment in a trapezoid? 
  ""answer2"": ""To calculate the length of the midsegment in a trapezoid, you can use the formula: Length of midsegment = (Base1 + Base2) / 2, where Base1 and Base2 are the lengths of the two parallel sides (bases) of the trapezoid. This formula gives you the average of the lengths of the two bases.--What are the properties of the midsegment of a trapezoid? 
  ""answer3"": ""The properties of the midsegment of a trapezoid include: 1) It is parallel to the two bases of the trapezoid. 2) Its length is equal to the average of the lengths of the two bases. 3) The midsegment divides the trapezoid into two smaller trapezoids that are similar to the original trapezoid, maintaining proportional relationships in their dimensions.""
}"
405717,"What is the location of CDG Airport in relation to central Paris? {
  ""answer1"": ""Charles de Gaulle Airport (CDG) is located approximately 25 kilometers (16 miles) northeast of central Paris. It is situated in Roissy-en-France, a commune in the Val-d'Oise department, and is easily accessible from the city via various transportation options.--How far is CDG Airport from downtown Paris? 
  ""answer2"": ""CDG Airport is about 25 kilometers (16 miles) from downtown Paris. The distance can be covered in varying times depending on the mode of transportation and traffic conditions, typically ranging from 30 minutes to over an hour.--What are the transportation options from CDG Airport to main Paris? 
  ""answer3"": ""There are several transportation options available from CDG Airport to central Paris. These include the RER B train, which connects the airport to various central stations; Roissybus, a direct bus service to the Opéra area; taxis and ride-sharing services, which provide door-to-door convenience; and shuttle services that can be pre-booked. Additionally, car rental services are available at the airport for those who prefer to drive.""
}"
443396,"What are LPS laws and what do they govern? {
  ""answer1"": ""LPS laws refer to 'Lanterman-Petris-Short' laws, which are a set of California laws that govern the involuntary civil commitment of individuals with mental health disorders. Enacted in the 1960s, these laws were designed to protect the rights of individuals with mental illness while ensuring that they receive necessary treatment. LPS laws establish the criteria and procedures for involuntary psychiatric holds, including the requirement for a mental health evaluation and the necessity of demonstrating that an individual poses a danger to themselves or others, or is gravely disabled due to mental illness. The laws also include provisions for the rights of individuals during the commitment process and outline the role of mental health professionals in determining the need for treatment.--How are LPS laws defined in legal terminology? 
  
  ""answer2"": ""In legal terminology, LPS laws are defined as a framework of statutes that outline the process and criteria for involuntary commitment of individuals with mental health issues. These laws are codified primarily in the California Welfare and Institutions Code, sections 5000 to 5500. The terminology includes terms such as 'grave disability,' which refers to a condition in which an individual is unable to provide for their basic personal needs for food, clothing, or shelter due to a mental disorder. The laws also specify the legal rights of individuals undergoing evaluation and treatment, ensuring that they are informed of their rights and have access to legal representation during the commitment process.--What are the key components or principles of LPS laws? 
  
  ""answer3"": ""The key components or principles of LPS laws include: 1) **Involuntary Commitment Criteria**: Individuals can only be committed involuntarily if they are deemed to pose a danger to themselves or others, or are gravely disabled due to mental illness. 2) **Due Process**: LPS laws emphasize the importance of due process, requiring mental health evaluations and hearings before an individual can be committed. 3) **Rights of Individuals**: The laws protect the rights of individuals, ensuring they have access to legal counsel, are informed of their rights, and are treated with dignity and respect throughout the commitment process. 4) **Treatment Focus**: The ultimate goal of LPS laws is to provide individuals with necessary treatment while safeguarding their civil liberties, promoting recovery and reintegration into society.""
}"
451602,"What is Medicare's official definition of mechanical ventilation? {
  ""answer1"": ""Medicare defines mechanical ventilation as a method of providing respiratory support to patients who are unable to breathe adequately on their own. This can include various forms of ventilatory support, such as invasive ventilation through an endotracheal tube or tracheostomy, as well as non-invasive forms such as bilevel positive airway pressure (BiPAP) or continuous positive airway pressure (CPAP). The primary goal of mechanical ventilation is to ensure adequate gas exchange and oxygenation while alleviating the work of breathing for the patient.--What criteria does Medicare use to determine coverage for mechanical ventilation? 
  ""answer2"": ""Medicare uses specific criteria to determine coverage for mechanical ventilation, which typically includes the medical necessity of the service. The patient must have a condition that results in respiratory failure or significant respiratory distress that cannot be managed with less intensive interventions. Coverage is generally granted when the patient requires continuous mechanical ventilation for at least 21 consecutive days, or if they have a chronic condition that necessitates long-term ventilatory support. Documentation from the healthcare provider must demonstrate that the patient meets these criteria and that the mechanical ventilation is essential for their health and safety.--How does Medicare differentiate between types of mechanical ventilation for reimbursement purposes? 
  ""answer3"": ""Medicare differentiates between types of mechanical ventilation for reimbursement purposes based on the mode of ventilation used and the duration of the patient's need for ventilatory support. For example, invasive mechanical ventilation is typically reimbursed differently than non-invasive ventilation. Additionally, Medicare may classify mechanical ventilation as either acute or chronic, impacting the reimbursement rates and coverage policies. Acute mechanical ventilation is often associated with short-term hospital stays, while chronic ventilation may involve home health care services. The specific coding used for billing also plays a critical role in determining reimbursement levels, with different codes assigned to various types of ventilatory support.""
}"
47923,"What is the definition of axon terminals in the context of neuroscience? {
  ""answer1"": ""In neuroscience, axon terminals, also known as terminal boutons, are the small structures at the end of an axon that transmit signals to other neurons or target cells. These terminals contain synaptic vesicles filled with neurotransmitters, which are released into the synaptic cleft during neurotransmission. The primary function of axon terminals is to facilitate communication between neurons by releasing chemical signals that can bind to receptors on the postsynaptic cell, thereby influencing its activity.--How do synaptic knobs function in the transmission of nerve signals? 
  ""answer2"": ""Synaptic knobs, another term for axon terminals, play a crucial role in the transmission of nerve signals. When an action potential reaches the synaptic knob, it triggers the opening of voltage-gated calcium channels, allowing calcium ions to flow into the terminal. This influx of calcium causes synaptic vesicles to move towards the presynaptic membrane and fuse with it, releasing neurotransmitters into the synaptic cleft. These neurotransmitters then bind to receptors on the postsynaptic neuron, leading to the propagation of the nerve signal. The efficiency and effectiveness of this process are vital for proper neuronal communication.--What is the difference between axon terminals and synaptic knobs? 
  ""answer3"": ""The terms axon terminals and synaptic knobs are often used interchangeably in the context of neuroscience, as both refer to the structures at the end of an axon that release neurotransmitters into the synaptic cleft. However, some distinctions can be made: axon terminals is a broader term that encompasses all types of terminal structures at the end of an axon, while synaptic knobs specifically refer to the terminal boutons that are involved in synaptic transmission. Thus, while all synaptic knobs are axon terminals, not all axon terminals may be referred to as synaptic knobs, especially in contexts where they may have different functions or structures.""
}"
489204,"What are the common causes of right pelvic pain in women? {
  ""answer1"": ""Common causes of right pelvic pain in women can vary widely and may include conditions such as ovarian cysts, ectopic pregnancy, pelvic inflammatory disease (PID), endometriosis, fibroids, and appendicitis. Ovarian cysts are fluid-filled sacs that can form on the surface of the ovaries and may cause pain if they rupture. Ectopic pregnancy occurs when a fertilized egg implants outside the uterus, often in a fallopian tube, leading to severe pain. Pelvic inflammatory disease is an infection of the reproductive organs that can cause significant discomfort. Endometriosis is a condition where tissue similar to the lining of the uterus grows outside it, causing pain and other symptoms. Fibroids are noncancerous growths in the uterus that can lead to pelvic pain. Appendicitis, while more common in the lower right abdomen, can also present as pelvic pain if the appendix is located in that area.--Are there specific medical conditions associated with right pelvic pain? 
  
  ""answer2"": ""Several medical conditions are specifically associated with right pelvic pain. These include ovarian conditions such as ovarian torsion, where an ovary twists and cuts off its blood supply, leading to severe pain. Pelvic inflammatory disease (PID) can also be a significant cause, as it often results from sexually transmitted infections. Other conditions include appendicitis, which can cause pain in the right lower abdomen and pelvic region, and ectopic pregnancy, which poses a serious risk if not treated promptly. Additionally, conditions like irritable bowel syndrome (IBS) or gastrointestinal issues can mimic pelvic pain and should be considered in differential diagnoses.--How can lifestyle factors contribute to right pelvic pain? 
  
  ""answer3"": ""Lifestyle factors can significantly contribute to right pelvic pain in women. For example, a sedentary lifestyle can lead to weakened pelvic muscles and increased susceptibility to conditions like pelvic floor dysfunction. Poor dietary choices may contribute to gastrointestinal issues, which can manifest as pelvic pain. Stress and anxiety can also play a role, as they may exacerbate muscle tension and lead to pain syndromes. Additionally, smoking and excessive alcohol consumption are linked to increased inflammation and may worsen conditions like endometriosis. Regular exercise, a balanced diet, and stress management techniques can help mitigate these risks and improve overall pelvic health.""
}"
490595,"What is the definition of RSA in cryptography? {
  ""answer1"": ""RSA, which stands for Rivest-Shamir-Adleman, is a public-key cryptographic system that is widely used for secure data transmission. It is based on the mathematical difficulty of factoring the product of two large prime numbers. In RSA, each user has a pair of keys: a public key, which can be shared with anyone, and a private key, which is kept secret. The security of RSA relies on the fact that, while it is easy to multiply two large primes together, it is extremely difficult to reverse the process and factor the resulting product back into its prime components.--How does RSA encryption work and what role does the key play? 
  
  ""answer2"": ""RSA encryption works by using the public key to encrypt data, which can then only be decrypted by the corresponding private key. The process begins with the generation of a key pair: the public key consists of a modulus (the product of two large primes) and an exponent, while the private key consists of the same modulus and a different exponent. When a sender wants to send a secure message, they encrypt the plaintext using the recipient's public key, transforming it into ciphertext. This ciphertext can only be decrypted back into plaintext by the recipient using their private key, ensuring that only the intended recipient can read the message.--What are the different types of keys used in RSA, and how are they generated? 
  
  ""answer3"": ""In RSA, there are two types of keys: the public key and the private key. The public key is used for encryption and can be shared openly, while the private key is used for decryption and must be kept secret. Key generation involves selecting two large prime numbers, typically hundreds of digits long, and computing their product to form the modulus. The public exponent is usually chosen as a small prime number, such as 65537, for efficiency. The private exponent is then calculated using the modular inverse of the public exponent with respect to the totient of the modulus. This process ensures that the keys are mathematically linked, allowing for secure communication.""
}"
527433,"What are the different types of dysarthria associated with cerebral palsy? {
  ""answer1"": ""Dysarthria is a motor speech disorder that can occur in individuals with cerebral palsy (CP) due to neurological impairments affecting the muscles involved in speech. The different types of dysarthria associated with cerebral palsy include: 1. **Spastic Dysarthria**: Characterized by muscle stiffness and weakness, leading to slow, effortful speech. 2. **Ataxic Dysarthria**: Results from damage to the cerebellum, causing irregular speech rhythm and poor coordination of speech muscles. 3. **Hypokinetic Dysarthria**: Often seen in individuals with basal ganglia involvement, leading to reduced speech volume and monotony. 4. **Hyperkinetic Dysarthria**: Associated with involuntary movements, resulting in unpredictable speech patterns. 5. **Mixed Dysarthria**: A combination of two or more types, reflecting the varied neurological impact of cerebral palsy.--How does cerebral palsy affect speech production in individuals with dysarthria? 
  
  ""answer2"": ""Cerebral palsy can significantly affect speech production in individuals with dysarthria by impairing the coordination and control of the muscles involved in speech. This can lead to difficulties in articulating sounds clearly, controlling the volume and pitch of the voice, and maintaining a steady rhythm while speaking. Individuals may exhibit slurred or slowed speech, reduced intelligibility, and challenges with breath support, which can affect the overall fluency of their speech. Additionally, the severity of these speech production challenges can vary widely based on the type and extent of cerebral palsy, as well as individual differences in muscle tone and control.--What are the characteristics and symptoms of each type of dysarthria in cerebral palsy? 
  
  ""answer3"": ""The characteristics and symptoms of each type of dysarthria in cerebral palsy are as follows: 1. **Spastic Dysarthria**: Speech is often strained and effortful, with a harsh voice quality. Articulation may be imprecise due to tightness in the speech muscles, leading to difficulty in producing clear consonants. 2. **Ataxic Dysarthria**: Speech may be characterized by irregularities in pitch and loudness, with a tendency for slurred or imprecise articulation. Individuals may struggle with the timing and coordination of speech, making their speech sound disjointed. 3. **Hypokinetic Dysarthria**: Individuals may speak in a soft voice with reduced range of motion in their speech muscles, resulting in a monotone quality. There may also be a tendency"
