qid,query
573724,"What factors are considered to be social determinants of health? {
  ""answer1"": ""Social determinants of health are the conditions in which people are born, grow, live, work, and age. Key factors include economic stability (income, employment, expenses), education (literacy, language, education attainment), social and community context (social integration, support systems, community engagement), health and healthcare (access to health services, health insurance coverage), and neighborhood and built environment (housing quality, access to transportation, safety, and recreational spaces). These determinants can influence health outcomes significantly, as they shape the opportunities individuals have for achieving good health.--How do social determinants of health impact individual health outcomes? 
  
  ""answer2"": ""Social determinants of health have a profound impact on individual health outcomes by influencing risk factors and access to healthcare. For instance, individuals from lower socioeconomic backgrounds may experience higher levels of stress, limited access to nutritious food, and inadequate healthcare services, which can lead to chronic health conditions such as obesity, diabetes, and hypertension. Furthermore, education levels can affect health literacy, which is crucial for making informed health choices. Overall, these determinants can create disparities in health outcomes across different populations, leading to a cycle of poor health and socioeconomic disadvantage.--In what ways can addressing social determinants of health improve public health? 
  
  ""answer3"": ""Addressing social determinants of health can significantly improve public health by creating environments that promote health equity and access to care. Initiatives that enhance economic stability, such as job training programs and affordable housing, can reduce poverty-related health issues. Improving education systems can lead to better health literacy and healthier lifestyle choices. Strengthening community networks fosters social support, which is vital for mental health. Additionally, policies that ensure equitable access to healthcare can lead to early detection and treatment of health conditions, ultimately reducing healthcare costs and improving overall community health outcomes.""
}"
833860,"What traditional dishes are commonly associated with Swiss cuisine? {
  ""answer1"": ""Swiss cuisine is characterized by its diversity, reflecting the country's multicultural influences and regional specialties. Some traditional dishes commonly associated with Swiss cuisine include:\n\n1. **Fondue**: A classic dish made by melting cheese (typically Gruyère and Emmental) and served with bread for dipping.\n2. **Rösti**: A crispy potato dish that is often compared to hash browns, typically enjoyed as a side dish or breakfast item.\n3. **Raclette**: Another cheese dish where the cheese is melted and scraped onto boiled potatoes, pickles, and cured meats.\n4. **Zürcher Geschnetzeltes**: A specialty from Zurich, this dish consists of sliced veal in a creamy white wine and mushroom sauce, served with Rösti.\n5. **Sausages**: Switzerland is known for its various sausages, such as the Cervelat and Salsiz, often enjoyed during barbecues or as part of traditional meals.\n6. **Bircher Müesli**: A popular breakfast dish made with rolled oats, grated apples, nuts, and yogurt, reflecting the Swiss emphasis on healthy eating.--How does Swiss food culture vary by region within Switzerland? 
  
  ""answer2"": ""Swiss food culture varies significantly by region, influenced by geography, climate, and the cultural backgrounds of the inhabitants. \n\n1. **German-speaking Switzerland**: This region is known for hearty dishes such as Rösti and various sausages. The cuisine often features meat and potatoes, with a strong influence from German culinary traditions.\n2. **French-speaking Switzerland**: The cuisine here leans towards lighter and more refined dishes, often featuring fresh vegetables and herbs. Dishes like Fondue and Raclette are popular, along with pastries and desserts that reflect French culinary techniques.\n3. **Italian-speaking Switzerland**: Ticino, the Italian-speaking region, showcases Mediterranean influences, with dishes that include polenta, risotto, and a variety of pasta. The use of olive oil and fresh vegetables is more prominent here.\n4. **Mountain regions**: In the Alps, traditional fare includes hearty, warming dishes that are high in calories, such as cheese-based meals and stews, catering to the needs of those living in colder climates.--What factors contribute to the popularity of certain foods in Switzerland? 
  
  ""answer3"": ""Several factors contribute to the popularity of certain foods in Switzerland:\n\n1. **Cultural Heritage**: Switzerland's diverse cultural influences, including German"
855410,"What are the active ingredients in Theraderm and how do they work? {
  ""answer1"": ""Theraderm products typically contain several active ingredients that work synergistically to improve skin health. Common active ingredients include Vitamin C (ascorbic acid), which is an antioxidant that helps protect the skin from free radical damage and promotes collagen production; Retinol, which is a derivative of Vitamin A that aids in skin cell turnover and reduces the appearance of fine lines and wrinkles; and various peptides that can help to enhance skin elasticity and firmness. These ingredients work together to rejuvenate the skin, improve texture, and promote a more youthful appearance.--What skin conditions can Theraderm help treat? 
  ""answer2"": ""Theraderm is commonly used to treat a variety of skin conditions, including but not limited to, fine lines and wrinkles, uneven skin tone, and sun damage. It can also be beneficial for individuals with acne-prone skin, as some formulations help to unclog pores and reduce breakouts. Additionally, Theraderm products may assist in improving the overall texture and appearance of the skin, making them suitable for those looking to enhance their skin's health and radiance.--Are there any side effects or precautions associated with using Theraderm? 
  ""answer3"": ""While Theraderm products are generally considered safe for most skin types, some users may experience side effects such as irritation, redness, or dryness, particularly when first starting treatment or when using products with active ingredients like retinol. It is advisable to perform a patch test before full application and to follow the usage instructions carefully. Individuals with sensitive skin or specific skin conditions should consult a dermatologist prior to use. Additionally, it is important to use sunscreen during the day when using products containing retinol, as this ingredient can increase skin sensitivity to UV radiation.""
}"
87181,"What are the primary medical conditions that lead to left ventricular hypertrophy? {
  ""answer1"": ""Left ventricular hypertrophy (LVH) is primarily caused by conditions that increase the workload on the heart. The most common medical conditions leading to LVH include hypertension (high blood pressure), aortic stenosis, and hypertrophic cardiomyopathy. Hypertension causes the heart muscle to thicken as it works harder to pump blood against increased resistance. Aortic stenosis, a narrowing of the aortic valve, forces the left ventricle to exert more effort to eject blood. Hypertrophic cardiomyopathy is a genetic condition characterized by abnormal thickening of the heart muscle without an obvious cause. Other contributing factors can include diabetes, obesity, and certain types of heart disease.--How does high blood pressure contribute to the development of left ventricular hypertrophy? 
  
  ""answer2"": ""High blood pressure is a significant risk factor for the development of left ventricular hypertrophy. When blood pressure is elevated, the heart has to pump against a greater force to circulate blood throughout the body. This increased workload causes the muscle fibers in the left ventricle to grow larger and thicker, a process known as hypertrophy. Over time, the thickened heart muscle can lead to stiffening of the ventricle, impaired diastolic function (the ability of the heart to fill with blood), and ultimately heart failure if left untreated. The relationship between hypertension and LVH underscores the importance of managing blood pressure to reduce cardiac risk.--Are there lifestyle factors that can increase the risk of developing left ventricular hypertrophy? 
  
  ""answer3"": ""Yes, several lifestyle factors can increase the risk of developing left ventricular hypertrophy. These include a sedentary lifestyle, poor dietary habits (such as high salt intake and excessive consumption of processed foods), obesity, and excessive alcohol consumption. Smoking is another significant risk factor, as it can contribute to hypertension and vascular damage. Additionally, chronic stress and lack of adequate sleep can negatively impact heart health. Adopting a healthy lifestyle that includes regular physical activity, a balanced diet, maintaining a healthy weight, and avoiding tobacco and excessive alcohol can help mitigate these risks.""
}"
87452,"What are the psychological factors that contribute to military suicide? {
  ""answer1"": ""Several psychological factors contribute to military suicide, including mental health disorders such as depression, anxiety, and post-traumatic stress disorder (PTSD). Soldiers may experience feelings of isolation, hopelessness, and a lack of purpose, particularly after returning from deployment. The stigma surrounding mental health issues in the military can prevent individuals from seeking help, exacerbating feelings of distress. Additionally, traumatic experiences during service, including combat exposure and loss of comrades, can lead to significant psychological strain. Other factors include substance abuse, relationship difficulties, and a history of suicidal behavior, all of which can increase vulnerability to suicidal thoughts and actions.--How do deployment experiences influence the risk of suicide among military personnel? 
  
  ""answer2"": ""Deployment experiences significantly influence the risk of suicide among military personnel. Combat exposure can lead to psychological trauma, including PTSD, which is a major risk factor for suicide. The stress of deployment, including long periods away from family and the challenges of reintegration into civilian life, can also contribute to mental health issues. Soldiers may face moral injury, which arises from actions taken during combat that conflict with personal values, leading to guilt and shame. Additionally, the cumulative effects of multiple deployments can increase the risk, as service members may struggle with unresolved trauma and stress over time. Support systems during and after deployment play a crucial role in mitigating these risks.--What role does access to mental health resources play in preventing suicide in the military? 
  
  ""answer3"": ""Access to mental health resources is critical in preventing suicide in the military. Comprehensive mental health services, including counseling, therapy, and support groups, can provide service members with the tools they need to cope with psychological challenges. Early intervention and regular mental health screenings can help identify at-risk individuals before crises develop. Furthermore, reducing stigma around seeking help is essential for encouraging military personnel to utilize available resources. Programs that promote resilience, coping strategies, and peer support can foster a healthier environment and reduce the incidence of suicide. The availability of resources, combined with a supportive culture, can significantly impact the mental well-being of military personnel.""
}"
915593,"What are the best meats to cook using the sous vide method? {
  ""answer1"": ""The sous vide method is particularly well-suited for cooking meats because it allows for precise temperature control, resulting in perfectly cooked, tender, and juicy dishes. Some of the best meats to cook using sous vide include: \n\n1. **Beef**: Cuts like ribeye, filet mignon, and brisket benefit greatly from sous vide cooking, as it enhances tenderness and flavor. \n2. **Pork**: Pork chops and pork tenderloin are excellent choices, allowing for a juicy and flavorful result. \n3. **Chicken**: Chicken breasts cooked sous vide remain moist and tender, eliminating the risk of overcooking. \n4. **Lamb**: Lamb chops and leg of lamb can be cooked to perfection, enhancing their natural flavors. \n5. **Fish**: Delicate fish like salmon and trout can be cooked gently, preserving their texture and moisture. \n\nOverall, sous vide is an ideal method for cooking meats that require precise temperature control to achieve the desired doneness and tenderness.--Can vegetables be cooked sous vide, and if so, which ones work best? 
  
  ""answer2"": ""Yes, vegetables can be cooked using the sous vide method, and many types yield excellent results. Sous vide allows vegetables to retain their nutrients, color, and flavor while achieving the perfect texture. Some of the best vegetables to cook sous vide include: \n\n1. **Carrots**: Cooking carrots sous vide enhances their sweetness and maintains a crisp-tender texture. \n2. **Asparagus**: Asparagus spears cooked sous vide are vibrant and tender without being mushy. \n3. **Potatoes**: Potatoes can be cooked to achieve a creamy texture, whether they are whole, diced, or mashed. \n4. **Beets**: Sous vide beets maintain their earthy flavor and vibrant color while becoming tender. \n5. **Broccoli and Cauliflower**: These can be cooked to retain their bright color and crunchiness. \n\nCooking times and temperatures can vary based on the vegetable and desired texture, making sous vide a versatile method for vegetable preparation.--What types of desserts can be prepared using sous vide cooking techniques? 
  
  ""answer3"": ""Sous vide cooking techniques can also be applied to desserts, offering unique textures and flavors that are difficult to achieve through traditional methods. Some popular desserts that can be prepared using sous vide include: \n\n1. **Custards and Puddings**: Sous vide allows for precise temperature control, resulting in smooth"
962179,"What year was the Salvation Army established? {
  ""answer1"": ""The Salvation Army was established in the year 1865. It was founded in London, England, by William Booth and his wife, Catherine Booth, as a response to the social issues and poverty they witnessed during that time.--Who founded the Salvation Army and what was their motivation? 
  ""answer2"": ""The Salvation Army was founded by William Booth, who was motivated by a deep desire to address the spiritual and physical needs of the poor and marginalized in society. He aimed to provide not only religious salvation but also practical assistance to those suffering from poverty, addiction, and social injustice.--In which city did the Salvation Army originate? 
  ""answer3"": ""The Salvation Army originated in London, England. It began as the East London Christian Mission, which later transformed into the Salvation Army, adopting a military structure and name to reflect its mission of 'saving souls' and helping those in need.""
}"
