qid,query
2005861,"three countries, 1984 novel, George Orwell, Oceania, Eastasia, Eurasia, dystopian literature, totalitarian regimes, political geography, literary analysis, Cold War context, surveillance state, propaganda, authoritarianism, fictional nations--1984, George Orwell, dystopian literature, totalitarianism, countries in 1984, Oceania, Eurasia, Eastasia, fictional countries, political themes, novel analysis, literary context, Cold War, surveillance state, propaganda, authoritarian regimes--three countries, 1984, Orwell, dystopia, totalitarianism, Oceania, Eurasia, Eastasia, political entities, fictional nations, novel analysis, geopolitical landscape, literary context--1984 novel, George Orwell, Oceania, Eastasia, Eurasia, totalitarianism, dystopian literature, political allegory, surveillance state, authoritarian regimes, historical context, literary analysis, themes in 1984, character analysis, propaganda in 1984, significance of the three countries, Cold War parallels, world politics in 1984, fictional countries in literature.--1984, countries, George Orwell, dystopia, totalitarianism, Oceania, Eastasia, Eurasia, novel, literature, political themes, fictional nations, character analysis, historical context, societal structure"
2006211,"Auslan, interpreted performance, meaning, definition, sign language, accessibility, deaf culture, theatre, interpretation, communication, performance art, audience engagement, visual language, inclusive events, live performance, deaf community, translation, artistic expression, cultural representation--Auslan, interpreted performance, meaning, definition, accessibility, sign language, theatre, deaf community, performance interpretation, cultural inclusion, communication access, live events, audience engagement, interpreting services, visual language, artistic expression--auslan, interpreted performance, meaning, definition, sign language, accessibility, deaf culture, theatre, interpretation, communication, live performance, inclusive, audience engagement, visual language, artistic expression, performance arts, deaf community, interpretation services, cultural representation, event accessibility--Auslan, interpreted performance, meaning, definition, sign language, accessibility, theater, deaf community, performance art, communication, interpretation, cultural significance, inclusive events, audience experience, visual language, live performance, artistic expression, deaf culture, interpretation services, performance accessibility.--Auslan, interpreted performance, meaning, definition, sign language, accessibility, deaf culture, theatre, communication, interpretation, performance arts, inclusive events, audience engagement, visual language, deaf community, live performance, interpretation services, cultural representation, event accessibility, arts education"
2006375,"quotient, power, exponent, mathematical definition, algebra, division, properties of exponents, examples, calculation, educational resources, explanation, related terms, applications, simplification, rules of exponents--quotient of a power definition, quotient of powers rule, exponent division, power of a quotient, mathematical properties of exponents, quotient of powers examples, simplifying powers, exponent rules, algebraic expressions, power rules in mathematics, educational resources on exponents, quotient of powers practice problems--quotient, power, exponent, mathematical definition, division of powers, properties of exponents, algebra, math terminology, examples, calculations, simplification, rules of exponents, educational resources, teaching concepts, numerical expressions--quotient of a power definition, quotient of a power example, quotient of a power formula, quotient of a power rule, properties of quotient of a power, quotient of a power explained, applications of quotient of a power, quotient of a power in algebra, quotient of a power with variables, understanding quotient of a power, quotient of a power vs product of a power, quotient of a power practice problems, quotient of a power in mathematics, visualizing quotient of a power, quotient of a power exercises--quotient, power, exponent, mathematical definition, division of powers, algebraic expressions, properties of exponents, examples, related terms, calculations, simplification, educational resources, mathematical concepts, understanding exponents, quotient rule, power rule, instructional materials, tutorials, practice problems"
2006394,"Septrin, healing properties, uses of Septrin, Septrin indications, Septrin benefits, Septrin treatment, Septrin infections, Septrin side effects, antibiotics, respiratory infections, urinary tract infections, bacterial infections, dosage of Septrin, Septrin mechanism, Septrin alternatives.--septrin uses, septrin indications, septrin benefits, septrin side effects, septrin dosage, septrin mechanism of action, septrin for infections, septrin antibiotic, septrin treatment, septrin reviews, septrin patient information, septrin contraindications, septrin interactions, septrin effectiveness, septrin alternatives--Septrin, healing properties, antibacterial, antibiotic, infections, respiratory infections, urinary tract infections, skin infections, dosage, side effects, mechanism of action, indications, contraindications, patient reviews, medical studies, drug interactions, prescription information, alternative treatments, pharmacology, clinical uses.--septrin uses, septrin benefits, septrin indications, septrin side effects, septrin mechanism of action, septrin dosage, septrin for infections, septrin antibiotic properties, septrin treatment guidelines, septrin reviews, septrin and allergies, septrin alternatives, septrin interactions, septrin for respiratory infections, septrin for urinary tract infections--Septrin, healing properties, antibiotic, bacterial infections, respiratory infections, skin infections, urinary tract infections, dosage, side effects, mechanism of action, alternative treatments, drug interactions, patient reviews, clinical studies, prescription information."
2006627,"311 service, non-emergency services, municipal services, city services, community assistance, local government, public inquiries, citizen reporting, urban services, information hotline, complaint reporting, city information, emergency services, public safety, service request, neighborhood services, local issues, government resources, civic engagement, community resources--311 service, 311 hotline, non-emergency services, municipal services, community assistance, city services, public services, local government, reporting issues, citizen complaints, service requests, emergency management, urban services, public safety, government resources--311, municipal services, non-emergency, city services, community assistance, local government, public safety, service request, information hotline, citizen reporting, complaint resolution, urban services, government resources, public inquiries, service access--311 services, 311 phone number, 311 meaning, 311 city services, 311 non-emergency, 311 reporting, 311 information line, 311 complaints, 311 assistance, 311 government services, 311 hotline, 311 service request, 311 community resources, 311 local services, 311 help line--311 services, non-emergency assistance, municipal services, city information, community resources, public services, local government, citizen reporting, complaint resolution, service requests, urban management, civic engagement, hotline services, city departments, public safety, neighborhood issues, service availability, government transparency, local issues, community support."
2007055,"sulfa drugs, sulfonamide antibiotics, sulfa medications, uses of sulfa, sulfa allergies, sulfa treatment, bacterial infections, antibiotic therapy, side effects of sulfa, history of sulfa drugs, alternatives to sulfa, mechanism of action, sulfa for UTIs, sulfa for skin infections, sulfa and pregnancy, prescribing sulfa, sulfa resistance, patient education on sulfa--sulfa drugs, sulfonamides, antibiotic treatment, sulfa allergy, medical uses of sulfa, side effects of sulfa, sulfa medications, bacterial infections, history of sulfa drugs, sulfa for infections, sulfa and penicillin, alternatives to sulfa, sulfa treatment effectiveness, prescription sulfa drugs--sulfa drugs, sulfonamides, antibiotic, bacterial infection, treatment, medication, side effects, mechanisms, uses, history, alternatives, allergy, efficacy, dosage, prescription, pharmacology, patient information--sulfa drugs, sulfa medications, sulfa allergy treatment, sulfa antibiotics, sulfanilamide, uses of sulfa, sulfa side effects, how sulfa works, sulfa versus penicillin, history of sulfa drugs, sulfa for infections, sulfa in medicine, sulfa treatment for UTIs, alternative treatments to sulfa, sulfa drug interactions--sulfa drugs, sulfonamides, antibiotic treatment, bacterial infections, medication uses, side effects, history of sulfa, mechanism of action, alternatives to sulfa, medical applications, drug interactions, patient information, prescription guidelines, pharmacology, clinical studies"
2007419,"cold bridging, thermal bridging, insulation, energy efficiency, building construction, heat loss, condensation, moisture control, thermal performance, energy loss, building envelope, HVAC systems, architectural design, passive house, energy audit, construction materials, building physics, thermal resistance, residential buildings, energy conservation--cold bridging, thermal bridging, insulation, energy efficiency, heat loss, building construction, architectural design, moisture control, thermal performance, energy conservation, building envelope, heat transfer, cold spots, condensation issues, home improvement, building science--cold bridging, thermal bridging, insulation, energy efficiency, building defects, heat loss, construction issues, moisture problems, building regulations, energy audit, home improvement, thermal performance, insulation materials, building envelope, energy conservation--cold bridging definition, cold bridging explanation, cold bridging effects, cold bridging solutions, cold bridging prevention, cold bridging examples, cold bridging insulation, cold bridging in buildings, thermal bridging, energy efficiency cold bridging, cold bridging and condensation, cold bridging repair, cold bridging materials, cold bridging analysis, cold bridging terminology--cold bridging, thermal bridging, insulation, energy efficiency, building physics, heat transfer, construction defects, moisture control, thermal performance, energy loss, building envelope, condensation risk, thermal resistance, architectural design, energy conservation"
2008871,"phylum, Ascaris, pinworm, nematoda, roundworms, helminths, taxonomy, parasitology, classification, nematodes, intestinal parasites, soil-transmitted, morphology, life cycle, host organisms--Ascaris, pinworm, phylum, nematoda, roundworms, helminths, parasitic worms, taxonomy, classification, nematodes, human parasites, intestinal worms, disease, life cycle, morphology--Nematoda, roundworms, helminths, parasitic worms, Ascaris lumbricoides, Enterobius vermicularis, classification, taxonomy, phylum identification, nematodes, intestinal parasites, morphology, life cycle, human parasites, soil-transmitted helminths--phylum of ascaris, phylum of pinworm, nematoda classification, ascaris and pinworm taxonomy, roundworms phylum, helminthes classification, parasitic worms phylum, nematodes characteristics, ascaris life cycle, pinworm life cycle, human parasites phylum, nematoda examples, roundworm diseases, parasitic infections phylum, helminth classification--Ascaris, pinworm, phylum, nematoda, roundworms, helminths, parasitic worms, taxonomy, classification, nematodes, intestinal parasites, human parasites, biology, zoology, organism classification, related species"
2009553,"Cotswolds, etymology, name origin, historical significance, geography, cultural heritage, English countryside, limestone hills, ancient trade routes, local dialect, agriculture, tourism, historical landmarks, natural beauty, regional history--Cotswolds history, Cotswolds name origin, Cotswolds etymology, Cotswolds geography, Cotswolds culture, Cotswolds attractions, Cotswolds villages, Cotswolds landscape, Cotswolds heritage, Cotswolds tourism, Cotswolds dialect, Cotswolds architecture, Cotswolds economy, Cotswolds flora and fauna, Cotswolds historical significance--Cotswolds, etymology, name origin, historical significance, geography, landscape, wool trade, local dialect, cultural heritage, tourism, historical landmarks, regional features, natural beauty, settlement history, English countryside--Cotswolds name origin, Cotswolds etymology, history of Cotswolds, Cotswolds meaning, Cotswolds geographical features, Cotswolds historical significance, Cotswolds cultural heritage, Cotswolds linguistic roots, Cotswolds local legends, Cotswolds historical landmarks, Cotswolds tourism, Cotswolds natural beauty, Cotswolds rural landscape, Cotswolds traditional architecture, Cotswolds historical context--Cotswolds, etymology, history, geography, name origin, landscape, cultural significance, local dialect, wool industry, tourism, historical landmarks, natural beauty, regional characteristics, English countryside, ancient settlements, place names, heritage."
2009871,"Massachusetts Bay Colony, founding reasons, Puritan migration, religious freedom, economic opportunities, colonial history, New England settlement, government structure, social conditions, indigenous relations, 17th century, historical significance, early American colonies, theocracy, trade and commerce, settlement patterns, cultural impact, dissenters, charter, leadership.--Massachusetts Bay Colony, founding reasons, Puritan settlement, religious freedom, economic opportunities, colonial history, New England colonies, 17th century, migration patterns, governance, cultural influences, social structure, historical significance--Massachusetts Bay Colony, founding reasons, Puritan migration, religious freedom, economic opportunities, colonial history, New England settlements, John Winthrop, 17th century, social structure, political motivations, religious persecution, settlement patterns, historical context, cultural influences--Massachusetts Bay Colony, founding reasons, Puritan migration, religious freedom, economic opportunities, colonial history, New England settlement, 17th century, political motivations, social factors, governance structure, indigenous relations, key figures, historical significance, early American colonies, Puritan beliefs, settlement patterns, colonial charter, religious persecution, economic ventures--Massachusetts Bay Colony, founding reasons, Puritan settlement, religious freedom, economic opportunities, colonial history, New England, 17th century, migration patterns, governance, social structure, indigenous relations, trade, agriculture, cultural development"
2012431,"ebola prevention methods, ebola vaccination, ebola transmission prevention, ebola safety measures, ebola outbreak control, ebola hygiene practices, ebola awareness campaigns, ebola risk reduction, ebola public health strategies, ebola education initiatives--ebola prevention methods, ebola transmission prevention, ebola safety measures, ebola vaccination, ebola outbreak control, ebola hygiene practices, ebola awareness campaigns, ebola risk reduction, ebola public health strategies, ebola educational resources, ebola protective equipment, ebola community health initiatives, ebola disease prevention tips, ebola infection control--ebola prevention methods, ebola vaccination, ebola transmission, ebola outbreak control, ebola hygiene practices, ebola public health measures, ebola education, ebola risk factors, ebola community awareness, ebola protective equipment, ebola symptoms, ebola treatment options, ebola travel guidelines, ebola containment strategies, ebola safe practices--ebola prevention methods, ebola prevention strategies, how to prevent ebola, ebola vaccination information, ebola outbreak prevention, ebola safety guidelines, ebola transmission prevention, ebola risk reduction, ebola public health measures, ebola awareness and prevention, ebola hygiene practices, ebola education resources, ebola community prevention efforts, ebola protective measures, ebola prevention tips--ebola prevention methods, ebola vaccine, ebola transmission, ebola symptoms, ebola outbreak control, ebola treatment, public health measures, ebola awareness campaigns, personal protective equipment, community education, ebola risk factors, ebola quarantine practices, ebola hygiene practices, global health initiatives, ebola research advancements"
2012536,"pork tenderloin recipe, oven cooking tips, marinating pork, seasoning pork tenderloin, cooking time pork tenderloin, temperature for pork tenderloin, pork tenderloin sides, baked pork tenderloin, juicy pork tenderloin, easy pork recipes, pork tenderloin marinade, oven roasted pork, tenderloin cooking methods, pork tenderloin glaze, herb crusted pork tenderloin--pork tenderloin recipes, oven cooking techniques, pork steak marinade, cooking time, temperature guide, seasoning ideas, side dishes for pork, easy pork recipes, tenderloin preparation, oven-baked pork, flavor pairings, cooking tips, meal prep, pork doneness, sauce suggestions--pork tenderloin recipe, oven cooking tips, tenderloin marinade, seasoning ideas, cooking temperature, cooking time, side dishes, meat thermometer, roasting techniques, glaze options, preparation steps, flavor combinations, serving suggestions, easy recipes, quick meals--pork tenderloin steaks recipe, oven cooking pork tenderloin, best way to cook pork tenderloin, pork tenderloin steak marinade, cooking times for pork tenderloin, oven roasted pork tenderloin tips, seasoning pork tenderloin steaks, pork tenderloin steak temperature, easy pork tenderloin recipes, juicy pork tenderloin in oven--pork tenderloin recipe, oven cooking tips, marinating pork, seasoning ideas, cooking times, internal temperature, side dishes, sauce options, tenderloin preparation, foil wrapping, roasting techniques, flavor pairings, meal prep, kitchen tools, serving suggestions"
2013306,"Gehan Homes, company profile, home builder, Texas real estate, residential construction, Gehan Homes history, Gehan Homes reviews, Gehan Homes locations, Gehan Homes floor plans, Gehan Homes communities, home buying process, new home construction, Gehan Homes awards, customer testimonials, Gehan Homes contact information--Gehan Homes, company profile, home builder, Texas real estate, customer reviews, housing market, new construction, home buying, community developments, floor plans, pricing, energy efficiency, awards, testimonials, locations, contact information, social media, industry news, home design trends, virtual tours--Gehan Homes, company profile, home builder, Texas real estate, housing market, home construction, residential development, customer reviews, company history, locations, floor plans, community amenities, awards, industry rankings, contact information, social media presence, testimonials, home buying process, financing options, energy-efficient homes, sustainability practices, new developments.--Gehan Homes history, Gehan Homes reviews, Gehan Homes locations, Gehan Homes floor plans, Gehan Homes contact information, Gehan Homes customer service, Gehan Homes new developments, Gehan Homes pricing, Gehan Homes community features, Gehan Homes testimonials, Gehan Homes awards, Gehan Homes sustainability initiatives, Gehan Homes financing options, Gehan Homes virtual tours, Gehan Homes model homes, Gehan Homes home buying process, Gehan Homes real estate market, Gehan Homes partnerships, Gehan Homes social media, Gehan Homes career opportunities--Gehan Homes, home builder, residential construction, Texas homes, new homes, home development, real estate, home design, customer reviews, housing market, energy-efficient homes, floor plans, home financing, community amenities, home buying process"
2016333,"ground beef empanadas recipe, empanada dough, filling ideas, cooking tips, baking empanadas, frying empanadas, seasoning ground beef, traditional empanadas, Argentine empanadas, Latin American recipes, homemade empanadas, easy empanada recipes, ground beef alternatives, dipping sauces, meal prep empanadas, freezer-friendly empanadas, variations of empanadas, serving suggestions, party appetizers, quick empanada recipes--ground beef empanadas recipe, homemade empanadas, empanada dough, cooking tips for empanadas, beef empanada filling, baking empanadas, frying empanadas, Latin American cuisine, easy empanada recipes, empanada variations, ground beef recipes, savory pastries, meal prep empanadas, party food ideas, traditional empanadas--ground beef recipes, empanada dough, cooking tips, filling variations, baking empanadas, frying empanadas, seasoning ground beef, Latin American cuisine, meal prep, easy appetizers, homemade empanadas, ground beef alternatives, empanada sauce, freezing empanadas, serving suggestions--ground beef empanadas recipe, easy empanadas with ground beef, homemade empanadas, empanada dough recipe, baking ground beef empanadas, frying empanadas, ground beef filling ideas, empanadas with cheese, spicy ground beef empanadas, traditional empanada recipes, empanadas sauce suggestions, gluten-free empanada dough, ground beef empanadas for parties, quick empanada recipes, freezing empanadas, air fryer empanadas, savory pastry recipes, Latin American snacks, cooking tips for empanadas, ground beef appetizers--ground beef empanadas recipe, empanada dough, cooking tips, filling variations, baking vs frying, seasoning ideas, quick meals, Latin American cuisine, appetizer ideas, meal prep, family-friendly recipes, easy snacks, comfort food, cultural dishes, homemade empanadas"
2017299,"US Open golf location 2023, US Open venue 2023, US Open golf championship site, US Open golf tournament location, 2023 US Open golf event, US Open golf date and place, US Open golf host city 2023, US Open golf course 2023, US Open golf schedule 2023--US Open golf location 2023, US Open golf venue 2023, US Open golf tournament site 2023, US Open golf championship location, US Open golf course 2023, US Open golf event details, US Open golf schedule 2023, US Open golf dates 2023, US Open golf host city 2023, US Open golf map 2023--US Open golf location 2023, US Open golf venue 2023, US Open golf schedule 2023, US Open golf dates 2023, US Open golf host city 2023, US Open golf course 2023, US Open golf championship 2023, US Open golf site 2023, US Open golf tournament 2023, US Open golf information 2023--US Open golf location 2023, US Open golf venue 2023, US Open golf tournament site 2023, where is US Open golf 2023, US Open golf championship location, US Open golf course 2023, US Open golf event details 2023, US Open golf schedule 2023, US Open golf host city 2023, US Open golf dates 2023--US Open golf location 2023, US Open golf venue, 2023 golf tournaments, golf championship schedule, US Open dates, golf event calendar, major golf tournaments, golf course hosting US Open, golf tournament location, US Open history, golf event details, sports events 2023, professional golf tournaments."
2025747,"suicidal statements, history of suicide, mental health coding, suicide prevention, psychological research, historical analysis, data on suicide, coding practices, mental health statements, suicide statistics, intervention strategies, behavioral health, clinical coding, suicide trends, historical context--suicidal statements history, suicidal ideation coding, mental health coding, suicide prevention coding, historical analysis of suicide, coding for mental health, suicide risk assessment, psychological statements coding, behavioral health history, suicide research data, coding practices for mental health, historical suicidal trends, suicide documentation standards, mental health data analysis, suicide statement examples--suicidal statements, history of suicide, mental health, suicide prevention, psychological research, self-harm, crisis intervention, historical context, mental illness, behavioral studies, suicide awareness, therapy techniques, support resources, risk factors, coping strategies--code for history of suicidal statements analysis, code for tracking suicidal statements, programming for suicide prevention data, historical data on suicidal statements, coding for mental health research, suicide statement trends analysis, data mining suicidal statements, programming for mental health statistics, software for analyzing suicidal trends, coding historical suicide data, algorithms for tracking suicidal ideation, machine learning for suicide statement analysis, coding for psychological research, data visualization of suicidal statements, programming for suicide risk assessment--mental health, suicide prevention, historical analysis, psychological research, self-harm statements, emotional well-being, crisis intervention, behavioral patterns, social stigma, therapy techniques, coping mechanisms, risk factors, qualitative research, data analysis, support resources"
