qid,query
2000511,"Bahamas weather, October climate, temperature trends, average temperatures, Bahamas climate data, end of October, historical weather, tropical climate, seasonal temperatures, weather patterns, travel weather, vacation planning, Caribbean weather, humidity levels, precipitation averages--Bahamas weather, October climate, average temperature Bahamas, Bahamas October weather, historical weather Bahamas, Bahamas seasonal temperatures, end of October weather, tropical climate Bahamas, average monthly temperature Bahamas, weather patterns Bahamas October--Bahamas weather, October climate, average temperature Bahamas, Bahamas October weather, historical temperature Bahamas, Bahamas seasonal temperatures, Caribbean weather, travel Bahamas October, Bahamas climate data, weather patterns Bahamas, average highs Bahamas, average lows Bahamas, October rainfall Bahamas, Bahamas weather averages--average bahamas temperature october, bahamas weather end of october, october climate bahamas, bahamas average temperature fall, bahamas october weather patterns, bahamas temperature trends, best time to visit bahamas, bahamas october travel tips, bahamas seasonal weather, october bahamas vacation, bahamas temperature history, bahamas humidity in october, bahamas rainfall october, bahamas average sea temperature, weather forecast bahamas october--Bahamas, average temperature, October weather, climate data, historical temperatures, tropical climate, weather patterns, seasonal temperatures, end of October, Bahamas climate, travel tips, weather averages, temperature trends, humidity levels, rainfall statistics"
2000719,"business architect, role definition, job description, responsibilities, skills, qualifications, career path, competencies, organizational structure, business analysis, strategic planning, stakeholder management, enterprise architecture, project management, process improvement, industry standards, best practices, certification, salary expectations, job market trends--business architect responsibilities, business architect skills, business architect competencies, business architect job description, business architect qualifications, business architect career path, business architect frameworks, business architect best practices, business architect tools, business architect certification--business architect, role definition, job description, responsibilities, skills required, qualifications, career path, industry standards, competencies, organizational impact, strategic alignment, project management, stakeholder engagement, enterprise architecture, business analysis, transformation initiatives, best practices, professional development, certification, salary expectations--business architect responsibilities, business architect skills, business architect job description, business architect competencies, business architect career path, business architect salary, business architect vs solutions architect, business architect training, business architect frameworks, business architect best practices--business architect, role definition, job description, responsibilities, skills required, qualifications, organizational structure, business strategy, enterprise architecture, stakeholder engagement, process improvement, project management, career path, industry standards, best practices, competency framework, role expectations, job market trends, professional development, certification programs"
2001532,"family advocate roles, family advocacy services, duties of a family advocate, family support advocate examples, responsibilities of family advocates, family advocacy case studies, family advocate job description, family advocate success stories, family advocacy organizations, family advocate skills, family advocacy programs, family support services, community family advocates, family advocacy impact, family advocate training--family advocate roles, family advocate responsibilities, family advocacy services, family support specialist, family advocacy programs, family advocate job description, family advocate duties, family advocacy organizations, family advocate training, family advocate skills, family advocacy case studies, family support resources, family advocacy impact, family advocate examples, family advocate testimonials--family advocate roles, family advocacy services, responsibilities of family advocates, family support roles, family advocacy examples, functions of family advocates, family advocate case studies, family advocacy organizations, benefits of family advocacy, family advocate job description--family advocate roles, family advocate responsibilities, duties of a family advocate, family advocate job description, family advocate services, family advocacy examples, family advocate case studies, family support roles, family advocate impact, family advocacy organizations, family advocate skills, family advocate training, benefits of family advocacy, family advocate testimonials, family advocate success stories--family advocate roles, family advocacy services, family support, child welfare advocate, family law advocate, community resources, parenting support, advocacy in family court, family mediation, legal support for families, family counseling, social services, family rights, family empowerment, case management, family intervention, advocacy strategies, family dynamics, support networks, conflict resolution"
2001908,"replace burners, Ducane grill, grill maintenance, burner installation, grill parts, grill repair, Ducane replacement parts, outdoor cooking, grill troubleshooting, burner types, DIY grill repair, grill accessories, cooking equipment, home improvement, gas grill maintenance--replace ducane grill burners, ducane grill burner replacement guide, ducane grill parts, how to change burners ducane grill, ducane grill maintenance, burner installation ducane grill, ducane grill repair tips, buy ducane grill burners, ducane grill troubleshooting, replace grill burners, ducane grill model compatibility, step-by-step burner replacement, grill burner types, ducane grill accessories, safe burner replacement methods--replace burners, Ducane grill, grill maintenance, burner installation, grill repair, replacement parts, Ducane parts, grill troubleshooting, outdoor cooking, gas grill, burner types, DIY grill repair, grill accessories, maintenance tips, cooking equipment--replace burners ducane grill, ducane grill burner replacement guide, how to change burners ducane grill, ducane grill burner installation, ducane grill parts replacement, troubleshooting ducane grill burners, best burners for ducane grill, ducane grill maintenance tips, where to buy ducane grill burners, ducane grill repair instructions--replace burners, Ducane grill, grill maintenance, burner installation, grill repair, outdoor cooking, grill parts, burner types, DIY grill repair, grill replacement parts, cooking equipment, gas grill maintenance, burner replacement guide, grill troubleshooting, outdoor grill care"
2001975,"insert notes PowerPoint, add speaker notes, PowerPoint slide notes, create notes section, PowerPoint tips, presentation notes, editing PowerPoint slides, notes functionality, PowerPoint features, using notes in presentations, PowerPoint tutorial, slide show notes, enhancing PowerPoint, effective presentations, PowerPoint guide--insert notes PowerPoint, add speaker notes PowerPoint, PowerPoint notes section, create notes PowerPoint, PowerPoint slide notes tutorial, PowerPoint presentation notes, editing notes PowerPoint, PowerPoint notes view, managing notes in PowerPoint, PowerPoint tips for notes--PowerPoint, insert notes, under slide, add notes, speaker notes, presentation tips, PowerPoint features, editing slides, note-taking, PowerPoint tutorial, slide notes, presentation design, enhance presentation, PowerPoint guide, notes section, visual aids, effective presentations, audience engagement, slide management--insert notes PowerPoint, add speaker notes PowerPoint, PowerPoint slide notes tutorial, PowerPoint notes section, create notes in PowerPoint, editing notes PowerPoint, PowerPoint presentation notes, insert comments PowerPoint, notes view PowerPoint, PowerPoint tips for notes, slide notes feature PowerPoint, using notes in PowerPoint, PowerPoint notes management, PowerPoint presentation tips, speaker notes best practices--PowerPoint, insert notes, slide notes, add comments, speaker notes, presentation tips, PowerPoint features, editing slides, note-taking, enhancing presentations, slide management, PowerPoint tutorial, user guide, visual aids, presentation design, effective communication, audience engagement, PowerPoint shortcuts, note organization, slide preparation"
2002146,"yucca propagation, yucca plant care, rooting yucca cuttings, yucca plant growing tips, yucca plant roots, plant propagation techniques, indoor yucca care, yucca soil requirements, yucca watering needs, yucca plant health, yucca varieties, yucca plant sunlight requirements, yucca plant pests, yucca plant diseases, yucca transplanting methods--yucca plant propagation, rooting yucca cuttings, yucca plant care, growing yucca from cuttings, yucca plant root system, yucca plant growth tips, yucca plant watering, indoor yucca plant care, yucca plant soil requirements, yucca plant sunlight needs--yucca propagation, yucca cuttings, yucca care, root yucca plant, yucca planting tips, yucca soil requirements, yucca watering needs, yucca growth conditions, yucca transplanting, yucca species, indoor yucca care, outdoor yucca planting, yucca pests, yucca diseases, yucca maintenance, yucca sunlight requirements--rooting yucca plant, propagate yucca plant, yucca plant care, yucca plant cuttings, growing yucca from cuttings, yucca plant propagation methods, how to grow yucca, yucca plant soil requirements, yucca plant watering tips, yucca plant growth conditions, yucca plant indoor care, yucca plant outdoor care, yucca plant pests and diseases, yucca plant sunlight needs, yucca plant fertilizer, yucca plant maintenance, yucca plant types, yucca plant lifecycle, yucca plant pruning, yucca plant repotting--yucca propagation, yucca cuttings, rooting techniques, plant care, indoor gardening, soil requirements, water needs, sunlight exposure, propagation methods, plant hormones, container gardening, seasonal planting, growth conditions, root development, yucca species"
2002269,"rabbit growth rate, rabbit development stages, rabbit growth timeline, rabbit age milestones, rabbit size comparison, rabbit breed growth differences, rabbit nutrition impact on growth, rabbit weight gain, rabbit growth chart, rabbit lifespan growth patterns--rabbit growth rate, rabbit development stages, rabbit maturity timeline, rabbit size growth chart, rabbit age growth comparison, factors affecting rabbit growth, average rabbit weight by age, rabbit breed growth differences, rabbit feeding for growth, rabbit growth milestones--rabbit growth rate, rabbit development stages, rabbit age milestones, rabbit growth timeline, rabbit size at different ages, factors affecting rabbit growth, rabbit breed growth comparisons, rabbit weight gain, rabbit growth chart, young rabbit care--rabbit growth rate, rabbit growth stages, rabbit growth timeline, rabbit size at maturity, rabbit growth chart, factors affecting rabbit growth, average rabbit weight, rabbit breed growth differences, rabbit development milestones, nutrition for growing rabbits--rabbit growth rate, rabbit development stages, rabbit size at maturity, rabbit growth chart, factors affecting rabbit growth, average rabbit weight, rabbit breeds growth comparison, rabbit nutrition for growth, lifespan of rabbits, rabbit growth timeline"
2002533,"average cost, tree planning, 8-foot tree, tree installation, landscaping expenses, tree purchase price, planting costs, maintenance fees, tree care, budget for trees, cost breakdown, landscaping budget, tree types, nursery prices, local tree services--average cost tree planning, tree planting expenses, cost of 8-foot tree, tree installation price, landscaping tree costs, tree purchase price, average tree cost, tree planting budget, tree care expenses, landscaping costs--average cost, plan, 8-foot tree, tree planting, landscaping expenses, tree care, maintenance costs, nursery prices, planting services, tree types, local prices, gardening budget, cost estimation, tree installation, horticulture costs--average cost tree planning, 8 foot tree expenses, tree planting budget, cost of planting trees, tree care costs, landscaping tree prices, average tree installation cost, 8 foot tree price estimate, tree planting cost breakdown, factors affecting tree planting cost--average cost, plan, 8' tree, tree planting, landscaping expenses, tree care, cost breakdown, tree selection, garden design, maintenance costs, nursery prices, tree installation, budgeting for trees, tree types, local prices"
2002798,"dry aging, wet aging, steak aging methods, aging process, meat aging techniques, flavor enhancement, tenderness improvement, aging time, temperature control, humidity levels, aging containers, sous vide aging, dry aging bags, flavor profiles, meat science, culinary techniques, steak preparation, beef aging, aging benefits, cooking tips, steak quality--dry aging, wet aging, steak aging techniques, aging beef, aging process, steak preparation, meat tenderizing, flavor enhancement, aging time, temperature control, humidity levels, aging containers, sous vide aging, aging methods, dry aging bags, aging steak at home--dry aging, wet aging, steak aging techniques, aging process, flavor enhancement, tenderness improvement, aging time, temperature control, humidity levels, steak cuts, aging methods, sous vide, meat science, storage conditions, culinary tips--dry aging steak, wet aging steak, aging steak at home, best methods to age steak, steak aging time, aging steak in fridge, benefits of aging steak, aging steak techniques, dry aging process, wet aging process, steak aging tips, how long to age steak, aging beef tips, steak flavor enhancement, meat aging science, home aging steak, aging steak for tenderness, steak aging equipment, optimal aging conditions, aging steak recipes--dry aging, wet aging, steak aging techniques, aging process, meat tenderization, flavor enhancement, aging time, storage conditions, temperature control, humidity levels, aging methods, beef maturation, culinary techniques, steak quality, aging benefits"
2003157,"frozen ham steak, nuwave oven, cooking instructions, thawing ham steak, cooking time, temperature settings, recipes, ham steak preparation, oven cooking tips, meal ideas, glaze options, seasoning suggestions, food safety, reheating tips, kitchen appliances--frozen ham steak, nuwave oven, cooking instructions, thawing ham, cooking time, temperature settings, recipes, meal prep, kitchen tips, ham steak recipes, microwave options, grilling, air frying, food safety, seasoning ideas--frozen ham steak, nuwave oven, cooking instructions, defrosting, cooking temperature, cooking time, recipes, ham steak preparation, microwave alternative, seasoning suggestions, meat thermometer, oven settings, food safety, meal ideas, glaze options--frozen ham steak recipe, nuwave oven cooking instructions, thawing frozen ham steak, cooking time for ham steak, nuwave oven settings, ham steak temperature guide, frozen ham steak tips, easy ham steak meals, reheating frozen ham steak, nuwave oven recipes, cooking frozen meat in nuwave, ham steak seasoning ideas, quick ham steak dinner, frozen ham steak glaze, nuwave oven advantages--frozen ham steak, Nuwave oven, cooking frozen ham, Nuwave cooking guide, ham steak recipes, frozen meat cooking, Nuwave oven tips, ham steak preparation, quick cooking methods, defrosting frozen ham, Nuwave temperature settings, ham steak seasoning, cooking times, meal prep, kitchen appliances"
2003322,"ceftriaxone dilution instructions, ceftriaxone vial preparation, ceftriaxone mixing guidelines, ceftriaxone dosage, ceftriaxone administration, sterile technique ceftriaxone, ceftriaxone reconstitution, ceftriaxone solution preparation, ceftriaxone storage conditions, ceftriaxone compatibility, intravenous ceftriaxone, ceftriaxone injection method, ceftriaxone concentration, ceftriaxone safety precautions, ceftriaxone handling guidelines--ceftriaxone dilution instructions, ceftriaxone reconstitution guidelines, ceftriaxone mixing techniques, ceftriaxone preparation steps, ceftriaxone dosage form, ceftriaxone administration methods, ceftriaxone vial instructions, ceftriaxone solution preparation, ceftriaxone storage conditions, ceftriaxone compatibility with solvents, ceftriaxone concentration adjustments, ceftriaxone intravenous use, ceftriaxone injection guidelines, ceftriaxone safety precautions, ceftriaxone pharmacology--ceftriaxone dilution instructions, ceftriaxone reconstitution, ceftriaxone preparation, ceftriaxone dosage form, ceftriaxone mixing guidelines, ceftriaxone solvent options, ceftriaxone storage, ceftriaxone administration routes, ceftriaxone compatibility, ceftriaxone concentration, ceftriaxone vial size, ceftriaxone infusion rate, ceftriaxone side effects, ceftriaxone safety precautions, ceftriaxone usage in pediatrics--ceftriaxone dilution instructions, ceftriaxone vial preparation, ceftriaxone reconstitution guidelines, ceftriaxone mixing techniques, ceftriaxone dosage calculations, ceftriaxone administration methods, ceftriaxone storage conditions, ceftriaxone safety precautions, ceftriaxone compatibility with solvents, ceftriaxone injection preparation, ceftriaxone concentration adjustments, ceftriaxone vial labeling, ceftriaxone infusion rates, ceftriaxone side effects, ceftriaxone pharmacology--ceftriaxone dilution, ceftriaxone preparation, medication dilution, intravenous ceftriaxone, reconstituting ceftriaxone, ceftriaxone dosage, sterile technique, ceftriaxone administration, drug dilution guidelines, injectable ceftriaxone, pharmacy procedures, antibiotic preparation, safe handling of ceftriaxone, mixing ceftriaxone, dilution ratios, medical guidelines, pharmacy best practices"
2003976,"scuba regulator assembly, scuba regulator setup, scuba equipment instructions, assembling scuba gear, scuba regulator maintenance, scuba diving equipment, regulator parts guide, scuba diving tutorials, regulator troubleshooting, diving gear assembly tips--scuba regulator assembly, scuba regulator setup, assembling scuba gear, scuba regulator maintenance, scuba diving equipment assembly, scuba regulator instructions, how to assemble scuba regulator, scuba regulator parts, scuba diving gear setup, scuba diving regulator guide, putting together scuba equipment, scuba regulator troubleshooting, scuba diving setup tips, regulator assembly guide, scuba diving regulator maintenance--scuba regulator assembly, scuba regulator setup, scuba regulator maintenance, scuba gear assembly, scuba diving equipment, regulator parts guide, scuba diving tutorial, regulator troubleshooting, scuba diving safety, scuba regulator disassembly, scuba diving tips, scuba equipment checklist, regulator adjustment, scuba diving for beginners, underwater breathing apparatus--assemble scuba regulator, scuba regulator setup guide, scuba regulator assembly instructions, how to assemble a scuba regulator, scuba regulator parts explanation, scuba regulator maintenance tips, scuba diving equipment assembly, putting together scuba gear, scuba regulator troubleshooting, scuba regulator configuration steps, beginner's guide to scuba regulators, scuba diving equipment setup, scuba regulator care and maintenance, scuba diving gear assembly tips, scuba regulator disassembly guide--scuba regulator assembly, scuba gear setup, regulator maintenance, diving equipment tutorial, scuba diving instructions, regulator parts identification, underwater breathing apparatus, scuba diving basics, regulator troubleshooting, diving safety tips, scuba gear configuration, assembly guide, scuba diving techniques, regulator testing, dive shop advice"
2004237,"transfer funds, online banking, Westpac app, account transfer, deposit transfer, money transfer, Westpac online services, banking options, fund transfer methods, electronic funds transfer, Westpac customer support, transaction limits, account management, mobile banking, online transactions--transfer funds, online banking, Westpac account transfer, deposit transfer, Westpac mobile app, fund transfer options, online money transfer, banking services, Westpac online services, account management, inter-account transfer, digital banking, financial transactions, money management, Westpac support--transfer funds, online banking, Westpac app, account transfer, money transfer, deposit transfer, Westpac online, banking services, fund transfer options, mobile banking, account management, Westpac support, transaction limits, online transactions, financial services--transfer funds Westpac online, Westpac deposit transfer instructions, online banking deposit transfer, Westpac account transfer guide, transfer money between accounts Westpac, online banking services Westpac, Westpac mobile app transfer, Westpac account management, how to use Westpac online banking, transfer money Westpac step by step, Westpac customer support, online money transfer options, Westpac account settings, secure online transfers Westpac, Westpac transfer fees, Westpac online banking features--transfer deposit, online banking, Westpac account transfer, fund transfer, online funds movement, Westpac services, digital banking, account management, banking app, money transfer options, inter-account transfer, online transactions, Westpac online services, banking security, customer support"
2004253,"trim whitespace, remove empty spaces, clean up Excel cells, Excel trim function, eliminate extra spaces, text functions Excel, data cleaning Excel, Excel formulas, trim leading trailing spaces, format cells Excel, cell formatting, Excel data management, string manipulation Excel, Excel tips, optimize Excel data--trim whitespace, remove extra spaces, clean up cells, excel trim function, eliminate blank spaces, formatting cells, excel text functions, data cleaning in excel, trim spaces in formulas, leading and trailing spaces, text manipulation in excel, excel tips and tricks, cell formatting options, space removal techniques, excel data management--trim spaces, remove blank cells, clean data, Excel functions, text manipulation, TRIM function, data cleaning, whitespace removal, Excel formulas, formatting cells, cell content, leading spaces, trailing spaces, text functions, spreadsheet tips, data organization, Excel shortcuts, clean up data, remove spaces in Excel, VBA for trimming--trim spaces in excel, remove extra spaces excel, eliminate blank spaces excel, trim function excel, clean function excel, excel trim whitespace, format cells excel, text to columns excel, find and replace excel, excel data cleanup, remove leading spaces excel, remove trailing spaces excel, excel string manipulation, excel text functions, excel tips and tricks--trim, blank space, Excel, remove spaces, clean data, text functions, TRIM function, whitespace, data formatting, cell cleanup, Excel tips, spreadsheet optimization, text manipulation, formula, data analysis, Excel shortcuts"
2005810,"executive branch, entities, government structure, federal agencies, executive departments, presidential powers, administrative organizations, cabinet positions, executive offices, regulatory agencies, executive leadership, government hierarchy, public administration, civil service, executive functions--executive branch, entities, government structure, federal agencies, executive departments, cabinet positions, presidential powers, administrative functions, executive orders, government organizations, executive leadership, branches of government, public administration, executive authority, policy implementation--executive branch, government, agencies, departments, roles, functions, leadership, President, Vice President, Cabinet, federal agencies, executive orders, administrative powers, branches of government, public administration, policy implementation, executive authority, executive officials, organizational structure, accountability--executive branch entities, executive branch components, executive branch structure, roles of executive branch, executive branch functions, executive agencies, executive departments, executive leadership, executive branch responsibilities, government executive branch, executive branch organization, executive branch overview, executive branch powers, executive branch officials, executive branch roles and responsibilities--executive branch, entities, government, structure, departments, agencies, roles, functions, leadership, administration, federal government, executive powers, cabinet, hierarchy, responsibilities, policy-making, oversight, executive orders, divisions, commissions"
