qid,query
2040613,"London Breed, San Francisco, mayor, policies, political stance, leadership, initiatives, community, social issues, housing, equality, economic development, public safety, education, transportation, health care, environment, diversity, inclusion, city government, local politics--London Breed, San Francisco, mayor, policies, political stance, social issues, community engagement, leadership, initiatives, public safety, housing, economic development, education, diversity, equity, inclusion, local government, advocacy, public health, environment.--London Breed, political stance, policies, San Francisco, mayor, social issues, community initiatives, housing, homelessness, public safety, education, economic development, diversity, equity, inclusion, local government, leadership, political career, advocacy, city governance--London Breed, San Francisco mayor, political views, policies, community initiatives, leadership style, advocacy, social justice, housing affordability, public safety, economic development, education reform, LGBTQ+ rights, racial equity, environmental sustainability, homelessness solutions, public health, city governance, urban development, community engagement--London Breed, San Francisco Mayor, political stance, policies, initiatives, leadership, community issues, social justice, housing, public safety, economic development, education, diversity, equality, urban development, climate change, local government, public health, homelessness, transportation, civic engagement, legislative agenda."
2043895,"motivation, psychological theories, intrinsic motivation, extrinsic motivation, Maslow's hierarchy, Herzberg's two-factor theory, McClelland's theory, self-determination theory, expectancy theory, goal-setting theory, reinforcement theory, cognitive evaluation theory, social learning theory, motivation in the workplace, employee motivation, motivation and performance, behavioral theories, drive theory, achievement motivation, motivation strategies--motivation, psychological theories, intrinsic motivation, extrinsic motivation, Maslow's hierarchy of needs, Herzberg's two-factor theory, McClelland's theory of needs, self-determination theory, expectancy theory, goal-setting theory, reinforcement theory, drive theory, cognitive evaluation theory, social learning theory, behaviorism, workplace motivation, educational motivation, personal development, leadership motivation, employee engagement--motivation, psychology, Maslow's hierarchy, self-determination theory, expectancy theory, goal-setting theory, intrinsic motivation, extrinsic motivation, behaviorism, reinforcement theory, cognitive evaluation theory, Herzberg's two-factor theory, McClelland's theory of needs, achievement motivation, social motivation, workplace motivation, educational motivation, personal development, leadership, performance improvement--motivation theories, types of motivational theories, motivational theories in psychology, Maslow's hierarchy of needs, Herzberg's two-factor theory, self-determination theory, expectancy theory, intrinsic vs extrinsic motivation, application of motivational theories, historical development of motivational theories, contemporary motivational theories, comparison of motivational theories, motivational theories in the workplace, educational motivational theories, impact of motivational theories on performance, critiques of motivational theories, motivational theories and behavior, cultural influences on motivational theories, motivational theories and leadership.--motivation, theories, psychological theories, intrinsic motivation, extrinsic motivation, Maslow's hierarchy, self-determination theory, goal-setting theory, expectancy theory, reinforcement theory, social cognitive theory, drive theory, achievement motivation, cognitive evaluation theory, behaviorism, motivation in education, workplace motivation, performance improvement, leadership motivation, personal development"
2044423,"short term disability tax form, disability income tax reporting, IRS tax forms for disability, 1099 disability income, tax implications short term disability, reporting disability benefits on taxes, tax forms for disability payments, short term disability and taxes, income tax disability benefits, tax filing short term disability--tax form, short term disability, disability benefits, IRS tax implications, tax reporting, W-2 form, 1099 form, income tax, disability income, unemployment benefits, tax deductions, tax credits, state disability insurance, federal tax, taxable income, financial forms, tax obligations--tax form, short term disability, disability benefits, IRS forms, income reporting, tax implications, W-2, 1099, unemployment benefits, tax deductions, financial assistance, state disability, federal tax, taxable income, employee benefits--tax form short term disability, short term disability tax implications, IRS tax forms disability benefits, reporting short term disability income, tax reporting short term disability payments, short term disability benefits tax form, disability income tax return, tax documentation for disability payments, understanding tax forms for disability, tax obligations short term disability--tax form, short term disability, disability benefits, IRS forms, tax implications, income reporting, W-2, 1099, taxable income, state disability, federal tax, employee benefits, insurance payments, tax deductions, financial planning, tax advice"
2045272,"paint hazards, paint production risks, chemical exposure, safety precautions, toxic substances, respiratory hazards, environmental impact, handling solvents, workplace safety, protective equipment, paint ingredients, health effects, flammable materials, mixing chemicals, waste disposal, regulatory compliance, ventilation requirements, skin contact risks, inhalation risks, safety guidelines--paint hazards, paint safety, paint fumes, toxic substances, chemical exposure, paint manufacturing risks, respiratory issues, skin irritation, environmental impact, safety precautions, protective equipment, ventilation, hazardous materials, workplace safety, paint ingredients, health effects, industry regulations--hazards, paint production, chemical exposure, safety measures, toxic substances, respiratory risks, flammable materials, environmental impact, skin irritation, proper ventilation, protective equipment, waste disposal, regulatory guidelines, health risks, workplace safety, mixing chemicals, paint ingredients, manufacturing processes--hazards of paint making, paint production risks, safety in paint manufacturing, toxic substances in paint, chemical exposure in paint making, environmental impact of paint, health risks of paint ingredients, safety precautions for paint production, paint making safety guidelines, hazardous materials in paint, paint fumes dangers, protective measures for paint makers, paint formulation hazards, personal protective equipment for paint making, regulations for paint safety--hazards of paint production, paint manufacturing risks, chemical exposure paint, safety in paint making, environmental impact paint, toxic substances in paint, paint fumes health effects, occupational hazards paint industry, personal protective equipment paint, paint safety guidelines, regulatory standards paint production, waste disposal paint, respiratory risks paint, skin contact paint hazards, fire hazards paint materials"
2046371,"functions, three regions, small intestine, duodenum, jejunum, ileum, digestion, absorption, nutrient breakdown, enzymatic activity, intestinal health, regional differences, gastrointestinal tract, digestive processes, nutrient absorption, gut microbiota, intestinal flora, digestive enzymes, bile secretion, pancreatic juices, villi, microvilli, surface area, nutrient transport, electrolyte balance, immune function, gut-brain axis--functions, regions, small intestine, duodenum, jejunum, ileum, digestion, absorption, nutrient transport, enzymatic activity, intestinal flora, gastrointestinal physiology, nutrient breakdown, digestive processes, intestinal health--duodenum, jejunum, ileum, nutrient absorption, digestion, enzyme secretion, bile interaction, intestinal flora, peristalsis, villi, microvilli, nutrient transport, electrolyte balance, immune function, digestive disorders, absorption mechanisms, intestinal health, mucosal surface, hormone regulation, gut microbiome--functions, three regions, small intestine, duodenum, jejunum, ileum, digestion, absorption, nutrient transport, enzymatic activity, bile secretion, intestinal flora, gastrointestinal physiology, nutrient breakdown, absorption mechanisms, intestinal health, digestive processes, regional functions, small bowel anatomy--functions, three regions, small intestine, duodenum, jejunum, ileum, digestion, absorption, nutrient transport, enzymatic activity, intestinal flora, digestive enzymes, bile, pancreatic juices, nutrient breakdown, absorption mechanisms, villi, microvilli, digestive processes, gastrointestinal physiology"
2049417,"peace, French translation, French language, peace definition, French vocabulary, peace in different languages, French phrases, language learning, cultural significance of peace, synonyms of peace in French--French translation, peace in French, meaning of peace, French language, French vocabulary, peace definition, French phrases, language learning, French words, translation resources--peace in French, French translation of peace, meaning of peace in French, French language peace, French vocabulary, peace definition in French, French phrases for peace, how to say peace in French, peace synonyms in French, French word for peace--peace in french translation, how to say peace in french, french word for peace, meaning of peace in french, peace definition in french, peace pronunciation in french, peace synonyms in french, learn french peace, peace in different languages, peace in french culture--peace, French translation, French language, meaning of peace, French vocabulary, peace in French, linguistic terms, French phrases, cultural significance, synonyms, related concepts, language learning, bilingual resources, translation tools, dictionary definitions"
2049687,"vaccination schedule, show piglets, recommended vaccines, piglet health, disease prevention, veterinary advice, swine vaccination, piglet immunization, common diseases, vaccination types, pig farming, animal husbandry, biosecurity measures, veterinary guidelines, piglet care--vaccination schedule, show piglets, piglet health, swine vaccination, common vaccines, veterinary recommendations, disease prevention, piglet care, immunization guidelines, livestock management, pig farming, biosecurity measures, veterinary advice, swine health management, piglet vaccinations--vaccination schedule, show piglets, swine health, piglet immunization, common vaccines, disease prevention, veterinary recommendations, piglet care, biosecurity measures, vaccination types, age-specific vaccinations, herd health management, piglet growth, veterinary guidelines, pig farming best practices--vaccination schedule, show piglets, piglet health, swine vaccinations, common vaccinations, vaccine types, piglet immunization, veterinary recommendations, disease prevention, vaccination timing, pig farming, livestock management, biosecurity measures, piglet care, veterinary advice--vaccination, show piglets, swine health, piglet care, immunization schedule, common diseases, veterinary recommendations, biosecurity measures, piglet management, disease prevention, vaccination types, veterinary advice, livestock health, swine vaccinations, animal husbandry"
2053884,"foreclosure process, personal property, items in foreclosure, abandoned belongings, eviction process, foreclosure timeline, tenant rights, property auction, auctioned items, storage of belongings, legal rights, repossession, lender policies, foreclosure laws, property inspection, secured creditors, eviction notice, homeowner obligations, asset liquidation--foreclosure process, items in foreclosure, property contents, abandoned belongings, foreclosure auction, personal property rights, eviction process, tenant rights, foreclosure laws, asset disposition, house eviction, foreclosure timeline, storage of belongings, legal rights, property repossession--foreclosure process, items in foreclosure, personal belongings, eviction process, foreclosure timeline, property auction, tenant rights, abandoned property, foreclosure laws, storage of belongings, auction process, homeowner rights, foreclosure consequences, property inspection, lien holders, personal property rights--foreclosure process, items in foreclosed house, personal belongings foreclosure, abandoned property laws, eviction process, real estate foreclosure, tenant rights foreclosure, auction of foreclosed home, property disposition, foreclosure timeline, homeowner rights, foreclosure auction rules, personal property removal, foreclosure consequences, storage of items, creditor claims, state foreclosure laws, foreclosure and personal property, tenant eviction rights, foreclosure notice process--foreclosure process, items in foreclosure, property rights, personal belongings, eviction process, auction process, tenant rights, abandoned property, foreclosure timeline, real estate law, secured creditors, foreclosure auction, possession of property, state laws, home foreclosure, personal property rights, asset liquidation, foreclosure consequences, homeowner responsibilities, property management"
2054355,"chicken by-product meal, pet food ingredients, nutritional benefits, protein source, amino acids, digestibility, pet health, animal nutrition, food formulation, meat meal, pet food quality, ingredient safety, feeding guidelines, dietary requirements, pet food labels--chicken by-product meal benefits, pet food ingredients, nutritional value chicken meal, pet food additives, animal protein sources, pet nutrition, chicken meal advantages, pet food quality, ingredient transparency, pet food formulation--nutritional value, protein source, digestibility, amino acids, vitamins, minerals, pet food ingredients, animal nutrition, food safety, quality standards, ingredient sourcing, pet health benefits, formulation, regulatory guidelines, consumer concerns--chicken by-product meal benefits, nutritional value of chicken by-product meal, chicken by-product meal ingredients, pet food protein sources, role of chicken by-product meal in dog food, chicken by-product meal for cats, pet food additives, animal protein in pet food, chicken meal vs chicken by-product meal, pet nutrition, pet food quality, digestibility of chicken by-product meal, chicken by-product meal safety, pet food formulation, ingredients in commercial pet food, animal by-products in pet food, benefits of by-products in pet nutrition, pet food labeling, understanding pet food ingredients, chicken by-product meal explained--chicken by-product meal, pet food nutrition, animal protein sources, pet food ingredients, nutritional value, protein content, digestibility, amino acids, pet food formulation, ingredient quality, pet health benefits, pet food safety, sourcing standards, regulatory guidelines, pet food labels"
2055211,"cat behavior, nocturnal activity, feline restlessness, night time behavior, sleep patterns, environmental factors, anxiety in cats, boredom in cats, hunting instincts, health issues, age-related changes, stimulation needs, attention seeking, territorial instincts, playfulness at night--cat behavior, nighttime activity, restless cat, feline restlessness, nocturnal cats, cat sleep patterns, reasons for cat restlessness, cat night behavior, why cats are active at night, cat anxiety, environmental factors, boredom in cats, hunting instincts, indoor cat behavior, cat health issues--cat behavior, nocturnal activity, feline restlessness, night time behavior, cat sleep patterns, reasons for cat anxiety, nighttime playfulness, feline instincts, environmental factors, cat health issues, boredom in cats, stimulation needs, pet care tips, cat exercise, sleep disturbances in pets--cat behavior at night, reasons for cat restlessness, night time cat activity, why cats are active at night, feline nocturnal behavior, restless cat solutions, keeping cats calm at night, cat sleep patterns, understanding cat anxiety, tips for calming restless cats, cat nighttime habits, why is my cat hyper at night, nocturnal animals, cat health issues, environmental factors affecting cats, playtime for cats at night, cat enrichment activities, signs of stress in cats, how to tire out a cat, feline instincts at night--cat behavior, nocturnal habits, feline restlessness, night activity, cat sleep patterns, reasons for cat hyperactivity, nighttime behavior in cats, environmental factors, boredom in cats, health issues in cats"
2055480,"corneal abrasion statistics, incidence rate corneal abrasion, corneal abrasion prevalence, corneal abrasion cases, corneal abrasion epidemiology, corneal abrasion risk factors, corneal abrasion causes, corneal abrasion treatment, corneal abrasion symptoms, corneal abrasion recovery time, eye injury statistics, ocular trauma incidents, corneal injury frequency, corneal abrasion demographics, corneal abrasion research studies--corneal abrasion statistics, corneal abrasion prevalence, corneal abrasion incidence rates, corneal abrasion causes, corneal abrasion treatment, corneal abrasion symptoms, eye injury statistics, ocular trauma incidents, corneal injury frequency, vision impairment, eye health statistics, emergency room visits corneal abrasion, risk factors corneal abrasion, corneal abrasion demographics, preventive measures corneal abrasion--corneal abrasion statistics, corneal abrasion prevalence, corneal abrasion incidence rates, corneal abrasion risk factors, corneal abrasion treatment, corneal abrasion symptoms, corneal abrasion causes, corneal abrasion epidemiology, eye injury statistics, ocular trauma incidents, corneal injury rates, visual impairment from corneal abrasion, corneal abrasion recovery, corneal abrasion prevention, emergency room visits corneal abrasion--corneal abrasion statistics, corneal abrasion prevalence, corneal abrasion incidence rates, corneal abrasion cases, corneal abrasion frequency, corneal abrasion risk factors, corneal abrasion treatment statistics, corneal abrasion in contact lens wearers, corneal abrasion emergency room visits, corneal abrasion recovery time, corneal abrasion causes, corneal abrasion symptoms, corneal abrasion complications, corneal abrasion prevention, corneal abrasion demographics--corneal abrasion statistics, incidence rate corneal abrasion, corneal abrasion prevalence, corneal abrasion cases, corneal injury statistics, eye injury incidents, corneal abrasion risk factors, corneal abrasion treatment frequency, ocular trauma statistics, emergency room visits corneal abrasion"
2055634,"PowerPoint video formats, supported video types, video compatibility PowerPoint, video playback PowerPoint, multimedia presentations, video file extensions, embedding videos in PowerPoint, PowerPoint video options, video formats for presentations, PowerPoint media support, video integration PowerPoint, video editing in PowerPoint, PowerPoint slideshow videos, video formats compatibility, video insertion PowerPoint.--PowerPoint video formats, supported video types, video compatibility PowerPoint, embedding videos in PowerPoint, PowerPoint media playback, video file formats for PowerPoint, PowerPoint video options, video formats for presentations, PowerPoint video support, types of videos for presentations, PowerPoint multimedia features, video integration in PowerPoint, PowerPoint slideshow videos, video editing in PowerPoint, PowerPoint video settings--PowerPoint video formats, supported video types, video compatibility PowerPoint, PowerPoint multimedia, video file formats, embedding videos in PowerPoint, PowerPoint video playback, video formats for presentations, compatible video files, PowerPoint media support, video insertion PowerPoint, PowerPoint slideshow videos, video editing PowerPoint, PowerPoint video features, video formats overview.--PowerPoint video formats, supported video types in PowerPoint, PowerPoint video compatibility, embedding videos in PowerPoint, video playback in PowerPoint, PowerPoint video formats list, how to insert videos in PowerPoint, PowerPoint video formats supported, video file types for PowerPoint, PowerPoint media playback options, best video formats for PowerPoint presentations, PowerPoint video guidelines, video formats for presentations, converting videos for PowerPoint, troubleshooting video playback in PowerPoint--PowerPoint video formats, supported video types, video compatibility, PowerPoint multimedia, video playback in PowerPoint, embedding videos in PowerPoint, video file extensions, PowerPoint video options, video formats for presentations, enhancing PowerPoint presentations, multimedia integration, video editing in PowerPoint, best video formats for PowerPoint, PowerPoint slideshow videos, video resolution for PowerPoint."
2055795,"Collins, Good to Great, Jim Collins, business success, leadership, management strategies, organizational change, high-performing companies, best practices, corporate culture, transformative leadership, performance improvement, business excellence, competitive advantage, research findings, case studies, business frameworks--Collins, Good to Great, business leadership, management principles, organizational success, Jim Collins, corporate strategy, performance excellence, transformational leadership, best practices, team dynamics, sustainable growth, competitive advantage, business transformation, case studies, success stories, leadership development--Jim Collins, Good to Great book, business management, leadership, organizational success, company growth, level 5 leadership, hedgehog concept, flywheel effect, research findings, business strategy, performance comparison, corporate culture, sustainable growth, best practices, case studies--Collins Good to Great summary, Collins Good to Great key concepts, Collins Good to Great analysis, Collins Good to Great quotes, Collins Good to Great principles, Collins Good to Great leadership, Collins Good to Great review, Collins Good to Great lessons, Collins Good to Great case studies, Collins Good to Great application, Collins Good to Great insights, Collins Good to Great PDF, Collins Good to Great audiobook, Collins Good to Great discussion questions, Collins Good to Great examples.--Collins, Good to Great, business strategy, leadership, organizational success, management principles, sustainable growth, company transformation, best practices, corporate culture, high-performance teams, Jim Collins, business excellence, competitive advantage, visionary leadership, performance metrics"
2056158,"phone recommendations, best smartphones Europe, travel phones, unlocked phones Europe, SIM cards Europe, mobile plans Europe, phone compatibility Europe, budget phones Europe, travel tips Europe, phone features for travel, international roaming, 5G phones Europe, data plans Europe, portable Wi-Fi devices, travel accessories for phones--best phones for Europe, travel phone recommendations, smartphones for Europe, mobile networks in Europe, unlocked phones for travel, SIM cards for Europe, international phone plans, phone compatibility in Europe, travel-friendly smartphones, European mobile carriers, phone features for travel, budget phones for Europe, phone coverage in Europe, travel apps for smartphones, portable Wi-Fi devices Europe--travel-friendly phones, best smartphones for Europe, unlocked phones, European network compatibility, international roaming, SIM-free devices, battery life, camera quality, data plans in Europe, travel apps, budget smartphones, premium devices, 5G compatibility, brand recommendations, user reviews, durability, warranty options, accessories for travel, local SIM cards, language support--phone options Europe, best smartphones Europe, travel phones Europe, SIM cards Europe, unlocked phones Europe, international roaming Europe, mobile plans Europe, phone compatibility Europe, travel accessories Europe, top-rated phones Europe--best smartphones Europe, travel-friendly phones, unlocked phones Europe, European SIM compatibility, international roaming options, budget phones Europe, top-rated phones for travel, phone features for Europe, mobile data plans Europe, phone reviews for travelers"
