qid,query
2026150,"secondary trauma definition, vicarious trauma, compassion fatigue, trauma exposure, secondary traumatic stress, psychological impact, emotional distress, trauma symptoms, mental health effects, coping mechanisms, trauma recovery, support resources, professional burnout, trauma-informed care, psychological resilience--secondary trauma definition, secondary traumatic stress, vicarious trauma definition, trauma exposure definition, effects of secondary trauma, signs of secondary trauma, coping with secondary trauma, secondary trauma symptoms, secondary trauma in caregiving, understanding secondary trauma--secondary trauma meaning, secondary trauma definition, vicarious trauma definition, compassion fatigue, trauma exposure, psychological impact of trauma, emotional distress, trauma symptoms, mental health effects, coping strategies for secondary trauma, secondary traumatic stress, trauma-informed care, support for trauma workers, resilience in trauma, secondary trauma resources--secondary trauma definition, secondary trauma meaning, what is secondary trauma, understanding secondary trauma, secondary trauma examples, effects of secondary trauma, secondary trauma symptoms, secondary trauma in psychology, secondary trauma vs vicarious trauma, coping with secondary trauma, secondary trauma in healthcare, secondary trauma resources, secondary trauma intervention, secondary trauma support, secondary trauma treatment--secondary trauma definition, vicarious trauma, compassion fatigue, trauma exposure, psychological impact, emotional distress, trauma symptoms, mental health effects, trauma recovery, secondary traumatic stress, coping strategies, support systems, trauma-informed care, awareness and education, resilience building"
2026558,"biographer, biography writer, life story author, memoirist, autobiographer, literary biographer, biographical author, writer of biographies, biography specialist, narrative non-fiction writer--biographer, biography writer, life story author, memoirist, literary biographer, biographical writer, personal historian, biography specialist, narrative non-fiction writer, historical biographer--biographer, biography writer, life story author, memoirist, literary biographer, personal historian, biographical author, narrative non-fiction writer, historical biographer, writer of lives--biographer, biography writer, literary biographer, memoirist, life writer, author of biographies, biographical writer, biography author, historical biographer, personal historian--biographer, biography writer, life story author, memoirist, narrative historian, personal historian, biographical author, life chronicler, literary biographer, autobiographer"
2027130,"home child care, definition, home-based childcare, child care services, early childhood education, family child care, child care providers, daycare definition, home daycare, childcare regulations, child care standards, child care terminology, home care definition, early learning, child development, parental care, childcare options, licensed childcare, informal childcare, childcare settings--""home child care services, home child care regulations, home child care benefits, home child care providers, home child care programs, home child care licensing, home child care requirements, home child care safety standards, home child care costs, home child care resources""--home childcare, child care services, early childhood education, family child care, daycare definition, child care regulations, home-based child care, child care providers, child development, parenting resources, child care standards, child care programs, home education, preschool care, child care licensing--home child care services, home child care regulations, home child care benefits, home child care providers, home child care requirements, home child care safety standards, home child care programs, home child care licensing, home child care options, home child care costs, home child care policies, home child care quality, home child care resources, home child care training, home child care statistics--home child care, child care services, early childhood education, child care regulations, family child care, licensed child care, child care providers, child development, child care options, affordable child care, child care resources, home-based child care, child care policies, child care quality, child care programs, parenting support, child care assistance, daycare alternatives, child care safety standards, child care workforce"
2027497,"potty training frequency, toddler potty schedule, potty training tips, potty training routine, toddler bathroom habits, potty training milestones, toddler toilet schedule, potty training advice, when to take toddler to potty, potty training best practices--toddler potty training frequency, potty training schedule, potty training tips, toddler bathroom routine, potty training success, signs of readiness for potty training, potty training age, how to potty train a toddler, potty training methods, encouraging toddler to use potty, potty training milestones, potty training accidents, transitioning from diapers to potty, potty training readiness checklist, potty training strategies--potty training schedule, toddler potty habits, potty training frequency, toddler bathroom routine, potty training tips, signs of readiness, potty training age, successful potty training, toddler toilet training, potty training advice, toddler bladder control, potty training milestones, encouraging potty use, potty training techniques, managing accidents--potty training schedule, toddler potty training frequency, potty training tips, how to potty train a toddler, signs of readiness for potty training, toddler bathroom routine, potty training milestones, best practices for potty training, potty training advice, managing accidents during potty training--potty training frequency, toddler potty schedule, potty training tips, toddler bathroom routine, potty training checklist, signs of readiness, potty training methods, toddler toilet habits, potty training age, potty training success, consistency in potty training, nighttime potty training, daytime potty training, rewards for potty training, toddler behavior during potty training"
2028378,"trial by jury, jury duty, jury selection, criminal trials, civil trials, legal process, court system, rights of defendants, jury instructions, trial procedures, legal terminology, courtroom, justice system, jury verdict, types of trials--trial by jury, jury trial, legal proceedings, criminal cases, civil cases, jury selection, constitutional rights, legal system, courtroom procedures, types of trials, jury duties, trial process, legal definitions, rights of defendants, trial outcomes, jury instructions, historical context, trial types, legal standards, case law--trial by jury, legal proceedings, jury selection, criminal cases, civil cases, constitutional rights, legal standards, jury duty, court system, trial procedures, jury instructions, verdicts, legal terminology, due process, historical context--trial by jury, legal process, criminal cases, civil cases, constitutional rights, jury selection, court procedures, legal terminology, trial procedures, jury duty, types of trials, legal rights, courtroom, justice system, trial outcomes--trial by jury, jury selection, legal proceedings, criminal trial, civil trial, jury duty, jury system, courtroom procedures, legal rights, trial process, verdict, jury instructions, types of trials, constitutional rights, due process, legal definitions, trial outcomes, jury roles, trial timeline, jury composition"
2029260,"issues with Amazon Prime, Amazon Prime problems, Amazon Prime complaints, Amazon Prime customer service, Amazon Prime reviews, Amazon Prime drawbacks, Amazon Prime subscription issues, Amazon Prime dissatisfaction, Amazon Prime performance, Amazon Prime failures, Amazon Prime service quality, Amazon Prime features, Amazon Prime alternatives, Amazon Prime user experiences, Amazon Prime feedback--Amazon Prime issues, Amazon Prime problems, Amazon Prime complaints, Amazon Prime customer service, Amazon Prime subscription issues, Amazon Prime delivery problems, Amazon Prime video issues, Amazon Prime membership concerns, Amazon Prime billing problems, Amazon Prime service outages, Amazon Prime account issues, Amazon Prime features complaints, Amazon Prime quality issues, Amazon Prime user reviews, Amazon Prime dissatisfaction--Amazon Prime issues, Amazon Prime problems, Amazon Prime complaints, Amazon Prime drawbacks, Amazon Prime customer service, Amazon Prime reviews, Amazon Prime dissatisfaction, Amazon Prime alternatives, Amazon Prime limitations, Amazon Prime subscription issues, Amazon Prime quality, Amazon Prime features, Amazon Prime value, Amazon Prime membership concerns, Amazon Prime performance issues--issues with Amazon Prime, Amazon Prime problems, Amazon Prime complaints, Amazon Prime customer service issues, Amazon Prime delivery problems, Amazon Prime subscription issues, Amazon Prime membership concerns, Amazon Prime quality issues, Amazon Prime service complaints, Amazon Prime dissatisfaction, Amazon Prime user reviews, Amazon Prime negative feedback, Amazon Prime troubleshooting, Amazon Prime account issues, Amazon Prime value concerns--Amazon Prime issues, Amazon Prime problems, Amazon Prime complaints, Amazon Prime customer service, Amazon Prime subscription issues, Amazon Prime delivery problems, Amazon Prime content availability, Amazon Prime pricing concerns, Amazon Prime user reviews, Amazon Prime service quality, Amazon Prime vs competitors, Amazon Prime membership drawbacks, Amazon Prime video streaming issues, Amazon Prime shipping delays, Amazon Prime cancellation problems"
2030323,"mesquite plant characteristics, mesquite plant habitat, mesquite plant uses, mesquite plant benefits, mesquite plant care, mesquite plant identification, mesquite plant types, mesquite plant growth, mesquite plant ecology, mesquite plant distribution, mesquite plant synonyms, mesquite plant photos, mesquite plant pests, mesquite plant diseases, mesquite plant history--mesquite tree characteristics, mesquite plant uses, mesquite plant habitat, mesquite plant benefits, mesquite tree identification, mesquite plant growth conditions, mesquite plant care, mesquite plant types, mesquite plant species, mesquite tree ecology, mesquite plant adaptations, mesquite plant flowering, mesquite wood properties, mesquite plant pictures, mesquite plant distribution--mesquite plant characteristics, mesquite plant habitat, mesquite plant uses, mesquite plant benefits, mesquite plant care, mesquite plant types, mesquite plant growth, mesquite plant ecology, mesquite plant identification, mesquite plant photos, mesquite plant distribution, mesquite plant cultivation, mesquite plant adaptations, mesquite plant soil requirements, mesquite plant pests--mesquite plant characteristics, mesquite plant habitat, mesquite plant uses, mesquite plant benefits, mesquite plant types, mesquite plant care, mesquite plant growth, mesquite plant identification, mesquite plant ecology, mesquite plant nutritional value, mesquite plant in landscaping, mesquite plant pests, mesquite plant diseases, mesquite plant history, mesquite plant propagation--mesquite plant characteristics, mesquite tree habitat, mesquite uses, mesquite benefits, mesquite species, mesquite growth conditions, mesquite ecological importance, mesquite wood properties, mesquite leaf structure, mesquite flowering, mesquite root system, mesquite soil preferences, mesquite pest resistance, mesquite cultivation techniques, mesquite nutritional value"
2030608,"definition, monsieur meaning, French term, title of respect, address, etiquette, language, translation, usage, context, synonyms, cultural significance, formal address, honorific, French language, male title--definition, monsieur, French term, title, address, etiquette, usage, meaning, translation, cultural context, language, honorific, formality, salutation, gentleman, Mr., linguistic, historical usage, social title--definition, monsieur meaning, French term, translation, usage, etymology, context, examples, synonyms, cultural significance, related terms--define monsieur meaning, monsieur definition, monsieur in French, monsieur usage, monsieur translation, monsieur etymology, monsieur synonyms, monsieur cultural significance, monsieur in context, monsieur examples--define, monsieur, meaning, translation, French, title, address, usage, context, etymology, synonyms, related terms, cultural significance, formal, informal, etiquette, honorific, language, communication"
2031726,"yeast infection, candidiasis, fungal infection, symptoms, treatment, diagnosis, healthcare provider, gynecologist, antifungal medication, vaginal health, probiotics, risk factors, prevention, home remedies, clinical guidelines, patient education--yeast infection treatment, yeast infection symptoms, yeast infection causes, yeast infection diagnosis, yeast infection remedies, yeast infection prevention, yeast infection medication, yeast infection home remedies, yeast infection specialist, vaginal yeast infection, oral yeast infection, recurrent yeast infection, yeast infection testing, over-the-counter yeast infection, yeast infection in men, yeast infection during pregnancy, chronic yeast infection, yeast infection natural treatment, yeast infection and antibiotics, yeast infection lifestyle changes--yeast infection treatment, yeast infection symptoms, yeast infection causes, yeast infection diagnosis, yeast infection remedies, yeast infection prevention, yeast infection medication, yeast infection home remedies, vaginal yeast infection, oral thrush, antifungal treatment, gynecologist, healthcare provider, yeast infection testing, probiotics for yeast infection--yeast infection treatment, yeast infection symptoms, yeast infection causes, yeast infection prevention, yeast infection home remedies, yeast infection diagnosis, yeast infection medication, yeast infection natural remedies, yeast infection in women, yeast infection in men, yeast infection and antibiotics, yeast infection recurrence, yeast infection specialist, yeast infection vs bacterial vaginosis, yeast infection and pregnancy, yeast infection and diabetes, yeast infection itching relief, yeast infection over-the-counter treatment, yeast infection lifestyle changes, yeast infection FAQs--yeast infection treatment, yeast infection symptoms, fungal infection doctor, candidiasis specialist, vaginal yeast infection, oral thrush, antifungal medication, yeast infection diagnosis, healthcare provider, gynecologist, infectious disease expert, yeast infection remedies, probiotics for yeast infection, yeast infection causes, yeast infection prevention"
2032090,"possessive partner, relationship advice, communication strategies, setting boundaries, dealing with jealousy, emotional support, relationship counseling, building trust, healthy relationships, conflict resolution, assertiveness training, self-care tips, understanding possessiveness, partner behavior, relationship dynamics--possessive partner, relationship advice, dealing with possessiveness, communication strategies, setting boundaries, emotional support, healthy relationships, conflict resolution, trust issues, self-esteem, relationship counseling, partner jealousy, coping mechanisms, personal space, mutual respect--possessive partner, relationship advice, managing jealousy, communication strategies, setting boundaries, emotional support, conflict resolution, trust issues, healthy relationships, self-esteem, assertiveness, relationship counseling, red flags, coping mechanisms, personal space, mutual respect, relationship dynamics, emotional intelligence, partner behavior, love and trust--possessive partner signs, dealing with possessive behavior, how to handle possessiveness in relationships, communication tips for possessive partners, relationship advice possessiveness, overcoming jealousy in relationships, setting boundaries with possessive partners, understanding possessiveness in love, emotional impact of possessiveness, improving trust in relationships, coping strategies for possessive partners, when to seek help for possessiveness, red flags in possessive relationships, building healthy relationship dynamics, fostering independence in relationships--possessive partner, relationship advice, dealing with jealousy, communication strategies, healthy boundaries, emotional support, conflict resolution, trust issues, relationship dynamics, personal space, assertiveness, counseling options, partner behavior, emotional intelligence, self-care tips, relationship growth, understanding possessiveness, setting limits, mutual respect, love languages"
2032949,"shape perimeter, shape boundary, external shape features, shape outline, geometric exterior, surface of a shape, shape edges, outer dimensions, shape contour, shape outline definition--shape perimeter, shape boundary, shape outline, external shape features, geometric shape exterior, shape surface, shape edges, shape dimensions, shape characteristics, shape properties--shape perimeter, shape boundary, exterior of a shape, shape outline, geometric shape, surface area, shape dimensions, shape characteristics, shape properties, shape edges, shape vertices, shape classification, shape types, shape analysis, visual representation of shapes--perimeter of a shape, shape boundaries, exterior of a geometric figure, outside edges of a shape, shape outline definition, surface area of a shape, geometric shape characteristics, shape properties, outline vs perimeter, visual representation of shapes, shape classification, types of geometric shapes, mathematical shape concepts, shape dimensions, understanding shape outlines--shape perimeter, shape boundary, outer edge, geometric outline, surface area, external dimensions, shape contour, outline characteristics, shape profile, geometric properties"
2032956,"Saturn V cost, Saturn V price, Saturn V budget, Apollo program expenses, Saturn V development cost, Saturn V historical cost, NASA Saturn V funding, Saturn V launch cost, Saturn V financial analysis, Saturn V inflation adjustment, Apollo missions budget, space launch vehicle costs, Saturn V comparison with other rockets, Saturn V economic impact, Saturn V manufacturing cost.--Saturn V cost, Saturn V price, Saturn V budget, Saturn V expenses, Saturn V funding, Apollo program costs, NASA Saturn V expenditure, Saturn V historical cost, Saturn V launch price, Saturn V financial analysis, Saturn V development cost, Saturn V mission expenses, Saturn V inflation-adjusted cost, Saturn V total cost, Saturn V construction cost--Saturn V cost, Saturn V price, Saturn V budget, Apollo program expenses, Saturn V launch cost, NASA Saturn V funding, Saturn V historical cost, Saturn V development expenses, Saturn V financial analysis, Saturn V inflation adjusted cost--cost of Saturn V, Saturn V price history, Saturn V development cost, Saturn V launch expenses, Saturn V budget breakdown, Saturn V inflation adjusted cost, Saturn V financial analysis, Saturn V total expenditure, NASA Saturn V funding, Saturn V economic impact, Saturn V historical cost comparison, Saturn V mission costs, Saturn V investment value, Saturn V pricing in today's dollars, Saturn V manufacturing costs--Saturn V cost, Saturn V price, Saturn V expenses, Apollo program budget, NASA Saturn V, Saturn V launch cost, historical rocket costs, space program funding, Apollo missions expenses, Saturn V development cost"
2033232,"exile, immigration, asylum seekers, political refugees, Trump administration, anti-Trump activists, expatriates, political dissent, persecution, human rights, migration, sanctuary, safe haven, displacement, political asylum, resistance, dissidents, social justice, activism, border crossing--immigrants, asylum seekers, political refugees, Trump administration, expatriates, political dissent, migration, anti-Trump activists, emigration, citizenship, visa status, political climate, social justice, human rights, border policies, international law, safety concerns, political persecution, activism, diaspora--immigration, exile, asylum, political refugees, Trump administration, US politics, expatriates, dissenters, anti-Trump activists, migration, political climate, social justice, human rights, international relocation, dissent, political asylum, activism, diaspora, protest, civil liberties--people fleeing US Trump policies, Americans expatriating Trump administration, political asylum Trump era, US citizens leaving Trump presidency, emigration due to Trump, Trump refugee stories, anti-Trump expatriates, impact of Trump on immigration, Americans abroad during Trump, reasons for leaving US Trump, Trump administration backlash, political dissenters under Trump, US citizens in exile Trump, seeking refuge from Trump policies, international response to Trump emigration--immigration, asylum seekers, political refugees, Trump administration, expatriates, political dissent, anti-Trump activists, U.S. emigration, political climate, international relocation, social justice, civil rights, dissenting voices, political asylum, migration trends, Trump policies, global migration, human rights, activism, expatriate communities"
2033396,"unresponsiveness definition, unresponsiveness causes, unresponsiveness symptoms, unresponsiveness treatment, unresponsiveness examples, unresponsiveness in psychology, unresponsiveness in communication, unresponsive behavior, unresponsiveness in medical terms, unresponsiveness assessment, unresponsiveness interventions, unresponsiveness diagnosis, unresponsiveness context, unresponsiveness implications, unresponsiveness case studies--unresponsiveness definition, unresponsiveness causes, unresponsiveness symptoms, unresponsiveness treatment, unresponsiveness types, unresponsiveness examples, unresponsiveness in psychology, unresponsiveness in medicine, unresponsive behavior, unresponsiveness assessment, unresponsiveness diagnosis, unresponsiveness intervention, unresponsiveness in children, unresponsiveness in adults, unresponsiveness meaning--unresponsiveness definition, causes of unresponsiveness, symptoms of unresponsiveness, unresponsiveness treatment, unresponsive behavior, medical unresponsiveness, psychological unresponsiveness, unresponsiveness in children, unresponsiveness in adults, unresponsiveness examples, unresponsiveness assessment, unresponsiveness diagnosis, unresponsiveness recovery, unresponsiveness intervention, unresponsiveness and communication--unresponsiveness definition, causes of unresponsiveness, symptoms of unresponsiveness, unresponsiveness in psychology, unresponsiveness in communication, unresponsiveness in relationships, treating unresponsiveness, unresponsiveness in children, unresponsiveness in adults, unresponsiveness in emergencies, unresponsiveness in technology, unresponsiveness vs. apathy, unresponsiveness assessment, unresponsiveness examples, unresponsiveness interventions--unresponsiveness definition, causes of unresponsiveness, symptoms of unresponsiveness, unresponsiveness treatment, unresponsive behavior, unresponsiveness in communication, psychological unresponsiveness, medical unresponsiveness, unresponsiveness examples, unresponsiveness in relationships, coping with unresponsiveness, unresponsiveness assessment, unresponsiveness interventions, unresponsiveness in children, unresponsiveness in adults, unresponsiveness and mental health, unresponsiveness in social situations, unresponsiveness diagnosis, unresponsiveness solutions, unresponsiveness consequences"
2033470,"Homosassa, Spring Hill, Brooksville, Tampa, Clearwater, Hernando Beach, Inverness, Citrus Springs, Tarpon Springs, Land O' Lakes, Dade City, New Port Richey, Pasco County, Nature Coast, Gulf Coast--nearby cities, towns near Weeki Wachee, attractions near Weeki Wachee Springs, Weeki Wachee Springs area, cities close to Weeki Wachee, places to visit near Weeki Wachee, Weeki Wachee Springs nearby attractions, surrounding cities, local attractions Weeki Wachee, Weeki Wachee Springs travel guide--Homosassa, Spring Hill, Brooksville, Tarpon Springs, Crystal River, Weeki Wachee, Nature Coast, Hernando County, Gulf Coast, Florida attractions, nearby towns, outdoor activities, water parks, wildlife parks, kayaking, hiking trails, tourist destinations, family-friendly activities, camping sites, scenic drives.--nearby cities, towns close to Weeki Wachee, attractions near Weeki Wachee Springs, cities within driving distance, best places to visit near Weeki Wachee, communities around Weeki Wachee Springs, nearby attractions, Florida cities near Weeki Wachee, local towns, places to stay near Weeki Wachee, travel destinations near Weeki Wachee, scenic spots near Weeki Wachee Springs, outdoor activities near Weeki Wachee, restaurants near Weeki Wachee Springs, hotels close to Weeki Wachee, parks near Weeki Wachee Springs, events near Weeki Wachee, family-friendly activities near Weeki Wachee.--towns, attractions, parks, activities, accommodations, travel, nature, recreation, wildlife, tourism, nearby, locations, map, directions, events, restaurants, lodging, hiking, kayaking, springs, water activities, scenic, family-friendly, day trips, local guides, eco-tourism, Florida"
